title;description;content;url;image;publishedAt;source;Texto
Pequim x Jack Ma: Por que os dias de glória dos gigantes da tecnologia na China chegaram ao fim?;Novas ações regulatórias do governo chinês ressaltam fragilidade de grandes empresas do setor, que foram do estímulo à perseguição;PEQUIM — Ainda não são claras todas as implicações dos movimentos feitos pelo governo da China contra o império do bilionário Jack Ma nos últimos dias, mas uma coisa já está clara: os dias de glória para os gigantes de tecnologia da China acabaram. A... [5224 chars];https://oglobo.globo.com/economia/pequim-jack-ma-por-que-os-dias-de-gloria-dos-gigantes-da-tecnologia-na-china-chegaram-ao-fim-24970361;https://ogimg.infoglobo.com.br/in/24971912-78b-8df/FT1086A/92399878_FILE-PHOTO-Jack-Ma-founder-and-executive-chairman-of-Chinas-Alibaba-Group-speaks-in-front.jpg;2021-04-15T10:30:00Z;O Globo;"PEQUIM — Ainda não são claras todas as implicações dos movimentos feitos pelo governo da China contra o império do bilionário Jack Ma nos últimos dias, mas uma coisa já está clara: os dias de glória para os gigantes de tecnologia da China acabaram. A lua de mel acabou.
PEQUIM — Ainda não são claras todas as implicações dos movimentos feitos pelo governo da China contra o império do bilionário Jack Ma nos últimos dias, mas uma coisa já está clara: os dias de glória para os gigantes de tecnologia da China acabaram. A lua de mel acabou.
Pequim imprimiu toda a sua autoridade de forma implacável na indústria de tecnologia do país no período de alguns dias. Em anúncios marcantes, impôs uma multa recorde de US $ 2,8 bilhões ao Alibaba Group, de Jack Ma, por abuso de seu domínio de mercado.
Pequim x Aliexpress:  Entenda a disputa e o que está em jogo
Em seguida, ordenou uma revisão do Ant Group Co. Na terça-feira, reguladores convocaram 34 das maiores empresas do país, da Tencent Holdings Ltd. ao grupo proprietário do TikTok, o ByteDance Ltd., avisando-as de que ""a linha vermelha das leis não pode ser ultrapassada"".
A mensagem não dita para Ma e seus colegas do ramo foi a de que a década de expansão irrestrita estimulada pelo governo chinês, que criou desafiantes ao Facebook Inc. e o Google, está no fim.
Foram-se os dias em que gigantes como Alibaba, Ant ou Tencent poderiam passar por cima de empresas adjacentes com seu poder financeiro superior e acumuladores de dados.
- Entre as regras para a Ant e a multa de US$ 2,8 bilhões para o Alibaba, os dias dourados acabaram para as grandes empresas de tecnologia da China - disse Mark Tanner, fundador da China Skinny, com sede em Xangai.
Entenda:  Por que a China se voltou contra o fundador do Alibaba
É provável que as empresas de tecnologia se movam com muito mais cautela em aquisições, compensem em excesso a obtenção de aprovações de Pequim, e cobrem taxas mais baixas no tráfego doméstico de internet que dominam.
A Ant, em particular, terá que encontrar maneiras de desvincular o maior serviço de pagamentos da China de seu negócio de crédito ao consumidor em rápido crescimento e diminuir seu fundo de mercado financeiro de assinatura Yu'ebao - que já foi o maior do mundo.
Riqueza:  Os oito bilionários mais ricos do mundo já têm juntos fortuna superior a US$ 1 trilhão
Mesmo as empresas que foram menos monitoradas até agora - como Tencent ou Meituan e Pinduoduo Inc. - provavelmente verão as oportunidades de crescimento reduzidas.
No início da última década, empreendedores visionários como Ma e o cofundador da Tencent criaram impérios de bilhões de dólares por negócios em expansão, do varejo às comunicações, servindo como modelos a seguir para uma geração mais jovem cada vez mais rica na China.
Mas as enormes oportunidades, juntamente com anos de hipercrescimento, também fomentaram uma mentalidade de excesso de concentração no setor de tecnologia, que irritou o Partido Comunista.
Os reguladores ficaram preocupados à medida que empresas como Alibaba e Tencent protegiam e ampliavam agressivamente seus domínios, usando dados para expulsar rivais ou forçando comerciantes e editores de conteúdo a acordos exclusivos.
Conheça: O ‘lobo solitário’ que destronou Jack Ma no ranking de bilionários da China com fortuna de US$ 58 bi
Sua influência crescente sobre todos os aspectos da vida chinesa tornou-se mais aparente à medida que se tornaram os canais pelos quais muitos dos 1,3 bilhão do país compram e pagam por coisas - entregando grandes quantidades de dados sobre o comportamento de gastos.
Os principais entre eles foram Alibaba e Tencent, que se tornaram os grandes criadores da indústria, investindo bilhões de dólares em centenas de start-ups.
Tudo isso veio à tona em 2020, quando Ma - prestes a inaugurar o IPO (oferta inicial de ações) recorde de US$ 35 bilhões da Ant - desdenhou publicamente os reguladores fora de contato e os ""velhos"" do poderoso setor bancário.
A série sem precedentes de ações regulatórias desde então resume como Pequim agora pretende controlar seus gigantes da internet e fintechs. Uma ampla campanha consumiu cerca de US$ 200 bilhões do valor de mercado do Alibaba desde outubro do ano passado.
A rápida capitulação do gigante do comércio eletrônico após uma investigação de quatro meses ressalta a sua vulnerabilidade às novas ações regulatórias.
Saiba mais: China endurece regras antimonopólio mirando gigantes de tecnologia
Outros titãs chineses são os próximos na mira por também serem dominantes em seus campos. Os reguladores podem se concentrar na prática histórica de exclusividade forçada da gigante de entregas Meituan.
E já investigam o serviço de jogos dominante da Tencent e se sua plataforma de mensagens WeChat exclui concorrentes. É o que apontaram analistas do Credit Suisse na última terça-feira.
Oferta de ações: IPO do braço financeiro do Alibaba é suspenso em Xangai e em Hong Kong, e Jack Ma perde US$ 3 bi
 - Os dias de expansão imprudente e crescimento selvagem se foram para sempre e, a partir de agora, o desenvolvimento dessas empresas provavelmente será colocado sob estrito controle do governo. Esse será o caso em um futuro previsível - diz Shen Meng, diretor do banco de investimento boutique Chanson & Co., com sede em Pequim“.
O Globo, um jornal nacional: Fique por dentro da evolução do jornal mais lido do Brasil

Os comentários são de responsabilidade exclusiva de seus autores e não
representam a opinião deste site. Se achar algo que viole os termos de
uso, denuncie. Leia as perguntas mais frequentes para saber o que é
impróprio ou ilegal


© 1996 - 2021. Todos direitos reservados a Editora Globo S/A. Este material não pode ser publicado, transmitido por broadcast, reescrito ou redistribuído sem autorização.

"
Positivo anuncia licenciamento e incorporação das operações da Compaq no Brasil;Por Paula Arend Laier (Reuters) - A Positivo Tecnologia comunicou na noite de quarta-feira acordo para licenciamento e incorporação das operações da marca de computadores Compaq em território brasileiro, sem divulg;"Por Paula Arend Laier
(Reuters) - A Positivo Tecnologia comunicou na noite de quarta-feira acordo para licenciamento e incorporação das operações da marca de computadores Compaq em território brasileiro, sem divulgar os valores do negócio.
""A companh... [422 chars]";https://economia.uol.com.br/noticias/reuters/2021/04/15/positivo-anuncia-licenciamento-e-incorporacao-das-operacoes-da-compaq-no-brasil.htm;https://conteudo.imguol.com.br/c/interacao/facebook/uol-economia.png;2021-04-15T03:00:00Z;UOL;"15/04/2021 09h01 
15/04/2021 09h01 
Por Paula Arend Laier
(Reuters) - A Positivo Tecnologia comunicou na noite de quarta-feira acordo para licenciamento e incorporação das operações da marca de computadores Compaq em território brasileiro, sem divulgar os valores do negócio.
""A companhia vai fabricar e comercializar modelos de notebooks, desktops e all-in-one Compaq, marca da HP Inc., empresa resultante da fusão entre a Compaq Computer Corporation (CPQ) e a Hewlett-Packard Company (HP)"", detalhou. 
Na quarta-feira, antes da divulgação do fato relevante à Comissão de Valores Mobiliários (CVM), as ações da Positivo fecharam em alta de 16,39%, a 10,51 reais, entre as maiores altas da bolsa nesta sessão.
"
São Paulo bate Guarani e vence a terceira em maratona pelo Paulista;Últimas Notícias: acompanhe tudo que acontece no Brasil e no mundo. Fique atualizado nos principais assuntos em Política, Economia, Tecnologia e mais.;O São Paulo chegou à terceira vitória em três jogos realizados em cinco dias. Nesta quarta-feira (14), o Tricolor superou o Guarani por 3 a 2 no Morumbi, em partida antecipada da nona rodada do Campeonato Paulista. A equipe da capital foi a 16 pontos... [2145 chars];https://noticias.uol.com.br/ultimas-noticias/agencia-brasil/2021/04/15/sao-paulo-bate-guarani-e-vence-a-terceira-em-maratona-pelo-paulista.htm;https://conteudo.imguol.com.br/c/interacao/facebook/uol-noticias-600px.jpg;2021-04-15T03:00:00Z;UOL;"15/04/2021 00h23 
15/04/2021 00h23 
O São Paulo chegou à terceira vitória em três jogos realizados em cinco dias. Nesta quarta-feira (14), o Tricolor superou o Guarani por 3 a 2 no Morumbi, em partida antecipada da nona rodada do Campeonato Paulista. A equipe da capital foi a 16 pontos, liderando o Grupo B, com a melhor campanha geral. O Bugre, com cinco pontos, é o terceiro colocado do Grupo D, o mesmo do Santos. 
Fim de jogo! #SPFCxGUA (3-2)? Welington? Igor Gomes? V. Bueno#VamosSãoPaulo ?? pic.twitter.com/yO47gGxuE0
Com a paralisação do Estadual por duas semanas, no período em que o Estado esteve na Fase Emergencial, a mais rígida no enfrentamento à pandemia do novo coronavírus (covid-19), a Federação Paulista de Futebol (FPF) tem acelerado a remarcação dos jogos de clubes envolvidos em torneios nacionais e internacionais no primeiro semestre. A maratona do São Paulo, que disputa a Libertadores, teve início no sábado (10), com a goleada por 5 a 1 sobre o São Caetano. Na terça-feira (12), o Tricolor derrotou o Red Bull Bragantino por 1 a 0.
Com um time misto em campo, repleto de jogadores formados na base entre os titulares (oito), o São Paulo começou pressionado pelo Guarani, que abriu o placar aos nove minutos, em uma bomba do lateral Airton. Aos 13, o meia Régis quase surpreendeu o goleiro Lucas Perri, acertando o travessão no escanteio. Aos poucos, o Tricolor foi se encontrando e criou lances de perigo, com o meia Martín Benítez e o atacante Vitor Bueno. Aos 44, enfim, o lateral Wellington aproveitou rebote de uma cabeçada de Benítez e empatou o jogo.
Primeiro gol pelo profissional ??Atuação excelente ??Vibra, Welington! ?#MadeInCotia#VamosSãoPaulo ?? pic.twitter.com/UXcJOmzcSn
A virada veio logo aos quatro minutos, em contra-ataque bem trabalhado, que culminou em cruzamento do atacante Galeano e gol do meia Igor Gomes, que bateu de primeira, na área. Aos 25, porém, a defesa tricolor bobeou após passe rasteiro de Davó, que o também atacante Bruno Sávio concluiu para as redes, deixando tudo igual.
Aos 34 minutos, Vitor Bueno perdeu grande chance na sequência de um cruzamento do também atacante Eder pela direita, batendo por cima, de frente para o goleiro Gabriel. Quatro minutos depois, o camisa 12 se redimiu ao ser lançado por Galeano e finalizar na saída do arqueiro do Guarani, garantindo a vitória ao São Paulo no Morumbi.
O Tricolor dá sequência à maratona pelo Paulistão na sexta-feira (16), às 22h (horário de Brasília), no Allianz Parque, contra o rival Palmeiras. O Guarani volta a campo na terça-feira (20), contra a Ferroviária, na Arena da Fonte Luminosa, em Araraquara (SP), em horário que ainda será definido.

                Tanques e tropas russas mais uma vez colocaram o leste da Ucrânia em alerta máximo.

              Por Pedro Fonseca
São Paulo - A Merck e sua parceira Ridgeback Therapeutics anunciaram nesta quinta-feira que vão interromper testes 
Islamabad, 15 Abr 2021 (AFP) - A embaixada da França no Paquistão recomendou nesta quinta-feira (15) a seus...
Paris, 15 Abr 2021 (AFP) - A um ano das eleições presidenciais na França, uma nova geração de jovens desencantada...
Paris, 15 Abr 2021 (AFP) - A um ano das eleições presidenciais na França, uma nova geração de jovens desencantada...
"
Palmeiras cai outra vez nos pênaltis e Defensa conquista a Recopa;Últimas Notícias: acompanhe tudo que acontece no Brasil e no mundo. Fique atualizado nos principais assuntos em Política, Economia, Tecnologia e mais.;Três dias após perder a Supercopa do Brasil para o Flamengo, o Palmeiras voltou a deixar escapar um título nos pênaltis, e novamente em Brasília. Nesta quarta-feira (14), no Mané Garrincha, o Verdão foi superado pelo Defensa y Justicia (Argentina) na... [3801 chars];https://noticias.uol.com.br/ultimas-noticias/agencia-brasil/2021/04/15/palmeiras-cai-outra-vez-nos-penaltis-e-defensa-conquista-a-recopa.htm;https://conteudo.imguol.com.br/c/interacao/facebook/uol-noticias-600px.jpg;2021-04-15T03:00:00Z;UOL;"15/04/2021 00h59 
15/04/2021 00h59 
Três dias após perder a Supercopa do Brasil para o Flamengo, o Palmeiras voltou a deixar escapar um título nos pênaltis, e novamente em Brasília. Nesta quarta-feira (14), no Mané Garrincha, o Verdão foi superado pelo Defensa y Justicia (Argentina) nas penalidades, por 4 a 3, após ser derrotado por 2 a 1 no tempo normal. 
?? ¡A lo grande! @ClubDefensayJus es campeón de la CONMEBOL #Recopa al vencer a @Palmeiras en Brasil.?? Es el segundo título internacional de su historia. pic.twitter.com/R9WyAM8UI8
Há uma semana, o time paulista venceu o jogo de ida por 2 a 1 no estádio Norberto ""Tito"" Tomaghello, em Florencio Varela (Argentina). Até os 47 minutos do segundo tempo desta quarta, a partida na capital federal estava empatada em 1 a 1, resultado que dava o título à equipe alviverde. Uma bomba indefensável do lateral Marcelo Benítez, porém, decretou a vitória do Defensa e levou o duelo para a prorrogação. Nos pênaltis, o atacante Luís Adriano e o goleiro Weverton desperdiçaram as cobranças, enquanto o time argentino teve aproveitamento perfeito.
Em desvantagem no placar agregado, o Defensa teve a iniciativa do ataque com jogadas de linha de fundo, dando trabalho à dupla de laterais do Palmeiras. Faltou, porém, capricho nas conclusões do atacante Walter Bou (que furou a bola dentro da área) e do meia Francisco Pizzini (que perdeu a chance após rebote de Weverton, chutando para fora).
Quem acabou balançando as redes foi o Verdão. Aos 18 minutos, o zagueiro Fernando Meza fez a carga no atacante Rony dentro da área e a penalidade foi marcada com participação do árbitro de vídeo (VAR). O meia Raphael Veiga cobrou e abriu o placar. A vantagem alviverde, porém, durou 12 minutos. O atacante Braian Romero recebeu cruzamento por baixo de Pizzini, que dominou às costas do zagueiro Gustavo Gómez, e bateu de primeira para deixar tudo igual. Aos 36, Weverton evitou a virada duas vezes em sequência, em finalizações de Romero e Benítez.
O segundo tempo começou equilibrado, com a primeira boa chance do Defensa. Aos seis minutos, Romero recebeu (mais uma vez) de Pizzini e foi travado frente a frente com Weverton. Aos dez, Benítez quase surpreendeu o goleiro palmeirense, que evitou o gol olímpico. O Verdão respondeu aos 15, com Rony chutando da entrada da área, obrigando o goleiro Ezequiel Unsain a uma boa defesa.
O jogo ficou dramático para o Palmeiras aos 20 minutos, quando Matías Viña foi expulso após o VAR (árbitro de vídeo) identificar um chute do lateral em Meza. Com um a menos, o Verdão teve a chance de liquidar a fatura aos 33, mas a finalização de bico do atacante Gabriel Veron foi defendida por Unsain. O Defensa foi com tudo para o ataque e, nos acréscimos, Benítez aproveitou a sobra de uma bola e soltou a bomba, indefensável para Weverton, deixando tudo igual e forçando a prorrogação.
?? Prorrogação! Com um gol incrível no fim, o @ClubDefensayJus venceu o @Palmeiras por 2-1 no tempo normal.???? ¡A la prórroga! Con un gol increíble en el final, @ClubDefensayJus derrotó 2-1 a @Palmeiras en los 90 minutos.? CONMEBOL #Recopa 2021 pic.twitter.com/0EPVzTmPUW
O tempo extra começou agitado. Aos dois minutos, o Defensa reclamou de pênalti não marcado de Gómez no atacante Miguel Merentiel. Aos quatro, foi a vez de Rony cair na área em dividida com Unsain. A arbitragem mandou o jogo seguir, mas, alertada pelo VAR, assinalou a penalidade do goleiro. A marcação gerou muita confusão entre jogadores e as comissões técnicas. Romero foi expulso, deixando o time argentino também com dez em campo. Gómez, porém, desperdiçou a penalidade, defendida por Unsain.
O desenrolar da prorrogação escancarou o desgaste de ambas as equipes, que pouco conseguiram produzir. A decisão acabou indo para os pênaltis. Pior para o Verdão. Luís Adriano, que entrou no tempo extra, perdeu a segunda cobrança, enquanto Weverton desperdiçou o quarto chute e decidiu o título a favor dos argentinos, que assinalaram as quatro batidas.
??? ¡Un Halcón entre los campeones de la CONMEBOL #Recopa! ??? @ClubDefensayJus se une a la lista y ya son 1?9? equipos los que consiguieron el título. pic.twitter.com/63Ivjz2JrZ
Confirmada pelo STF, comissão de inquérito vai atrás de detalhes administrativos para mostrar descaso da equipe de 
Dois suspeitos de envolvimento na morte do chefe regional do Instituto Água e Terra (IAT) em Paranavaí, no norte...
Nesta quarta-feira (14), a Polícia Militar de Apucarana foi acionada por volta das 17 horas em um estabelecimento...
"
Drone dispara foguete contra aeroporto no Curdistão iraquiano;Últimas Notícias: acompanhe tudo que acontece no Brasil e no mundo. Fique atualizado nos principais assuntos em Política, Economia, Tecnologia e mais.;Erbil, Iraque, 15 Abr 2021 (AFP) - O aeroporto de Erbil, capital do Curdistão iraquiano, foi alvo nesta quarta-feira de um ataque com drone, segundo autoridades curdas, em uma escalada sem precedentes das armas usadas para atacar os soldados american... [2494 chars];https://noticias.uol.com.br/ultimas-noticias/afp/2021/04/15/drone-dispara-foguete-contra-aeroporto-no-curdistao-iraquiano.htm;https://conteudo.imguol.com.br/c/interacao/facebook/uol-noticias-600px.jpg;2021-04-15T03:00:00Z;UOL;"15/04/2021 00h10 
15/04/2021 00h10 
Erbil, Iraque, 15 Abr 2021 (AFP) - O aeroporto de Erbil, capital do Curdistão iraquiano, foi alvo nesta quarta-feira de um ataque com drone, segundo autoridades curdas, em uma escalada sem precedentes das armas usadas para atacar os soldados americanos posicionados no local.
A explosão, ouvida em vários pontos da cidade, não teve a autoria reivindicada formalmente, mas, assim como ocorreu em fevereiro, quando foguetes mataram em Erbil um subcontratante estrangeiro da coalizão antijihadista liderada pelos Estados Unidos e um iraquiano, o grupo Guardiões do Sangue se manifestou. Ele é formado por facções pró-Irã que atuam há anos no Iraque, e aplaudiu a explosão em Erbil.
À noite, um cordão de segurança bloqueava todos os acessos ao aeroporto, afirmaram testemunhas. O governador assegurou que os voos não foram interrompidos.
""Indignado com as informações de ataques na região do Curdistão iraquiano"", reagiu no Twitter o porta-voz do Departamento de Estado americano, Ned Price. ""O povo iraquiano já sofreu por tempo demais com esse tipo de violência e violação de sua soberania.""
- 'Escalada perigosa' -
O Ministério do Interior do Curdistão afirmou que ""um drone carregado com TNT"" havia atacado ""o quartel-general da coalizão no aeroporto de Erbil"". Hoshyar Zebari, ex-ministro iraquiano de Assuntos Exteriores e figura política do Curdistão, acusou no Twitter ""uma milícia"" de estar por trás desse ataque ""terrorista com foguetes e drones"", referindo-se às facções pró-Irã atuantes no país.
Os pró-Irã multiplicam as declarações de guerra, prometendo forçar a saída do ""ocupante"" americano, como pediu em votação o Parlamento em Bagdá há mais de um ano. 
Uma fonte da segurança iraquiana informou à AFP que foguetes caíram em outros lugares, um deles tendo como alvo as tropas turcas, posicionadas há 25 anos em uma dezena de bases no Curdistão, principalmente para lutar contra o Partido dos Trabalhadores do Curdistão, que a Turquia classifica de terrorista. Um soldado turco morreu em Baachiqa, informou o Ministério da Defesa daquele país.
Desde que Joe Biden assumiu a presidência americana, em janeiro, bases que abrigam soldados do país ou representações diplomáticas americanas foram alvo de cerca de 20 ataques com bombas ou foguetes. Antes disso, desde o outono de 2019, houve dezenas.
Há uma semana, Washington retomou o ""diálogo estratégico"" com o governo iraquiano de Mustafah al-Kazimi, ameaçado por apoiadores do Irã. Estados Unidos e Irã estão presentes ou têm aliados no Iraque, onde Washington mantém cerca de 2,5 mil militares.
Os ataques no Iraque representam um desafio para Biden, no momento em que ele abre as portas para retomar as negociações com Teerã sobre seu programa nuclear. 
str-sbh/mdz/mis/jz/mvv/lb
"
Cruzeiro supera América-RN e avança na Copa do Brasil;Últimas Notícias: acompanhe tudo que acontece no Brasil e no mundo. Fique atualizado nos principais assuntos em Política, Economia, Tecnologia e mais.;"O Cruzeiro foi até a Arena das Dunas, em Natal, nesta quarta-feira (14), e derrotou o América-RN por 1 a 0 para se classificar para a terceira fase da Copa do Brasil, para a qual também avançaram o ABC e o América-MG.
Jogando fora de casa, a Raposa s... [1824 chars]";https://noticias.uol.com.br/ultimas-noticias/agencia-brasil/2021/04/15/cruzeiro-supera-america-rn-e-avanca-na-copa-do-brasil.htm;https://conteudo.imguol.com.br/c/interacao/facebook/uol-noticias-600px.jpg;2021-04-15T03:00:00Z;UOL;"15/04/2021 00h02 
15/04/2021 00h02 
O Cruzeiro foi até a Arena das Dunas, em Natal, nesta quarta-feira (14), e derrotou o América-RN por 1 a 0 para se classificar para a terceira fase da Copa do Brasil, para a qual também avançaram o ABC e o América-MG. 
SEGUIMOS EM FRENTE NA @COPADOBRASIL! ??AMÉRICA-RN 0 x 1 CRUZEIRO?#AMExCRU | #OMaiorCampeão pic.twitter.com/z9h391c3lL
Jogando fora de casa, a Raposa sofreu muito para garantir a classificação. O único gol da Raposa saiu apenas no segundo tempo. Aos 37 minutos, Matheus Barbosa marca, com um chute colocado, após receber passe de Felipe Augusto.
O Botafogo se despediu da Copa do Brasil após ser derrotado por 4 a 1 pelo ABC na disputa de pênaltis depois de empate em 1 a 1 nos 90 minutos em jogo disputado no estádio Frasqueirão, em Natal (RN). A Rádio Nacional transmitiu a partida.
CLASSIFICADO!!! CLASSIFICADO!!! CLASSIFICADO!!!O Mais Querido fez 4 a 1 nos pênaltis e está garantido na 3ª fase da Copa do Brasil!!! pic.twitter.com/CdefjAfE1U
Em um jogo de baixa qualidade técnica, O Mais Querido abriu o marcador graças a Maycon Douglas. Logo aos 10 minutos, o atacante ganhou disputa de bola com a defesa do Alvinegro e acerta um belo chute. Depois, o Botafogo tentou muito, e só encontrou a igualdade nos acréscimos do segundo tempo com gol de cabeça do zagueiro Gilvan.
Na disputa de pênaltis o ABC foi mais competente. O Mais Querido acertou todas as suas cobranças, enquanto, pelo Botafogo, Cesinha chutou para fora e Marcinho teve a cobrança defendida pelo goleiro Wellington.
Quem se classificou nesta quarta foi o América-MG, que superou o Ferroviário por 3 a 2 na disputa de pênaltis, após empate em 1 a 1 no tempo regulamentar. Nos 90 minutos, o Coelho abriu o placar com Felipe Azevedo, mas o time cearense empatou com Augusto.
CLASSIFICADOS!!!!!! ???NOS PÊNALTIS, O #COELHÃO LEVA A MELHOR E ESTÁ CLASSIFICADO PARA A FASE 3 DA @COPADOBRASIL!!!!!VAMOOOOOOOOS!!!!! ???#AFCxFAC | (3) 1x1 (2)#CoelhãoSérieA#PraCimaDelesCoelho #SomosSparta pic.twitter.com/d2oxFhOjXp
Com isto, a decisão foi para os pênaltis. E na disputa na marca da cal o América-MG foi mais efetivo, e triunfou por 3 a 2.
Pela classificação, Cruzeiro, ABC e América-MG asseguraram uma premiação de R$ 1,7 milhão cada. Os próximos adversários na competição serão definidos em sorteio realizado pela Confederação Brasileira de Futebol (CBF).
Confirmada pelo STF, comissão de inquérito vai atrás de detalhes administrativos para mostrar descaso da equipe de 
"
