title;description;content;url;image;publishedAt;source;Texto
Covid-19: com alta de casos, Japão não descarta cancelamento das Olimpíadas;Últimas Notícias: acompanhe tudo que acontece no Brasil e no mundo. Fique atualizado nos principais assuntos em Política, Economia, Tecnologia e mais.;"O secretário-geral do Partido Liberal Democrata,Toshihiro Nikai, não descartou, nesta quarta-feira (14) a hipótese de cancelar a Olímpiada em último caso, diante do aumento de contaminações da Covid-19 no país.
O secretário-geral do Partido Liberal D... [2603 chars]";https://noticias.uol.com.br/ultimas-noticias/rfi/2021/04/15/covid-19-com-alta-de-casos-japao-nao-descarta-cancelamento-das-olimpiadas.htm;https://conteudo.imguol.com.br/c/interacao/facebook/uol-noticias-600px.jpg;2021-04-15T03:00:00Z;UOL;"15/04/2021 04h30 
15/04/2021 04h30 

O secretário-geral do Partido Liberal Democrata,Toshihiro Nikai, não descartou, nesta quarta-feira (14) a hipótese de cancelar a Olímpiada em último caso, diante do aumento de contaminações da Covid-19 no país. 

O secretário-geral do Partido Liberal Democrata,Toshihiro Nikai, não descartou, nesta quarta-feira (14) a hipótese de cancelar a Olímpiada em último caso, diante do aumento de contaminações da Covid-19 no país. 
""Se não for possível organizar os Jogos, devemos cancelá-los sem hesitar"", disse Nikai ao canal de TV TBS, nesta quinta-feira (15). ""Se as Olímpiadas contribuírem para o aumento das infecções, não sei para que elas servem"", acrescentou. 
O representante do governo japonês disse, entretanto, que o país espera que a Olímpiada, que teoricamente começam em 100 dias, sejam um sucesso. Um pouco mais tarde, um representante do partido, citado pela agência Jiji, que não quis se identificar, afirmou que o evento não será cancelado.
A cerimônia de abertura dos Jogos Olímpicos está prevista para o dia 23 de julho. O evento, que termina em 8 de agosto, já havia sido adiado em 2020 por conta da pandemia. 
O país enfrenta uma quarta onda de contaminações, o que levou as autoridades a impor novas restrições em diversas regiões, incluindo Tóquio. Nesta quarta-feira, foram registrados 4.000 novos casos, o que não ocorria desde janeiro. A vacinação é lenta, e apenas 1,1 dos 126 milhões habitantes receberam uma dose.
A nova onda epidêmica também atrapalha o calendário das competições de qualificação para os Jogos, assim como a volta da tocha olímpica, que teve início em 25 de março.
A cidade de Matsuyama, no oeste do país, anunciou nesta quarta-feira, por exemplo, que cancelaria a etapa para evitar aglomerações. A região de Osaka também preferiu, na semana passada, fazer a passagem da tocha em um parque fechado ao público.
A população japonesa se opõe à realização dos Jogos Olímpicos de Tóquio nesse verão por conta das restrições sanitárias, de acordo com pesquisas realizadas nos últimos meses.
Por precaução, e pela primeira vez na história, os organizadores japoneses e o Comitê Olímpico Internacional decidiram que o evento não receberá espectadores estrangeiros.
Comitê descarta adiamento
Profissionais da saúde alertaram para o risco ligado à organização dos Jogos Olímpicos no contexto epidêmico. Nesta semana, quatro especialistas pediram em um artigo no jornal científico British Medical que a organização do evento ""fosse reavaliada"" de forma urgente. ""Eventos internacionais de massa, como as Olímpiadas, não são seguros"", escreveram.   
O vice-presidente do Comitê Olímpico Internacional, John Coates, descartou nesta quarta-feira um possível cancelamento. ""Estamos prontos, preocupados, a segurança continua sendo nossa prioridade, mas estamos preparados para as piores situações"", declarou.
(Com informações da AFP)
O presidente francês, Emmanuel Macron, visitou nesta quinta-feira (15) os trabalhos de consolidação da catedral de 
A supressão da propriedade intelectual do imunizante é ""uma etapa vital e necessária para acabar com a pandemia"",...
A ex-presidente Dilma Rousseff (PT) foi absolvida nesta quarta-feira (14) pelo TCU (Tribunal de Contas da União)...
Londres, 15 Abr 2021 (AFP) - Os membros da realeza britânica usarão trajes civis no funeral do príncipe Philip...
A morte de duas pessoas da mesma família - mãe e filho -
pela Covid-19, em intervalo de pouco mais de 24 horas,...
A Índia registrou o recorde de 200.000 novos casos de Covid-19 nas últimas 24 horas, de acordo com dados oficiais...
O maior ídolo da história do Santos não deixou o aniversário de 109 anos do clube, nesta quarta-feira, passar...
Kiev, 15 Abr 2021 (AFP) - A Rússia ameaça abertamente de destruição a Ucrânia, afirmou nesta quinta-feira o chefe...
"
Covid-19: Argentina amplia horário de toque de recolher e fecha escolas;Últimas Notícias: acompanhe tudo que acontece no Brasil e no mundo. Fique atualizado nos principais assuntos em Política, Economia, Tecnologia e mais.;O presidente argentino, Alberto Fernández, ampliou em quatro horas o horário do toque de recolher anunciado há uma semana e suspendeu uma série de atividades, incluindo as aulas presenciais, até 30 de abril, com o objetivo de evitar a saturação de ho... [5658 chars];https://noticias.uol.com.br/ultimas-noticias/rfi/2021/04/15/covid-19-argentina-amplia-horario-de-toque-de-recolher-e-fecha-escolas.htm;https://conteudo.imguol.com.br/c/interacao/facebook/uol-noticias-600px.jpg;2021-04-15T03:00:00Z;UOL;"15/04/2021 05h28 
15/04/2021 05h28 

O presidente argentino, Alberto Fernández, ampliou em quatro horas o horário do toque de recolher anunciado há uma semana e suspendeu uma série de atividades, incluindo as aulas presenciais, até 30 de abril, com o objetivo de evitar a saturação de hospitais. O anúncio foi seguido de um forte panelaço em Buenos Aires que avançou pela madrugada desta quinta-feira (15) em frente à residência presidencial. 

O presidente argentino, Alberto Fernández, ampliou em quatro horas o horário do toque de recolher anunciado há uma semana e suspendeu uma série de atividades, incluindo as aulas presenciais, até 30 de abril, com o objetivo de evitar a saturação de hospitais. O anúncio foi seguido de um forte panelaço em Buenos Aires que avançou pela madrugada desta quinta-feira (15) em frente à residência presidencial. 
Márcio Resende, correspondente da RFI em Buenos Aires
""O que tentamos na semana passada foi pouco. Todo o esforço que fizemos até aqui parece insuficiente diante do aumento dos contágios na Argentina. Por isso, decidi que entre as 20h e as 6 horas não será permitido circular pelas ruas"", anunciou Alberto Fernández, em rede nacional de rádio e TV, direto da residência presidencial.
Na semana passada, Fernández já tinha ordenado que bares e restaurantes só funcionassem até as 23h, horário que agora também diminuiu em quatro horas.
""Todas as atividades comerciais só poderão acontecer entre 9h e 19h. As atividades gastronômicas ficarão fechadas em horário noturno. Também suspendi todas as atividades recreativas, sociais, culturais, esportivas e religiosas em lugares fechados"", determinou o presidente, incluindo na lista aquilo que o governo prometeu que seria a última atividade a ser fechada: as escolas.
""Todas essas medidas incluem a suspensão de aulas, durante duas semanas a partir de segunda-feira. Alunos e professores não irão à escola. A educação será virtual, à distância. As demais medidas começaram a valer a partir da zero hora de sexta-feira e até o dia 30 de abril"", detalhou, explicando que as decisões visam dois objetivos: ""não interromper a campanha de vacinação e evitar que o sistema de Saúde fique saturado"".
O anúncio de fechamento das escolas e universidades foi surpresa até mesmo para o ministro da Educação, Nicolás Trotta, que, horas antes, tinha dito que ""as escolas não seriam fechadas"" porque ""são uma prioridade"". Segundo ele, ""nas escolas, o risco de contágio é baixo. A evidência demonstra isso. As escolas não serão fechadas"", garantiu o ministro, depois da experiência de 2020, ano em que não houve aulas presenciais.
Risco de colapso
Na cidade de Buenos Aires, no primeiro mês de aula de 2021, apenas 0,17% de professores e alunos foram contaminados. Entre 17 de março e 12 de abril, os casos continuaram baixos, embora levemente mais altos: 0,71%.
Várias clínicas do sistema de Saúde privado, onde 70% dos argentinos são atendidos, estão próximas da saturação, especialmente na área metropolitana de Buenos Aires. No sistema de Saúde público, a ocupação de leitos de terapia intensiva está em 71,4%.
""Há um mês, tínhamos 45.498 casos de contágios semanais. Na semana passada, 122.468 casos. Nesta semana, a cifra será maior. Isso significa que multiplicamos por mais de dois a quantidade de contágios em apenas um mês"", ilustrou o presidente.
Alberto Fernández ficou isolado até esta quinta-feira isolado por ter contraído coronavírus, mesmo vacinado com as duas doses da russa Sputnik-V. O diagnóstico foi confirmado em 3 de abril. ""Nestes dias que estive longe, monitorei a evolução da pandemia. O vírus está atacando e não cede"", apontou.
Governo quer dividir custo político
As medidas estão destinadas à área metropolitana de Buenos Aires, que abrange a capital argentina, onde vivem três milhões de habitantes, além de outros 40 municípios com mais 13 milhões. No total, 40% da população argentina e metade do PIB do país.
O governo federal esperava que prefeitos e governadores anunciassem medidas como uma forma de dividir o custo político de aplicar medidas de restrição, mas nenhuma autoridade local quis esse desgaste.
""O resto das jurisdições podem aderir às decisões que estou tomando. Espero que os governadores e os prefeitos entendam que devem acompanhar-me neste momento difícil"", avisou Fernández, anunciando também que ""o cumprimento dessas decisões será controlado pelas forças federais"".
Alberto Fernández contou que pediu às Forças Armadas que ajudem no atendimento sanitário. Será a primeira vez, desde o final da ditadura (1976-1983) que o Exército estará nas ruas.
Forte panelaço de protesto
Logo depois dos anúncios, milhares de pessoas começaram com um forte panelaço de protesto na maioria dos bairros de Buenos Aires. As manifestações de repúdio multiplicaram-se ao longo da noite. Primeiro, pelas janelas, mas, depois, pelas ruas. As buzinas dos automóveis também se somaram às panelas.
Em frente à residência presidencial, milhares de pessoas protestaram contra as medidas madrugada adentro, apesar do toque de recolher vigente a partir da meia-noite.
Houve manifestações ainda em frente ao edifício da vice-presidente, Cristina Kirchner. No ano passado, a Argentina manteve a mais prolongada quarentena do mundo com 233 dias de um isolamento que provocou milhares de falências e uma queda de 10% no PIB.
O toque de recolher tem uma simbologia sensível para os argentinos que associam o instrumento aos sombrios tempos da ditadura. Entre 1976 e 1983, quando regeu o recolher no país, o regime militar argentino provocou a maior quantidade de vítimas na região, estimadas em 30 mil mortos pelas organizações de direitos humanos. O assunto é ainda um trauma na sociedade.
Em apenas um ano, a pandemia já deixou na Argentina quase o dobro de mortos: 58.542, sendo 368 nas últimas 24 horas. Com 45 milhões de habitantes, a quantidade acumulada de infecções chega a 2,604 milhões, dos quais 25.157 foram nas últimas 24 horas.
Washington, 15 Abr 2021 (AFP) - O governo dos Estados Unidos anunciou nesta quinta-feira (15) sanções financeiras...

              Por Parisa Hafezi
Caracas, 15 Abr 2021 (AFP) - Crise, hiperinflação, queda do poder aquisitivo, sanções econômicas... a Venezuela,...
"
Caixa paga auxílio emergencial a nascidos em maio;Últimas Notícias: acompanhe tudo que acontece no Brasil e no mundo. Fique atualizado nos principais assuntos em Política, Economia, Tecnologia e mais.;"Trabalhadores informais nascidos em maio começam a receber hoje (15) a nova rodada do auxílio emergencial. O benefício terá parcelas de R$ 150 a R$ 375, dependendo da família.
O pagamento também será feito a inscritos no Cadastro Único de Programas S... [1839 chars]";https://noticias.uol.com.br/ultimas-noticias/agencia-brasil/2021/04/15/caixa-pagaauxilio-emergencial-a-nascidos-em-maio.htm;https://conteudo.imguol.com.br/c/interacao/facebook/uol-noticias-600px.jpg;2021-04-15T03:00:00Z;UOL;"15/04/2021 05h50 
15/04/2021 05h50 
Trabalhadores informais nascidos em maio começam a receber hoje (15) a nova rodada do auxílio emergencial. O benefício terá parcelas de R$ 150 a R$ 375, dependendo da família. 
O pagamento também será feito a inscritos no Cadastro Único de Programas Sociais do Governo Federal (CadÚnico) nascidos nesse mês.
Também hoje, a Caixa Econômica Federal depositará a revisão do auxílio emergencial para 236 mil novos beneficiários nascidos de janeiro a maio incluídos na nova rodada. Essas pessoas haviam sido excluídas por não se enquadrarem no público elegível, mas contestaram o benefício negado e conseguiram reaver o auxílio.
Os nascidos de junho a dezembro reincluídos no auxílio emergencial receberão conforme o calendário de pagamentos divulgado no fim de março. A relação dos incluídos na revisão do auxílio está disponível na página de consultas desenvolvida pela Dataprev, estatal responsável pelo cadastro dos beneficiários.
A primeira parcela será depositada nas contas poupança digitais e poderá ser movimentada pelo aplicativo Caixa Tem. Somente de duas a quatro semanas após o depósito, o dinheiro poderá ser sacado em espécie ou transferido para uma conta corrente.
Ao todo 45,6 milhões de brasileiros serão beneficiados pela nova rodada do auxílio emergencial. O auxílio será pago apenas a quem recebia o benefício em dezembro de 2020. Também é necessário cumprir outros requisitos para ter direito à nova rodada (acesse abaixo link do guia de perguntas e respostas).Para os beneficiários do Bolsa Família, o pagamento ocorre de forma distinta. Os inscritos podem sacar diretamente o dinheiro nos dez últimos dias úteis de cada mês, com base no dígito final do Número de Inscrição Social (NIS). O auxílio emergencial somente será pago quando o valor for superior ao benefício do programa social.
A Agência Brasil elaborou um guia de perguntas e respostas sobre o auxílio emergencial. Entre as dúvidas que o beneficiário pode tirar estão os critérios para receber o benefício, a regularização do CPF e os critérios de desempate dentro da mesma família para ter acesso ao auxílio.
Rio de Janeiro, 15 Abr 2021 (AFP) - A atuação caótica de autoridades brasileiras no enfrentamento da crise do novo 
Morreu nesta quinta-feira (15), o diretor da Rádio Banda B, Michel Micheleto, de 59 anos. Ele estava internado...
O governo deve propor para 2022 uma meta fiscal que permite um rombo próximo de R$ 170 bilhões, segundo apurou o...
"
Bolsonaro é 'grande responsável' por 'desastre' de covid, diz vice-presidente de delegação do Parlamento Europeu para o Brasil;Últimas Notícias: acompanhe tudo que acontece no Brasil e no mundo. Fique atualizado nos principais assuntos em Política, Economia, Tecnologia e mais.;"Alemã Anna Cavazzini, eurodeputada pelo Partido Verde, participa nesta quinta-feira de reunião tendo como pano de fundo a abertura da CPI para investigar a crise do coronavírus no país e os recordes de mortes por covid-19.
Na visão da alemã Anna Cava... [5690 chars]";https://noticias.uol.com.br/ultimas-noticias/bbc/2021/04/15/bolsonaro-e-grande-responsavel-por-desastre-de-covid-diz-vice-presidente-de-delegacao-do-parlamento-europeu-para-o-brasil.htm;https://conteudo.imguol.com.br/c/interacao/facebook/uol-noticias-600px.jpg;2021-04-15T03:00:00Z;UOL;"Luis Barrucho - @luisbarrucho - Da BBC News Brasil em Londres 
Luis Barrucho - @luisbarrucho - Da BBC News Brasil em Londres 
15/04/2021 05h52 

                Alemã Anna Cavazzini, eurodeputada pelo Partido Verde, participa nesta quinta-feira de reunião tendo como pano de fundo a abertura da CPI para investigar a crise do coronavírus no país e os recordes de mortes por covid-19.
            
Na visão da alemã Anna Cavazzini, eurodeputada pelo Partido Verde e vice-presidente da delegação do Parlamento Europeu para assuntos relacionados ao Brasil, o presidente Jair Bolsonaro (sem partido) tem ""grande parcela de responsabilidade"" pela crise sanitária desencadeada pela pandemia de covid-19 no país, que ela descreve como ""um verdadeiro desastre"".
Cavazzini participa de uma reunião de duas horas sobre o Brasil nesta quinta-feira (15/4) marcada no Parlamento Europeu, tendo como pano de fundo a abertura da CPI (Comissão Parlamentar de Inquérito) para investigar a crise do coronavírus no país e os recordes de mortes por covid-19. 
O chefe da Missão do Brasil junto à União Europeia, embaixador Marcos Galvão, foi chamado para participar.
Aludindo a uma expressão em sua língua materna, Cavazzini diz que a situação atual do Brasil é como se o país ""caminhasse rumo ao precipício de olhos bem abertos"".
""Devo dizer que nenhum país é perfeito. Muitos governos estão lutando pelas melhores práticas. Por exemplo, em meu país, a Alemanha, também temos uma discussão muito crítica sobre se o governo está fazendo a coisa certa. Mas acho que a situação no Brasil realmente se destaca"", diz ela, em entrevista à BBC News Brasil por telefone. 
""É um nível completamente diferente de desastre, má gestão governamental, negação política, basicamente é como se o Brasil estivesse ""caminhando rumo ao precipício de olhos bem abertos"", acrescenta.
Segundo Cavazzini, Bolsonaro ""tem grande parcela de responsabilidade pelo número de doentes e mortos porque não levou a doença a sério, incentivou as pessoas a se reunirem em grandes aglomerações, manteve-se cético no início em relação à vacinação e obstruiu os serviços de imunização em cidades e Estados do Brasil"". 
Reuniões como essa não têm implicação prática e são marcadas com antecedência para discutir temas de interesse bilaterais.
Mas Cavazzini diz que, embora o Parlamento Europeu não possa ditar a política externa, ""pode participar nas conversas e influenciar a agenda"" dos Estados membros do bloco.
""Queremos mostrar a solidariedade europeia para com as pessoas que estão lá (Brasil) e gravemente afetadas (pela covid). Claro que também queremos lançar luz também sobre a difícil situação dos direitos humanos no Brasil e principalmente das pessoas que defendem as florestas, que defendem suas terras, que estão ameaçadas e algumas delas infelizmente mortas"", diz.
Cavazzini, que também é membro do comitê parlamentar responsável por assuntos relacionados ao meio ambiente, é uma das principais vozes críticas à política ambiental do governo Bolsonaro, especialmente no tocante ao desmatamento da Amazônia. Ela também se opõe ao acordo entre a União Europeia e o Mercosul (ainda em fase de revisão jurídica).
""Em geral, é claro que sempre é difícil influenciar realmente a política de saúde de outro país porque é realmente uma questão nacional. Mas acho que uma mistura de pressão diplomática, conversar com o governo, dialogar, tentar identificar os agentes que pensam e agem de forma diferente, apoiá-los é sempre muito importante"", diz. 
""Há a questão do financiamento de cooperação... no momento eu não daria nenhum dinheiro ao governo de Bolsonaro, talvez identifique corporações que possam ajudar algumas pessoas no Brasil. Essas são opções de política externa. O Parlamento Europeu basicamente não tem voz na política externa, mas pode participar nas conversas e pode influenciar a agenda"", completa.
Em aviso sobre a audiência, Cavazzini citou a ordem emitida na quinta (8) pelo ministro Luís Roberto Barroso, do STF (Supremo Tribunal Federal), para que o presidente do Senado, Rodrigo Pacheco (DEM-MG), intalasse uma CPI da pandemia da covid-19. Pacheco tomou a decisão nesta terça-feira. 
A CPI investigará a atuação do governo de Jair Bolsonaro no enfrentamento da pandemia de coronavírus, assim como o uso de recursos federais por Estados e municípios na contenção da crise sanitária.
Cavazzini também menciona que ""mais de 340 mil brasileiros já morreram com o vírus"" e que ""nos últimos dias, a média diária de mortes ultrapassou 4 mil"".
Além de abordar a ""situação econômica e sanitária no Brasil"", a audiência vai incluir ""troca de opiniões sobre a cooperação científica e tecnológica entre a UE e o Brasil"" e ""troca de pontos de vista sobre a situação dos defensores dos direitos humanos no Brasil, incluindo o caso Fernando dos Santos Araújo"".
Sobrevivente da chacina de Pau D'Arco, em 2017, que resultou na morte de dez trabalhadores rurais e atribuída a policiais, Araújo chegou a entrar no programa de proteção a testemunhas, mas voltou à fazenda neste ano e também foi assassinado.
Recentemente, Cavazzini fez parte do grupo de 68 deputados do Parlamento Europeu que enviou uma carta ao vice-presidente Hamilton Mourão e ao Conselho Nacional da Amazônia Legal, que ele coordena, reclamando de planos para restringir as atividades de ONGs na região. 
A eurodeputada foi a primeira signatária do texto, que considera ""muito preocupantes"" notícias sobre o estabelecimento de limites e regras mais duras para a atuação de entidades da sociedade civil.
""O processo de autorização para funcionamento das ONGs já está bem regulamentado pela lei brasileira. Por muitas décadas, várias ONGs no Brasil têm implementado programas e ações para combater crimes ambientais, proteger a floresta amazônica e a sobrevivência de suas populações, enquanto promovem o desenvolvimento sustentável na região"", afirma a carta, de novembro do ano passado.
Já assistiu aos nossos novos vídeos no YouTube? Inscreva-se no nosso canal! 
https://www.youtube.com/watch?v=VTTp7e9yzX4
https://www.youtube.com/watch?v=1a56kIlucug
https://www.youtube.com/watch?v=JIQjCWedrRQ

                Tanques e tropas russas mais uma vez colocaram o leste da Ucrânia em alerta máximo.

              Por Pedro Fonseca
São Paulo - A Merck e sua parceira Ridgeback Therapeutics anunciaram nesta quinta-feira que vão interromper testes 
Islamabad, 15 Abr 2021 (AFP) - A embaixada da França no Paquistão recomendou nesta quinta-feira (15) a seus...
Paris, 15 Abr 2021 (AFP) - A um ano das eleições presidenciais na França, uma nova geração de jovens desencantada...
Paris, 15 Abr 2021 (AFP) - A um ano das eleições presidenciais na França, uma nova geração de jovens desencantada...
"
