title;description;content;url;image;publishedAt;source;Texto
Robson Conceição e o ouro que vi do início ao fim: 100 dias para Tóquio;Nos Jogos Rio-2016 tive a grata missão de cobrir o boxe no Pavilhão 6 do Riocentro e pude presenciar a trajetória de um herói do esporte olímpico nacional;Josias Pereira é repórter do Super FC e escreve sobre futebol internacional, um espaço voltado inclusive às ligas alternativas mundo afora, variadas modalidades esportivas, como basquete, futebol americano, beisebol, dentre outras, além de literatura... [8658 chars];https://www.otempo.com.br/opiniao/pelo-mundo/robson-conceicao-e-o-ouro-que-vi-do-inicio-ao-fim-100-dias-para-toquio-1.2472022;https://www.otempo.com.br/image/contentid/policy:1.1959586:1530730705/image/image.jpg?f=3x2&w=620&$p$f$w=3220ccf;2021-04-14T03:24:15Z;O Tempo;"SuperNotícia
SuperNotícia
RádioSuper
Super.FC
O TempoBetim
Josias Pereira é repórter do Super FC e escreve sobre futebol internacional, um espaço voltado inclusive às ligas alternativas mundo afora, variadas modalidades esportivas, como basquete, futebol americano, beisebol, dentre outras, além de literatura e turismo esportivo. 
O mundo entrou na contagem regressiva de 100 dias para os Jogos Olímpicos de Tóquio. E eu ainda guardo vivo na minha memória os momentos que vivi em 2016, quando tive a oportunidade de cobrir uma Olimpíada pelo Super.FC / Jornal O Tempo, no Rio de Janeiro. Presenciar aquela festa de cores, de línguas, povos e esportes, foi a realização de um sonho e uma das minhas afirmações na carreira de jornalista, ainda aos 26 anos de idade. 
Recordo-me ainda pequeno, por volta de cinco, seis anos, que meu primeiro contato com o esporte foi uma bola de futebol dos Jogos Olímpicos de Barcelona, em 1992. E desde Sydney, mesmo ainda sem compreender muito do que se desenrolava, passei a acumular recortes de revistas e jornal, que guardo até hoje, sobre os Jogos Olímpicos. Mal poderia imaginar que um dia viveria tudo aquilo de perto. 
Das mais variadas histórias do Rio 2016, guardo comigo o ouro que acompanhei desde o início. O ouro de Robson Conceição, o primeiro pugilista da história do Brasil a subir no lugar mais alto do pódio em uma Olimpíada. Um fã confesso de Rocky Balboa, a nobre arte sempre foi para mim uma paixão e ao analisar as possibilidades de medalha do país marquei na minha agenda o Pavilhão 6 do Riocentro, na Barra da Tijuca. Lá era a casa do boxe olímpico. 
Foi no amadorismo do boxe olímpico que vários nomes dos ringues deram o ar da graça, como Cassius Clay, posteriormente Muhammad Ali, possivelmente um dos três maiores esportistas de todos os tempos. Para se ter uma ideia de pugilista recente, até mesmo o milionário Floyd Mayweather subiu em um pódio olímpico, conquistando um bronze para os EUA em Atlanta 1996.
O Rio de Janeiro marcou uma Olimpíada extremamente decisiva para o boxe moderno, com a permissão de pugilistas profissionais na busca por medalhas. Há de se lembrar ainda que a Olimpíada do Rio de Janeiro quebrou uma tradição do boxe olímpico. Pela primeira vez desde Los Angeles 1984, quando o item passou a ser obrigatório, os boxeadores passaram a lutar sem os protetores de cabeça que antes protegiam seus rostos.

Em meio às críticas, o apelo pela modalidade foi imediato entre o público brasileiro, que transformou o Pavilhão 6 no mais animado local dos Jogos Olímpicos. Eu mesmo produzi matérias que davam conta dos cânticos dos torcedores, que iam desde o 'Uh, vai morrer', que gerou um mal estar nos organizadores dos Jogos, muito pelo altíssimo impacto do UFC naquele período, até o apoio aos árbitros brasileiros, saudados como ídolos, e o pugilista equatoriano Carlos Andres Mina, que rapidamente ganhou do público a música ""Mina, seus cabelo é da hora, seu corpão violão, meu docinho de coco, tá me deixando louco', dos Mamonas Assassinas, como hino - mesmo sem ele entender absolutamente nada do que se tratava. 

Em meio a essa loucura organizada que tomava conta do Pavilhão 6, um baiano de Salvador, chamado Robson Conceição, começou a traçar sua trajetória. Robson é mais um dos filhos de pai ausente desse país. Uma criação dura em meio à periferia do bairro de Boa Vista de São Caetano. Ele cresceu tendo ao lado a mãe e a avó e a necessidade o fez crescer muito cedo, ajudando no sustento da casa, sendo de feirante a vendedor de picolé na praia e também ajudante de pedreiro. 
O amor ao boxe não foi algo imediato. Foi construído. Seja lá uma influência do tio Roberto, conhecido pelas brigas de rua no carnaval de Salvador, seja lá pelo desejo que foi aumentando quando ainda treinava no fundo de um quintal na Boa Vista.  As brigas de rua não eram o caminho de Robson. Quando passou a levar a sério a modalidade, o mundo o conheceu. 

O 'Terror da Boa Vista' se tornou a história viva do boxe brasileiro. Um campeão olímpico. Lembro-me da primeira luta no Pavilhão 6. Robson, aos 26 anos, não era uma figura desconhecida do ciclo olímpico. Na verdade, ele já havia ido a Pequim e Londres, e foi eliminado nas duas Olimpíadas na primeira fase da disputa. 
Existia uma pressão psicológica na luta contra Anvar Yunusov, do Tajiquistão. Será que Robson ficará pelo caminho mais uma vez? Não desta vez. Um round. Um nocaute técnico. O adversário lesionou a mão e o triunfo foi assegurado ao brasileiro, que já ingressou nas oitavas de final da categoria até 60 kg. Robson não era mais aquele menino que pisara em Pequim. Ele era o número dois no ranking mundial. Um atleta respeitado.  
Robson marcou para um duelo difícil nas quartas contra o uzbeque o Urshid Tojibaev. A resistência foi grande. Houve momentos que a trocação e os clinches me fazia contar os pontos e pensar até no pior. Mas a decisão dos juízes foi certeira, dando a vitória por 3 rounds a 0 para o brasileiro. 

Robson Conceição avançou para uma semifinal com cara de decisão. O pugilismo cubano é notoriamente um dos melhores da história dos Jogos Olímpicos. O país caribenho chegou ao Rio de Janeiro com 66 medalhas na modalidade, sendo 34 de ouro. A terra de ícones como Kid Chocolate, Teófilo Stevenson, Felix Savón e tantos outros, confiava para a categoria Lázaro Álvarez, dono de dois ouros Pan-Americanos, e que vinha com fome de vitória após o bronze em Londres 2012. 
Não seria uma luta fácil para Robson. Foi um confronto eletrizante e que deixou o Pavilhão 6 do Riocentro em polvorosa. O duelo nos corners já acontecia e a troca de hostilidades entre brasileiros e cubanos era real. O 'Uh, vai morrer' era o grito de ponta a ponta. E o Brasil literalmente ia junto com Robson a cada golpe. 
Era dia dos pais. E a mãe de Robson, a figura materna e paterna da sua vida, assistia nas arquibancadas ao lado da nora Erika e da pequena Sophia, a filha de Conceição. O pai, lá no ringue, dava tudo de si. Um dos maiores dia dos pais que Robson pode viver. 
Resistiram os três rounds. O soar do relógio. Braços pra cima dos dois lados. A explosão brasileira com a decisão dos juízes: três rounds a zero. Na passagem para a conversa com a imprensa escrita, um certo entrevero entre técnicos brasileiros e cubanos. A rivalidade cristalina. Mas naquela tarde, a vitória era brasileira e ninguém iria tirá-la de Robson Conceição, garantido ao menos com uma prata. 
A post shared by Josias Pereira (@josiaspsantos)
Em Londres 2012, Esquiva Falcão levou o boxe brasileiro à prata, já abrindo caminho para a glória  que aconteceria quatro anos depois. Era Brasil contra França. Robson Conceição contra Sofiane Oumiha. Naquela mesma Olimpíada, uma disputa entre brasileiros e franceses havia gerado polêmica. No salto com vara, Thiago Braz venceu na final o francês Renaud Lavillenie, que reclamou bastante dos gritos brasileiros nas arquibancadas do Engenhão buscando tirar sua concentração. A atitude, de fato, foi uma bola fora imensa da torcida brasileira, gerando uma repercussão negativa mundial. 
Mas no boxe, Sofiane, de apenas 21 anos, não poderia conter a mobilização que tomou conta do Pavilhão 6. Foi um dia de ouro. Naquele dia nada me interessava a não ser me dirigir para o Riocentro. Por lá cheguei cedo para garantir meu lugar e presenciar a história ser escrita. O primeiro round foi extremamente equilibrado e Robson venceu por uma ligeira margem. 
Mas no segundo, ele soltou o braço e dominou o francês, levando-o inclusive à lona em uma oportunidade. 
No terceiro e último round, o público brasileiro passou a celebrar a vitória antes mesmo do tempo determinado, tendo em vista que Oumiha conseguiu conectar poucos golpes em Conceição. O cansaço atingiu o jovem pugilista, enquanto Robson aguardava o fim do combate.
Quando a luta se encerrou, a vitória já era certa. Robson, um campeão olímpico, e o choro. O abraço na família. A celebração no Pavilhão 6, a celebração nacional. Do início ao fim lá estive e me lembro desde a primeira entrevista, nas oitavas, quando o número de jornalistas presentes na zona mista era de contar nos dedos até que a atenção em torno do baiano mobilizou um batalhão a cada nova vitória. Mas Robson, solícito, ainda expressou sua humildade ao lembrar-se de cada um que lá esteve quando tudo começou. Uma glória olímpica que nunca vou esquecer e faz parte da minha contagem rumo aos Jogos de Tóquio.
---
Em tempos de desinformação e pandemia, o jornal O TEMPO reforça o compromisso com o jornalismo mineiro, profissional e de qualidade. Nossa redação produz diariamente informação responsável e que você pode confiar. Continue nos apoiando. Assine O TEMPO.
Josias Pereira é repórter do Super FC e escreve sobre futebol internacional, um espaço voltado inclusive às ligas alternativas mundo afora, variadas modalidades esportivas, como basquete, futebol americano, beisebol, dentre outras, além de literatura e turismo esportivo. 
"
"Sincerona, Domitila brinca que 'amarelou' em entrevista com Messi: ""tremia""";A apresentadora e jornalista Domitila Becker, convidada desta semana no quadro Sincerão/Sincerona no canal do UOL Esporte no YouTube, divertiu-se ao recordar o dia em que 'ama;"A apresentadora e jornalista Domitila Becker, convidada desta semana no quadro Sincerão/Sincerona no canal do UOL Esporte no YouTube, divertiu-se ao recordar o dia em que 'amarelou' em uma entrevista coletiva com Lionel Messi.
""Quando em trabalhava c... [703 chars]";https://www.uol.com.br/esporte/futebol/ultimas-noticias/2021/04/14/sincerona-domitila-brinca-que-amarelou-em-entrevista-com-messi-tremia.htm;https://conteudo.imguol.com.br/c/entretenimento/49/2019/10/18/a-jornalista-domitila-becker-1571441091269_v2_750x421.png;2021-04-14T03:00:00Z;UOL;"Marcello De Vico
Marcello De Vico
Do UOL, em Santos (SP)
14/04/2021 04h00 
A apresentadora e jornalista Domitila Becker, convidada desta semana no quadro Sincerão/Sincerona no canal do UOL Esporte no YouTube, divertiu-se ao recordar o dia em que 'amarelou' em uma entrevista coletiva com Lionel Messi.
""Quando em trabalhava como correspondente em Barcelona, rolou uma entrevista coletiva do Messi. Ele quase nunca dava entrevista"", lembra a partir dos 4min04s do vídeo cima. ""Eu estava muito nervosa e não consegui fazer pergunta nenhuma. Eu estava tremendo"", brinca.
No quadro, ela ainda conta sobre o dia em que o namorado austríaco ficou bêbado no Maracanã e virou botafoguense, cita Serena Williams como personalidade com quem gostaria de 'tomar umas' — apesar de ressaltar que ""ela não deve tomar Skol"" — e fica um pouco mais séria quando questionada sobre o comentário do esporte/futebol que mais a irrita: ""Futebol feminino nem é tão legal... Já passamos dessa fase, né?"".
Depois da eliminação precoce na Libertadores, o Grêmio já voltou aos treinos nesta quinta-feira pensando no jogo...
Após a classificação para a 3ª fase da Copa do Brasil na noite de quarta-feira, 14 de abril, o América-MG se...
Jogador com mais pontos na história da modalidade no mundo inteiro, Oscar Schmidt relembrou em suas redes sociais...
"
compromissos do BBB21 impedem TV Globo aos sábados;Pelo menos nos dois primeiros finais de semana após o retorno do Campeonato Paulista, a Globo não vai exibir jogos do estadual. O Esporte da emissora até queria transmitir partidas no sábado à noite, mas fatores comerciais e de programação envolvendo o;"Gabriel Vaquer cobre mídia esportiva desde 2014. No UOL Esporte, conta detalhes do evento onde seu time joga e onde seu profissional de TV esportiva favorito vai trabalhar.
Pelo menos nos dois primeiros finais de semana após o retorno do Campeonato P... [1994 chars]";https://www.uol.com.br/esporte/colunas/gabriel-vaquer/2021/04/14/como-bbb21-impede-globo-de-mostrar-jogos-do-paulistao-aos-sabados-a-noite.htm;https://conteudo.imguol.com.br/c/entretenimento/e2/2021/04/12/bbb-21-tiago-leifert-no-programa-de-1104-1618198243126_v2_615x300.png;2021-04-14T03:00:00Z;UOL;"Texto que relata acontecimentos, baseado em fatos e dados observados ou verificados diretamente pelo jornalista ou obtidos pelo acesso a fontes jornalísticas reconhecidas e confiáveis.
Texto que relata acontecimentos, baseado em fatos e dados observados ou verificados diretamente pelo jornalista ou obtidos pelo acesso a fontes jornalísticas reconhecidas e confiáveis.
Gabriel Vaquer cobre mídia esportiva desde 2014. No UOL Esporte, conta detalhes do evento onde seu time joga e onde seu profissional de TV esportiva favorito vai trabalhar.
Colunista do UOL
14/04/2021 13h54 
Pelo menos nos dois primeiros finais de semana após o retorno do Campeonato Paulista, a Globo não vai exibir jogos do estadual. O Esporte da emissora até queria transmitir partidas no sábado à noite, mas fatores comerciais e de programação envolvendo o ""Big Brother Brasil 21"", reality de maior sucesso no canal atualmente, impediram isso.
A coluna apurou que a expectativa do Esporte da Globo era mostrar pelo menos uma partida no próximo sábado (17). Mas não foi possível porque já existiam compromissos com exposição de anunciantes neste dia. Nem mesmo uma regionalização, com partida apenas para o estado de São Paulo, foi cogitada.
Como a capital paulista é o principal mercado de televisão do Brasil, o caso dela é diferente de Porto Alegre, por exemplo, que flexibilizou a programação e exibiu Grêmio x Internacional no mês de março, na faixa do ""BBB21"". Naquele dia, também, era possível porque não se tinham tantos compromissos envolvendo o reality.
No próximo sábado, por exemplo, deve ocorrer a festa da semana no programa. Normalmente, a celebração dos 'brothers' costuma ser uma celebração patrocinada com um tema específico, envolvendo uma marca ou uma empresa que já seja anunciante fixa no reality show comandado por Tiago Leifert.
Apenas na edição deste ano, o ""BBB21"" conseguiu um faturamento de R$ 530 milhões somente com patrocinadores principais. Foi o recorde de arrecadação publicitária do reality.
Foram oito cotistas: Americanas, Amstel, Avon, C&A, McDonald's, P&G, PicPay e Seara, Above e Organnact. Em ordem de importância publicitária, o ""BBB21"" só perde para o futebol na Globo.
O ""Big Brother Brasil 21"" tem final marcada para o dia 4 de maio. O que se sabe é que, no dia 8 de maio, está prevista a estreia da série ""Vai que Cola"" nas noites de sábado, logo após a novela ""Império"".
Mas, até meados de maio, a expectativa dos clubes é que jogos do Paulista possam acontecer mais cedo, antes das 20h, coisa que o Ministério Público de São Paulo não permite atualmente pelo protocolo em vigor no combate aos efeitos da pandemia do coronavírus.
"
"SBT faz proposta por ex-árbitra; Globo quer manter";O SBT fez uma proposta para ter a comentarista de arbitragem Nadine Basttos, ex-árbitra da Fifa e primeira mulher a estar em uma final da Copa do Brasil em sua função. A intenção é tirar a profissional do Esporte da Globo, onde ela está desde agosto do;"Texto que relata acontecimentos, baseado em fatos e dados observados ou verificados diretamente pelo jornalista ou obtidos pelo acesso a fontes jornalísticas reconhecidas e confiáveis.
Gabriel Vaquer cobre mídia esportiva desde 2014. No UOL Esporte, ... [3177 chars]";https://www.uol.com.br/esporte/colunas/gabriel-vaquer/2021/04/14/sbt-faz-proposta-para-ter-nadine-basttos-globo-quer-manter-ex-arbitra.htm;https://conteudo.imguol.com.br/c/esporte/b2/2020/07/15/nadine-bastos-ex-comentarista-de-arbitragem-do-fox-sports-1594830270180_v2_615x300.jpg;2021-04-14T03:00:00Z;UOL;"Texto que relata acontecimentos, baseado em fatos e dados observados ou verificados diretamente pelo jornalista ou obtidos pelo acesso a fontes jornalísticas reconhecidas e confiáveis.
Texto que relata acontecimentos, baseado em fatos e dados observados ou verificados diretamente pelo jornalista ou obtidos pelo acesso a fontes jornalísticas reconhecidas e confiáveis.
Gabriel Vaquer cobre mídia esportiva desde 2014. No UOL Esporte, conta detalhes do evento onde seu time joga e onde seu profissional de TV esportiva favorito vai trabalhar.
14/04/2021 14h30 
O SBT fez uma proposta para ter a comentarista de arbitragem Nadine Basttos, ex-árbitra da Fifa e primeira mulher a estar em uma final da Copa do Brasil em sua função. A intenção é tirar a profissional do Esporte da Globo, onde ela está desde agosto do ano passado.A analista foi a primeira mulher a comentar arbitragem de forma fixa na TV brasileira. Atualmente, Nadine é o único nome feminino da ""Central do Apito"".
A coluna apurou que Nadine avisou aos seus chefes na Globo que teve essa conversa com o canal de Silvio Santos, que quer contar com os seus serviços porque sentiu a necessidade, desde a final da Libertadores 2020 em janeiro, que precisava de um nome para comentar polêmicas de arbitragem.
Hoje, a situação está indefinida. A Globo não pretende fazer grandes esforços para manter Nadine Basttos em seus quadros, mas gostaria que ela continuasse por um projeto de médio e longo prazo que tem para aumentar a presença feminina em transmissões de futebol.
Nadine faz parte dessa medida, que contou também no último ano com as contratações da narradora Renata Silveira e da comentarista Renata Mendonça. A semente dele começou com o acerto para contratar Ana Thaís Matos em 2019, hoje um dos principais nomes da Globo nas competições de futebol. A ideia é ter, em breve, um jogo transmitido apenas por mulheres.
No SBT, se a negociação avançar, Nadine teria uma vantagem importante: seria o nome titular das competições para falar de arbitragem. O canal fechou a compra da Libertadores e da Liga dos Campeões e está negociando de forma avançada a compra dos direitos de transmissão da Copa América 2021, que acontecerá em junho. 
Um fato que azedou um pouco a relação de Nadine Basttos internamente no Grupo Globo foram as críticas que ela sofreu em janeiro, partindo de torcedores e até executivos do Flamengo, por conta de um erro em uma opinião durante o jogo entre Inter x Red Bull Bragantino.
Na oportunidade, Nadine disse que houve um toque de mão, que na interpretação de grande parte da torcida, não aconteceu. A ex-árbitra discutiu no Twitter e até apagou sua conta na rede social. A coluna apurou que não houve apoio interno claro após ataques mais sérios que a analista sofreu, incluindo até ameaças de morte.
A expectativa é que a questão seja resolvida ainda nesta semana. Procurada oficialmente pela coluna, a Globo diz apenas que ""Nadine Basttos faz parte do Esporte da Globo"". E, de fato, ainda faz, tanto que foi escalada para ""Central do Apito"" normalmente nesta semana. Hoje (14), por exemplo, ela participa da transmissão na Globo de América-RN x Cruzeiro, em exibição regionalizada para Minas Gerais.
Até sexta-feira (16), Nadine Basttos também vai atuar em outros jogos. No SporTV, ela fará Joinville x Atlético-GO na quinta (14) pela Copa do Brasil. No dia seguinte, está escalada para Caxias x Grêmio pelo Campeonato Gaúcho e Ponte Preta x Santos no Campeonato Paulista.
A coluna tentou falar com Nadine Basttos desde a última terça-feira (13), mas a ex-árbitra não respondeu aos contatos. Caso o faça, a reportagem será atualizada.
"
