title;description;content;url;image;publishedAt;source;Texto;categoria
Taxa de transmissão da covid-19 no Espírito Santo é a maior em quase um ano;Atualmente, ela está em 1,53, o que significa dizer que um grupo de 100 pessoas infectadas é capaz de contaminar outras 153. Esse é o quarto aumento consecutivo desse índice, registrado no estado;"Foto: TV Vitória
A taxa de transmissão da covid-19 no Espírito Santo é a mais alta registrada em quase um ano. Atualmente, ela está em 1,53, o que significa dizer que um grupo de 100 pessoas infectadas é capaz de contaminar outras 153. Esse é o quart... [2152 chars]";https://www.folhavitoria.com.br/geral/noticia/04/2021/taxa-de-transmissao-da-covid-19-no-espirito-santo-e-a-maior-em-quase-um-ano;https://assets.folhavitoria.com.br/images/bf8d98a0-9eed-0138-3fef-0a58a9feac2a--minified.jpg;2021-04-16T00:32:40Z;Jornal Folha Vitória;"A taxa de transmissão da covid-19 no Espírito Santo é a mais alta registrada em quase um ano. Atualmente, ela está em 1,53, o que significa dizer que um grupo de 100 pessoas infectadas é capaz de contaminar outras 153. Esse é o quarto aumento consecutivo desse índice, registrado no estado, e o maior patamar desde maio do ano passado.
A taxa de transmissão da covid-19 no Espírito Santo é a mais alta registrada em quase um ano. Atualmente, ela está em 1,53, o que significa dizer que um grupo de 100 pessoas infectadas é capaz de contaminar outras 153. Esse é o quarto aumento consecutivo desse índice, registrado no estado, e o maior patamar desde maio do ano passado.
No dia 15 de maio, a taxa de transmissão estava em 1,70 no Espírito Santo Santo. Em 19 de fevereiro, chegou a 0,84, em um momento em que a curva da pandemia estava menor — especialistas consideram como ideal que a taxa esteja abaixo de 1.
A partir de 26 de fevereiro, voltou a ficar acima de 1 e, desde então, não parou de crescer. No dia 5 de março, estava em 1,29; em 12 de março, 1,44; e no dia 19 daquele mês chegou a 1,53.
""Por conta dos eventos de carnaval e também as aglomerações do início de ano, combinadas com o aumento da notificação de síndromes respiratórias, que é um aumento sazonal, e também o efeito da nova variante da covid, especificamente a inglesa, diagnosticada pelo nosso Laboratório Central, essa taxa de transmissão e o contágio aqui no Estado voltou a crescer"", destacou o diretor de Integração do Instituto Jones dos Santos Neves (IJSN), Pablo Lira.
A atual taxa de transmissão acende um sinal vermelho para os especialistas, já que significa mais gente doente e, consequentemente, mais pressão nos hospitais, que já estão superlotados.
No interior do estado, a taxa de transmissão é ainda maior, chegando a 1,6. Já na Grande Vitória, ela recua um pouco, marcando 1,42, o que ainda é considerado alto. ""O interior manteve esse padrão mais intenso de contágio e de registros de casos e mortes. Então o interior ainda permanece com a velocidade de transmissão mais elevada do que a média estadual e da Grande Vitória"", frisou Pablo Lira.
Até o final da tarde desta quinta-feira, a taxa de ocupação de leitos de Unidade de Terapia Intensiva (UTI) exclusivos para o tratamento da covid-19, oferecidos pela rede pública, estava em 92,76%. Dos 1.022 leitos de UTI para coronavírus nos hospitais estaduais e nos filantrópicos e particulares contratados pela Sesa, 948 estavam ocupados. 
Já na rede particular, a taxa de ocupação é de 87,11%, segundo o Painel Leitos da Rede Privada - ES. Das 225 vagas disponibilizadas pela rede privada, 196 estão preenchidas.
Com informações do repórter Álvaro Zanotti, da TV Vitória/Record TV 
";['geral']
Nunes Marques manda PGR avaliar abertura de investigação contra Bolsonaro por diálogo com Kajuru;Bolsonaro pressionou pelo impeachment de ministros do STF, como Alexandre de Moraes, e atacou a CPI da Pandemia no Senado, que investiga a gestão do governo federal durante a pandemia da Covid-19;"Bolsonaro pressionou pelo impeachment de ministros do STF, como Alexandre de Moraes, e atacou a CPI da Pandemia no Senado, que investiga a gestão do governo federal durante a pandemia da Covid-19 edit
247 - O ministro Kassio Nunes Marques, do Supremo... [1214 chars]";https://www.brasil247.com/regionais/brasilia/nunes-marques-manda-pgr-avaliar-abertura-de-investigacao-contra-bolsonaro-por-dialogo-com-kajuru;https://publisher-publish.s3.eu-central-1.amazonaws.com/pb-brasil247/swp/jtjeq9/media/20201105211144_3d80756ae007eee9cc7812769594d9a99e384503cf44222d0d9e60352a54b8e4.jpeg;2021-04-16T00:25:37Z;Brasil 247;"Bolsonaro pressionou pelo impeachment de ministros do STF, como Alexandre de Moraes, e atacou a CPI da Pandemia no Senado, que investiga a gestão do governo federal durante a pandemia da Covid-19
edit
Bolsonaro pressionou pelo impeachment de ministros do STF, como Alexandre de Moraes, e atacou a CPI da Pandemia no Senado, que investiga a gestão do governo federal durante a pandemia da Covid-19
edit






247 - O ministro Kassio Nunes Marques, do Supremo Tribunal Federal (STF), enviou nesta quinta-feira, 15, à Procuradoria-Geral da República uma notícia-crime contra Jair Bolsonaro por advocacia administrativa e corrupção ativa apresentada por deputados do PSOL.
Os psolistas apresentaram a denúncia na quarta-feira, 14 , apontando crimes na conversa telefônica de Bolsonaro com o senador Jorge Kajuru, divulgada pelo parlamentar no domingo, 11.
Bolsonaro pressionou pelo impeachment de ministros do STF, como Alexandre de Moraes, e atacou a CPI da Pandemia no Senado, que investiga a gestão do governo federal durante a pandemia da Covid-19. 




Ação de parlamentares do PSOL alega que o diálogo mostra o Poder Executivo pressionando o Poder Legislativo a interferir na instauração de um processo de investigação de que é alvo.
“Não há aqui nenhuma dúvida do cometimento de graves crimes de responsabilidade por parte do noticiado”, dizem os parlamentares do PSOL David Miranda (RJ), Fernanda Melchionna (RS), Sâmia Bonfim (SP) e Viviane Reis (PA). 




O ministro Nunes Marques, colocado no STF por Bolsonaro, foi sorteado relator da ação contra o presidente.
Inscreva-se no canal de cortes da TV 247 e saiba mais:

247 - O ministro Kassio Nunes Marques, do Supremo Tribunal Federal (STF), enviou nesta quinta-feira, 15, à Procuradoria-Geral da República uma notícia-crime contra Jair Bolsonaro por advocacia administrativa e corrupção ativa apresentada por deputados do PSOL.
Os psolistas apresentaram a denúncia na quarta-feira, 14 , apontando crimes na conversa telefônica de Bolsonaro com o senador Jorge Kajuru, divulgada pelo parlamentar no domingo, 11.
Bolsonaro pressionou pelo impeachment de ministros do STF, como Alexandre de Moraes, e atacou a CPI da Pandemia no Senado, que investiga a gestão do governo federal durante a pandemia da Covid-19.
Ação de parlamentares do PSOL alega que o diálogo mostra o Poder Executivo pressionando o Poder Legislativo a interferir na instauração de um processo de investigação de que é alvo.
“Não há aqui nenhuma dúvida do cometimento de graves crimes de responsabilidade por parte do noticiado”, dizem os parlamentares do PSOL David Miranda (RJ), Fernanda Melchionna (RS), Sâmia Bonfim (SP) e Viviane Reis (PA).
O ministro Nunes Marques, colocado no STF por Bolsonaro, foi sorteado relator da ação contra o presidente.
Inscreva-se no canal de cortes da TV 247 e saiba mais:
O conhecimento liberta. Saiba mais. Siga-nos no Telegram.
A você que chegou até aqui, agradecemos muito por valorizar nosso conteúdo. Ao contrário da mídia corporativa, o Brasil 247 e a TV 247 se financiam por meio da sua própria comunidade de leitores e telespectadores. Você pode apoiar a TV 247 e o site Brasil 247 de diversas formas. Veja como em brasil247.com/apoio
Os comentários aqui postados expressam a opinião dos seus autores, responsáveis por seu teor, e não do 247
© 2021 Editora 247 - Todos os Direitos Reservados

";['regionais', 'brasilia']
Bolsonaro diz que Kajuru não pediu autorização para gravar: 'Maluco';Na gravação, o presidente diz que pedidos de impeachment contra ministros do STF (Supremo Tribunal Federal) podem interromper a apuração da CPI da Covid.;"O presidente Jair Bolsonaro (sem partido) voltou a dizer hoje que o senador Jorge Kajuru (Podemos-GO) não pediu autorização para gravar a conversa entre os dois e o chamou de ""maluco"". No último fim de semana, o parlamentar divulgou uma ligação em qu... [2014 chars]";https://noticias.uol.com.br/politica/ultimas-noticias/2021/04/15/bolsonaro-diz-que-kajuru-nao-pediu-autorizacao-para-gravar-maluco.htm;https://conteudo.imguol.com.br/c/noticias/6d/2021/04/15/15abr21---jair-bolsonaro-em-live-semanal-1618524579342_v2_615x300.png;2021-04-16T00:25:00Z;UOL;"Do UOL, em São Paulo
Do UOL, em São Paulo
15/04/2021 21h24Atualizada em 15/04/2021 21h25 
O presidente Jair Bolsonaro (sem partido) voltou a dizer hoje que o senador Jorge Kajuru (Podemos-GO) não pediu autorização para gravar a conversa entre os dois e o chamou de ""maluco"". No último fim de semana, o parlamentar divulgou uma ligação em que Bolsonaro sugere caminhos para interromper a CPI da Covid que investigará a conduta do governo federal na pandemia.
No diálogo, o presidente diz que pedidos de impeachment contra ministros do STF (Supremo Tribunal Federal) podem interromper a apuração da CPI. Ele também cobra que ações de governadores e prefeitos sejam investigadas.
""O senador Kajuru me ligou, foi uma conversa que eu teria com qualquer senador. Agora, o fato de gravar... No dia seguinte, ele me ligou novamente e falou que tinha cortado partes agressivas ao senador [Randolfe Rodrigues]. Fiquei quieto, quando ele falou aquilo, vi que o cara me gravou e iria divulgar. Não vou discutir com maluco. Ele não pediu autorização para gravar uma ligação comigo"", afirmou Bolsonaro.
A declaração foi dada durante live semanal transmitida nas redes sociais. Bolsonaro vem negando que sabia da gravação desde que o teor da conversa se tornou público. Kajuru, entretanto, contradiz o presidente. ""É claro que ele sabia. Ele falou tudo aquilo sabendo que eu estava gravando. É evidente"", declarou o senador recentemente.
""A questão do STF não fui eu que perguntei. Ele que quis falar. Eu ia falar para ele parar? Não sou assessor dele"", chegou a dizer Kajuru durante o UOL Entrevista.
Bolsonaro ainda pede que Kajuru divulgue uma segunda conversa gravada. ""Agora 'tá' faltando você divulgar a outra ligação que você diz que fez para mim e eu concordei. Publica aí. Essa você não gravou? Pô, Kajuru, você grava tudo. Não gravou porque vai se ferrar, né? Vai fazer uma prova contra você, tá certo?"".
Desde segunda-feira, o presidente Bolsonaro diz que Kajuru o ligou duas vezes e que ele deve publicar a segunda gravação: ""Podem divulgar tudo da minha parte"".
Para o senador Kajuru, Bolsonaro mudou o discurso após receber orientações e assessoria. ""Deixei claro para ele que iria colocar o nosso papo no ar. Ele disse que não tinha nada para esconder. Ele queria que divulgasse"". Ele ainda diz que o presidente aproveitou a gravação para mandar recados.
Começa na quinta-feira da semana que vem a Cúpula do Clima, organizada por Joe Biden. Com uma semana de...
Nesta quinta-feira (15), o Brasil chegou aos 25,4 milhões de vacinados contra a covid-19. No total, 25.460.098...
O Brasil completou 30 dias seguidos com média móvel de mortes acima de 2.000 óbitos por dia. Nesta quinta-feira...
Em meio ao risco de desabastecimento de medicamentos usados na intubação de pacientes com Covid em UTIs, situação...
O presidente Jair Bolsonaro (sem partido) afirmou hoje que só deixa a Presidência da República se ""Deus me tirar a 
A ministra Cármen Lúcia, do Supremo Tribunal Federal (STF), estabeleceu prazo de cinco dias para que o presidente...
O ministro do STF (Supremo Tribunal Federal) Kassio Nunes Marques decidiu hoje pelo arquivamento da ação movida...
O senador Jorge Kajuru anunciou hoje que se afiliou ao partido Podemos, após ser convidado a deixar o Cidadania. A 
O ministro do Supremo Tribunal Federal (STF) Alexandre de Moraes votou para processos criminais contra o...
Por maioria, o STF (Supremo Tribunal Federal) manteve a decisão do ministro Edson Fachin que beneficia o...
O delegado Alexandre Saraiva, que será substituido da chefia da Polícia Federal do Amazonas, como revelou o...
Oito líderes de oposição na Câmara dos Deputados enviaram representação ao Ministério Público Federal com...
";['politica', 'ultimas-noticias']
"França ultrapassa 100 mil mortes pela Covid-19; segunda onda mata o dobro de infectados";França superou nesta quinta-feira (15) o pesado balanço de 100 mil mortos desde o início da epidemia de Covid-19, em meio à terceira onda da infecção viral. Ao mesmo tempo em que as autoridades sanitárias anunciavam 38.045 casos positivos adicionais da doença em 24 horas;França superou nesta quinta-feira (15) o pesado balanço de 100 mil mortos desde o início da epidemia de Covid-19, em meio à terceira onda da infecção viral. Ao mesmo tempo em que as autoridades sanitárias anunciavam 38.045 casos positivos adicionais ... [3579 chars];https://www.brasil247.com/mundo/franca-ultrapassa-100-mil-mortes-pela-covid-19-segunda-onda-mata-o-dobro-de-infectados;https://publisher-publish.s3.eu-central-1.amazonaws.com/pb-brasil247/swp/jtjeq9/media/2020092417090_c9a9ab2e4c8e4f69d1f4ffa94c9964d52b379d0d44bb215811f2568dcda133e1.jpeg;2021-04-16T00:05:57Z;Brasil 247;"França superou nesta quinta-feira (15) o pesado balanço de 100 mil mortos desde o início da epidemia de Covid-19, em meio à terceira onda da infecção viral. Ao mesmo tempo em que as autoridades sanitárias anunciavam 38.045 casos positivos adicionais da doença em 24 horas
edit
França superou nesta quinta-feira (15) o pesado balanço de 100 mil mortos desde o início da epidemia de Covid-19, em meio à terceira onda da infecção viral. Ao mesmo tempo em que as autoridades sanitárias anunciavam 38.045 casos positivos adicionais da doença em 24 horas
edit






Da RFI - Com 300 novas mortes registradas nos hospitais, a França se tornou o segundo país da Europa com o maior número de vítimas do coronavírus, atrás do Reino Unido (127 mil mortes) e da Itália (115 mil). A variante britânica do vírus, mais contagiosa e responsável pela manutenção das infecções num nível elevado, se propaga de forma desigual no território. O norte e o leste do país são os mais afetados, apesar do lockdown em vigor há várias semanas.
Apesar da violência da primeira onda – quase 30 mil mortes entre meados de março e meados de maio de 2020 –, a grande maioria dos óbitos ocorreu desde o final de outubro, cerca de 65 mil, em consequência da segunda onda que nunca arrefeceu. 
Com mais de 5.900 pacientes em Unidades de Tratamento Intensivo (UTIs), o maior desde a primavera de 2020, ""a terceira onda não ficou para trás"", alertou Gabriel Attal, o porta-voz do governo. O pico das hospitalizações deve ser atingido entre 25 e 30 de abril, segundo projeções de epidemiologistas. 




A oposição atribui a duração da crise a medidas tardias do Executivo, que havia descartado o confinamento estrito no final de janeiro, conforme recomendava o conselho científico que assessora o presidente Emmanuel Macron em suas decisões. A oposição critica a ""leveza insuportável"" com que o presidente aguardou até o último momento, no final de março, para decretar um lockdown nacional, incluindo o fechamento das escolas, até o fim de abril. 
Reabertura de restaurantes e museus 
No final da tarde desta quinta-feira, Macron reuniu no Palácio do Eliseu quinze prefeitos para explicar de que maneira o governo planeja reabrir parte dos estabelecimentos fechados há cinco meses em meados de maio. Em seguida, o presidente discutiu as modalidades de reabertura por videoconferência com dez ministros.
Embora haja grande expectativa em relação a esse calendário, a reabertura irá ocorrer em etapas, a cada três semanas, e com algumas condições. O governo ainda estuda se vai exigir um passaporte vacinal ou teste negativo de PCR na forma de QR, que seria exigido de clientes e frequentadores na entrada dos estabelecimentos. 




Em relação às escolas, Macron reafirmou a intenção de retomar as aulas no dia 26 de abril.
Até lá, os obstáculos no caminho ainda serão numerosos. Esta semana, o governo suspendeu às pressas as ligações aéreas com o Brasil, pelo menos até o dia 19 de abril, devido a preocupações com a variante P1, considerada mais perigosa, mas ainda insignificante no território francês – 0,5% dos casos.
Reforço de controle em passageiros provenientes da Guiana Francesa
Por outro lado, os passageiros provenientes da Guiana Francesa, onde a variante brasileira já representa 84% das contaminações, terão de se submeter a dois testes anticovid, um antes do embarque em Caiena, com no máximo 72 horas de validade, e um segundo (antigênico) na chegada ao aeroporto de Orly, na região parisiense. 






Os hospitais no território ultramarino francês acabam de acionar o ""plano branco"" de mobilização dos profissionais da saúde, adiando procedimentos não urgentes e prevendo um afluxo maciço de pacientes nos próximos dias.
Há vários meses, as autoridades francesas reforçaram as operações policiais no rio Oiapoque para evitar a entrada de brasileiros nos 730 quilômetros de fronteira que a França tem com o estado do Amapá. Apesar dos esforços, o policiamento no local sempre teve falhas por se tratar de uma área de floresta, propícia aos esconderijos de garimpeiros e pescadores clandestinos. 

Da RFI - Com 300 novas mortes registradas nos hospitais, a França se tornou o segundo país da Europa com o maior número de vítimas do coronavírus, atrás do Reino Unido (127 mil mortes) e da Itália (115 mil). A variante britânica do vírus, mais contagiosa e responsável pela manutenção das infecções num nível elevado, se propaga de forma desigual no território. O norte e o leste do país são os mais afetados, apesar do lockdown em vigor há várias semanas.
Apesar da violência da primeira onda – quase 30 mil mortes entre meados de março e meados de maio de 2020 –, a grande maioria dos óbitos ocorreu desde o final de outubro, cerca de 65 mil, em consequência da segunda onda que nunca arrefeceu. 
Com mais de 5.900 pacientes em Unidades de Tratamento Intensivo (UTIs), o maior desde a primavera de 2020, ""a terceira onda não ficou para trás"", alertou Gabriel Attal, o porta-voz do governo. O pico das hospitalizações deve ser atingido entre 25 e 30 de abril, segundo projeções de epidemiologistas.
A oposição atribui a duração da crise a medidas tardias do Executivo, que havia descartado o confinamento estrito no final de janeiro, conforme recomendava o conselho científico que assessora o presidente Emmanuel Macron em suas decisões. A oposição critica a ""leveza insuportável"" com que o presidente aguardou até o último momento, no final de março, para decretar um lockdown nacional, incluindo o fechamento das escolas, até o fim de abril. 
No final da tarde desta quinta-feira, Macron reuniu no Palácio do Eliseu quinze prefeitos para explicar de que maneira o governo planeja reabrir parte dos estabelecimentos fechados há cinco meses em meados de maio. Em seguida, o presidente discutiu as modalidades de reabertura por videoconferência com dez ministros.
Embora haja grande expectativa em relação a esse calendário, a reabertura irá ocorrer em etapas, a cada três semanas, e com algumas condições. O governo ainda estuda se vai exigir um passaporte vacinal ou teste negativo de PCR na forma de QR, que seria exigido de clientes e frequentadores na entrada dos estabelecimentos.
Em relação às escolas, Macron reafirmou a intenção de retomar as aulas no dia 26 de abril.
Até lá, os obstáculos no caminho ainda serão numerosos. Esta semana, o governo suspendeu às pressas as ligações aéreas com o Brasil, pelo menos até o dia 19 de abril, devido a preocupações com a variante P1, considerada mais perigosa, mas ainda insignificante no território francês – 0,5% dos casos.
Por outro lado, os passageiros provenientes da Guiana Francesa, onde a variante brasileira já representa 84% das contaminações, terão de se submeter a dois testes anticovid, um antes do embarque em Caiena, com no máximo 72 horas de validade, e um segundo (antigênico) na chegada ao aeroporto de Orly, na região parisiense.
Os hospitais no território ultramarino francês acabam de acionar o ""plano branco"" de mobilização dos profissionais da saúde, adiando procedimentos não urgentes e prevendo um afluxo maciço de pacientes nos próximos dias.
Há vários meses, as autoridades francesas reforçaram as operações policiais no rio Oiapoque para evitar a entrada de brasileiros nos 730 quilômetros de fronteira que a França tem com o estado do Amapá. Apesar dos esforços, o policiamento no local sempre teve falhas por se tratar de uma área de floresta, propícia aos esconderijos de garimpeiros e pescadores clandestinos. 
O conhecimento liberta. Saiba mais. Siga-nos no Telegram.
A você que chegou até aqui, agradecemos muito por valorizar nosso conteúdo. Ao contrário da mídia corporativa, o Brasil 247 e a TV 247 se financiam por meio da sua própria comunidade de leitores e telespectadores. Você pode apoiar a TV 247 e o site Brasil 247 de diversas formas. Veja como em brasil247.com/apoio
Os comentários aqui postados expressam a opinião dos seus autores, responsáveis por seu teor, e não do 247
© 2021 Editora 247 - Todos os Direitos Reservados

";['mundo']
