title;description;content;url;image;publishedAt;source;Texto;categoria
"Raúl Castro se aposenta; saiba cinco fatos sobre o congresso do Partido Comunista de Cuba";Os irmãos Castro estiveram no poder durante mais de seis décadas em Cuba. Com a aposentadoria de Raúl, é o fim de uma era.;"Imagem de rua de Havana em 12 de abril de 2021 — Foto: Alexandre Meneghini/Reuters
1 de 2 Imagem de rua de Havana em 12 de abril de 2021 — Foto: Alexandre Meneghini/Reuters
O congresso do Partido Comunista cubano, que começa nesta sexta-feira (16), e... [4865 chars]";https://g1.globo.com/mundo/noticia/2021/04/16/raul-castro-se-aposenta-saiba-cinco-fatos-sobre-o-congresso-do-partido-comunista-de-cuba.ghtml;https://s2.glbimg.com/vmrYVvGIKLQje3qduL56tadyxpA=/1200x/smart/filters:cover():strip_icc()/i.s3.glbimg.com/v1/AUTH_59edd422c0c84a879bd37670ae4f538a/internal_photos/bs/2021/d/b/dhYcZaSHCF0vT7bLs0NQ/2021-04-13t183523z-1665017870-rc26vm9c7htp-rtrmadp-3-cuba-politics.jpg;2021-04-16T14:40:04Z;G1;"  16/04/2021 11h40    Atualizado  16/04/2021    
  16/04/2021 11h40    Atualizado  16/04/2021    
 Imagem de rua de Havana em 12 de abril de 2021 — Foto: Alexandre Meneghini/Reuters 
 O congresso do Partido Comunista cubano, que começa nesta sexta-feira (16), encerrará mais de seis décadas de governo dos irmãos Fidel e Raúl Castro em Cuba. 
Fidel morreu em 2016. Seu irmão, Raúl, ficou na presidência até 2019. No entanto, ele seguiu no cargo de primeiro-secretário do Partido Comunista, o cargo que acumula mais poder, até agora.
 Veja um vídeo de 2019 sobre reformas na organização do Estado cubano. 
 Cuba volta a ter primeiro-ministro depois de mais de 40 anos 
 Centenas de delegados do partido único se reunirão a partir desta sexta-feira durante quatro dias no Palacio de las Convenciones de Havana para debater as questões centrais do país. 
 Esse encontro acontece 60 anos após Fidel Castro ter proclamado que a revolução na ilha tinha caráter socialista. 
 O evento será parcialmente transmitido pela televisão. 
 Foto de Raúl Castro em entrada de prédio de governo em Havana, em 11 de abril de 2021 — Foto: Alexandre Meneghini/Reuters 
Substituto dos Castro
 A nomeação de Díaz-Canel como novo primeiro-secretário, cargo mais importante de Cuba, poderá ocorrer em sua última sessão, na segunda-feira. 
Aposentadoria em massa
 Além de Raúl Castro, grandes nomes da geração histórica, aquela que fez a revolução de 1959, devem se aposentar, entre eles o número dois do Partido, José Ramón Machado Ventura, de 90 anos, e o comandante Ramiro Valdés, de 88. 
 Nas ruas de Havana, sem turistas devido à pandemia, os cubanos parecem mais preocupados com a escassez de alimentos, as longas filas nos supermercados e a espiral inflacionária desencadeada pela recente unificação das duas moedas que o país tinha. 
 Veja cinco fatos sobre o Congresso do Partido Comunista de Cuba 
1 - Partida de Raúl Castro
 Três anos depois de deixar a Presidência, Raúl Castro, de 89 anos, vai entregar o cargo de primeiro-secretário do partido único ao presidente, Miguel Díaz-Canel, de 60 anos. 
 Ele tem como planos se aposentar para ""cuidar dos seus netos"" e ler livros 
 Isso dará a Díaz-Canel uma margem de manobra maior, já que terá ""o aparato do partido nas mãos"", segundo o ex-diplomata Carlos Alzugaray. 
 No entanto, Raúl poderá continuar próximo do poder, como Deng Xiaoping, na China, que não ocupava nenhum cargo, mas era consultado sobre as principais questões e tinha a última palavra, diz Alzugaray. 
2 - Economia em queda livre
 O país vive sua pior crise econômica em 30 anos. Em 2020, o PIB caiu 11%, e a pandemia de coronavírus paralisou seu motor econômico, o turismo. 
 Os cubanos passam longas horas nas filas dos mercados. 
 ""O oitavo Congresso deve se concentrar em estabelecer objetivos para a reforma"", opina o economista Ricardo Torres, da Universidade de Havana. E enfatiza que a transformação do sistema de propriedade deve ser o principal objetivo, para acelerar a abertura da economia ao setor privado. 
3 - Revolução da internet
 Essa é a grande mudança dos últimos anos em Cuba. A chegada da internet móvel (3G) no fim de 2018 acabou com a impressão de isolamento sentida pelos habitantes da ilha, até então uma das menos conectadas do mundo. 
 Cuba tem apagão nos serviços de telefone e internet 
 Como parte de sua programação, o congresso propôs que o partido seja mais eficaz contra a ""subversão político-ideológica"" nas redes sociais. 
 ""A internet tem sido um facilitador para o crescimento da sociedade civil"", diz Ted Henken, sociólogo americano e autor do livro ""La revolución digital en Cuba"". 
4 - Biden e o desconhecido
 A eleição de Joe Biden como presidente dos Estados Unidos suscitou esperanças em Cuba. Após quatro anos de fortes sanções de Donald Trump, chegou um presidente que prometeu retroceder, pelo menos parcialmente. 
 Três meses após sua posse, ele não disse uma palavra sobre a ilha, e seu governo continua firme em relação aos direitos humanos. 
 Juan González, seu assessor para a América Latina no Conselho de Segurança Nacional, acaba de afirmar que ""Biden não é Barack Obama em sua política para com Cuba"". 
 ""O momento político mudou de maneira importante, o espaço político está muito fechado, porque o governo cubano não respondeu de forma alguma"", disse ele. Gonzáles ainda denunciou a opressão contra os cubanos. 
5 - A esperança de uma vacina
 A detecção dos primeiros casos de coronavírus em Cuba, em março de 2020, foi uma oportunidade de demonstrar os pontos fortes de um modelo que dá grande relevância à saúde. 
 Segundo a Organização Mundial da Saúde (OMS), o país tem 82 médicos para cada 10 mil habitantes (contra 32 na França e 26 nos Estados Unidos). 
 A ilha, com 11,2 milhões de habitantes, registrou 88.445 casos e 487 mortes. 
 Sua outra aposta de desenvolver sua própria vacina também parece estar indo bem, com duas candidatas na fase três e no final dos testes clínicos. 
 O congresso pode ser a ocasião para anunciar o início de uma campanha de vacinação, prevista para junho. 
Veja os vídeos mais assistidos do G1
O que aconteceu hoje, diretamente no seu e-mail
Obrigado!
 Você acaba de se inscrever na newsletter Resumo do dia. 
Veja também




";['mundo']
Começa nesta sexta-feira o 8º Congresso do Partido Comunista de Cuba;Os delegados de várias províncias ao 8º Congresso do Partido que governa Cuba chegaram à capital do país para o evento que começa nesta sexta-feira (16) e vai até a próxima segunda;"Os delegados de várias províncias ao 8º Congresso do Partido que governa Cuba chegaram à capital do país para o evento que começa nesta sexta-feira (16) e vai até a próxima segunda edit
247 - Realiza-se a partir desta sexta-feira (16), o 8º congresso... [473 chars]";https://www.brasil247.com/mundo/comeca-nesta-sexta-feira-o-8-congresso-do-partido-comunista-de-cuba;https://www.brasil247.com/bundles/_themes/swp/daily-theme@sw6147/img/defaultFBShare.jpg;2021-04-16T08:02:31Z;Brasil 247;"Os delegados de várias províncias ao 8º Congresso do Partido que governa Cuba chegaram à capital do país para o evento que começa nesta sexta-feira (16) e vai até a próxima segunda
edit
Os delegados de várias províncias ao 8º Congresso do Partido que governa Cuba chegaram à capital do país para o evento que começa nesta sexta-feira (16) e vai até a próxima segunda
edit






247 - Realiza-se a partir desta sexta-feira (16), o 8º congresso do Partido Conunista de Cuba, que governa a ilha socialista. Entre as decisões previstas está a atualização da Conceituação do Modelo Econômico e Social de Desenvolvimento Socialista de Cuba, e a implementação das Diretrizes da Política Econômica e Social do Partido e do Governo, informa o jornal Granma.
Está prevista também a renovação na cúpula do Partido. O atual dirigente máximo do PC de Cuba é Raúl Castro.  

247 - Realiza-se a partir desta sexta-feira (16), o 8º congresso do Partido Conunista de Cuba, que governa a ilha socialista. Entre as decisões previstas está a atualização da Conceituação do Modelo Econômico e Social de Desenvolvimento Socialista de Cuba, e a implementação das Diretrizes da Política Econômica e Social do Partido e do Governo, informa o jornal Granma.
Está prevista também a renovação na cúpula do Partido. O atual dirigente máximo do PC de Cuba é Raúl Castro.  
O conhecimento liberta. Saiba mais. Siga-nos no Telegram.
A você que chegou até aqui, agradecemos muito por valorizar nosso conteúdo. Ao contrário da mídia corporativa, o Brasil 247 e a TV 247 se financiam por meio da sua própria comunidade de leitores e telespectadores. Você pode apoiar a TV 247 e o site Brasil 247 de diversas formas. Veja como em brasil247.com/apoio
Os comentários aqui postados expressam a opinião dos seus autores, responsáveis por seu teor, e não do 247
© 2021 Editora 247 - Todos os Direitos Reservados

";['mundo']
Concentração de mercado e influência política: entenda por que os EUA querem limitar o domínio das ‘big techs’;Congresso americano aprovou um relatório que abre caminho para novas leis contra práticas monopolistas de gigantes como Google, Facebook e Amazon;RIO - O Congresso americano deu na quinta-feira mais um passo no cerco às gigantes globais de tecnologia. O Comitê de Justiça da Câmara dos Deputados dos Estados Unidos aprovou um relatório que acusa as big techs de comprarem ou aniquilarem empresas ... [6463 chars];https://oglobo.globo.com/economia/concentracao-de-mercado-influencia-politica-entenda-por-que-os-eua-querem-limitar-dominio-das-big-techs-1-24973788;https://ogimg.infoglobo.com.br/economia/24792302-307-eeb/FT1086A/gaf.jpg;2021-04-16T07:30:00Z;O Globo;"RIO - O Congresso americano deu na quinta-feira mais um passo no cerco às gigantes globais de tecnologia. O Comitê de Justiça da Câmara dos Deputados dos Estados Unidos aprovou um relatório que acusa as big techs de comprarem ou aniquilarem empresas de menor porte. 
RIO - O Congresso americano deu na quinta-feira mais um passo no cerco às gigantes globais de tecnologia. O Comitê de Justiça da Câmara dos Deputados dos Estados Unidos aprovou um relatório que acusa as big techs de comprarem ou aniquilarem empresas de menor porte. 
O relatório de mais de 400 páginas aprovado por 24 votos a 17 com apoio de republicanos e democratas é um avanço em relação ao primeiro levantamento feito pelo Congresso sobre as big techs, divulgado em outubro. No alvo estão Google, Amazon, Apple e Facebook.
Ranking global:  Big techs e fabricantes de vacinas se destacam entre as 50 empresas mais inovadoras. Veja a lista
O texto já propunha mudanças significativas na legislação antitruste para limitar o domínio de algumas dessas empresas em seus segmentos. Também trazia exemplos de como elas abusavam de seu poder de mercado, inibindo a concorrência.
Para analistas ouvidos pelo GLOBO, o relatório mostra que há uma disposição crescente das autoridades americanas para impor limites à atuação monopolista das big techs. E as razões não são só econômicas.
A influência política que as redes sociais exercem na sociedade também incomoda. Em comum, especialistas concordam que uma eventual aprovação da legislação nos EUA pode ter impacto para outras partes do mundo.
Para o professor do Instituto de Economia da UFRJ Luiz Carlos Prado, a aprovação do relatório é fruto de um momento no qual as big techs já vinham sob escrutínio público. Dessa forma, a discussão deve se encaminhar para algum tipo de regulação das atividades dessas empresas, mas resta saber qual natureza e abrangência desse controle.
Linha do tempo:  Google está na mira da Justiça americana e europeia há mais de dez anos. Veja todos os processos
Para o economista, ainda há um longo caminho pela frente, pois o relatório não determina o que será feito, mas serve como base para futuras recomendações.
— Ainda está longe de ser conclusivo, pois há muito debate a ser feito e essas empresas possuem influência no Congresso americano. A regulação é feita pelas autoridades americanas, mas essas empresas atuam internacionalmente. Então, precisa se discutir como essa regulação será feita. Que existirá algum tipo de regulação, eu não tenho dúvida, a questão é como será feita — diz.
Prado destaca que o relatório aprovado foca em questões de concorrência, com destaque para evitar a prática de truste, mas há outros pontos como uso de dados e propagação de desinformação que também vêm à tona quando se discute o tema:
Microsoft:  Empresa defende que grupos de mídia negociem com 'big techs' por remuneração de conteúdo
— O poder político e financeiro dessas empresas é tão grande que os Estados precisam impor limites, tanto no que se refere à questão concorrencial quanto em outras atividades.
 O pesquisador do Núcleo de Prospecção e Inteligência Internacional da FGV, Leonardo Neves, também destaca que o poder de lobby dessas empresas pode diluir algumas propostas em futuros projetos de lei.
Ele concorda que o impacto que essas empresas podem provocar na economia e na política favorece as tentativas de regulação:
— O impacto que essas empresas têm tido na vida política gera esse movimento de regulação. A comunidade política está preocupada com a liberdade que elas têm.
Para Neves, as medidas antitruste podem gerar impactos a longo prazo, no sentido de estimularem maior concorrência no futuro. O pesquisador lembra que a prática de crescimento por aquisições de outras empresas é comum no setor de tecnologia, já que muitas dessas grandes empresas têm uma natureza monopolista em suas estratégias.
Likes:  Facebook vai permitir que seus usuários escolham bloquear a contagem de curtidas
— Poucas pessoas teriam tanto interesse de participar do Facebook se tivessem tantas outras redes sociais do tipo. Esse setor pressupõe que terão poucos concorrentes. Essas medidas, se aprovadas, colocam obstáculos na vida dessas empresas. Não acredito que gere grandes impactos a curto prazo. Mas no médio, vão surgir outras companhias com ideias inovadoras que não vão ser compradas e podem tentar rivalizar no futuro
O coordenador da área de direito e tecnologia do ITS, Christian Perrone, diz que tentativas de regulação das gigantes de tecnologia não são uma coisa nova. Ele lembra do uso de medidas antitrustes para limitar a Microsoft na década de 1990.
Também destaca que o presidente Joe Biden nomeou pessoas favoráveis à regulação para cargos no seu governo.
— Esse é mais um movimento nesse contexto, um ponto de partida para avançar na discussão do poder que essas empresas adquiriram. Ainda tem muita água para correr, até para averiguar se os caminhos indicados no relatório são os melhores, como a sociedade civil vai reagir a isso, quais serão os argumentos das companhias.
""Consentimento forçado"":  Nova política de privacidade do WhatsApp é questionada no Ministério da Justiça e na ANPD
O pesquisador define a discussão sobre a regulação no setor de tecnologia como um pêndulo. Foi da euforia do início do século com as inovações às preocupações levantadas a partir da metade da década passada. Perrone também observa que há outros pontos a serem debatidos sobre as big techs, além da concorrência:
— Começamos a entender como essas empresas tem uma importância desproporcional dentro do cenário global. E precisamos avaliar quais impactos uma maior regulação terá. Ainda temos um espaço para buscar meios para avaliar o desafio que não só as big techs como as novas tecnologias nos impõe. Como vamos lidar com desinformação, riscos à privacidade e não somente o tamanho da empresa.
Tim Berners-Lee:  Primeiro ele criou a web, agora quer proteger seus dados e tirar poder das 'big techs'
Com relação ao Brasil, Perrone ressalta que o país ainda é mero espectador do debate, já que funciona mais como um consumidor de tecnologia do que propriamente um criador de ferramentas:
— Estamos um pouco à margem dessa discussão. Sofremos mais os impactos, pois somos mais um consumidor de tecnologia do que um produtor. Como um país do Sul global, temos que olhar como as regulações dessas empresas podem nos afetar, quais serão os impactos para acessos a serviços tecnológicos. 
O Globo, um jornal nacional: Fique por dentro da evolução do jornal mais lido do Brasil

Os comentários são de responsabilidade exclusiva de seus autores e não
representam a opinião deste site. Se achar algo que viole os termos de
uso, denuncie. Leia as perguntas mais frequentes para saber o que é
impróprio ou ilegal


© 1996 - 2021. Todos direitos reservados a Editora Globo S/A. Este material não pode ser publicado, transmitido por broadcast, reescrito ou redistribuído sem autorização.

";['economia']
Raúl Castro se despede e encerra longo capítulo da história;Em poucos dias, Cuba não terá nenhum Castro no poder: o congresso do Partido Comunista, que começa hoje (16), encerrará mais de seis décadas de governo dos irmãos Fidel e Raúl Castro, dando lugar a uma nova geração.Após a morte de Fidel em 2016,;"Em poucos dias, Cuba não terá nenhum Castro no poder: o congresso do Partido Comunista, que começa hoje (16), encerrará mais de seis décadas de governo dos irmãos Fidel e Raúl Castro, dando lugar a uma nova geração.
Após a morte de Fidel em 2016, a a... [4078 chars]";https://noticias.uol.com.br/ultimas-noticias/afp/2021/04/16/raul-castro-se-despede-e-encerra-longo-capitulo-da-historia-cuba.htm;https://conteudo.imguol.com.br/c/noticias/89/2021/04/16/12abr2021---homem-passa-por-outdoor-com-imagens-de-fidel-castro-raul-castro-e-miguel-diaz-canel-em-havana-cuba-1618578596503_v2_615x300.jpg;2021-04-16T03:00:00Z;UOL;"Em Havana
Em Havana
16/04/2021 10h11 
Em poucos dias, Cuba não terá nenhum Castro no poder: o congresso do Partido Comunista, que começa hoje (16), encerrará mais de seis décadas de governo dos irmãos Fidel e Raúl Castro, dando lugar a uma nova geração.
Após a morte de Fidel em 2016, a aposentadoria de Raúl - que está perto de completar 90 anos - e a substituição por Miguel Díaz-Canel (60), viram uma página histórica da ilha. A maioria de seus habitantes não conheceu outra família governante além da dos revolucionários.
""Raúl não vai estar no comando do Partido, mas (para) qualquer problema estará ali. Raúl não morreu"", comenta Ramón Blande, um militante comunista de 84 anos, equipado com uma máscara para se proteger do coronavírus.
E certamente, frisa, Díaz-Canel ainda é ""bastante jovem"", mas ""enfrenta sérios problemas"".
A partir das 9h0 (10h de Brasília), várias centenas de delegados do partido único, de toda a ilha, se reunirão durante quatro dias no Palacio de las Convenciones de Havana, para debater as questões centrais do país.
Este conclave a portas fechadas, que se inicia 60 anos depois de Fidel Castro ter proclamado o caráter socialista da revolução, será transmitido, pelo menos parcialmente, pela televisão.
A nomeação de Díaz-Canel como novo primeiro secretário, cargo mais importante de Cuba, poderá ocorrer em sua última sessão, na segunda-feira.
Junto com Raúl Castro, grandes nomes da geração histórica - aquela que fez a revolução de 1959 - devem se aposentar, entre eles o número dois do Partido, José Ramón Machado Ventura, de 90 anos, e o comandante Ramiro Valdés, de 88.
Nas ruas de Havana, sem turistas devido à pandemia, os cubanos parecem mais preocupados com a escassez de alimentos, as longas filas nos supermercados e a espiral inflacionária desencadeada pela recente unificação das duas moedas que o país tinha.
""Tenho esperança de que com o congresso melhore isso, porque os preços estão muito altos, os salários subiram (...), mas (...) no final as contas não fecham"", lamenta María Martínez, aposentada de 68 anos.
Para Norman McKay, analista da The Economist, ""a saída de (Raúl) Castro é um acontecimento histórico não só porque marca o fim de uma dinastia que já dura mais de 50 anos, mas também porque ocorre em um período de perturbações e dificuldades econômicas significativas"".
""Isso não significa necessariamente que haverá uma mudança abrupta no estilo do partido comunista"", mas ""a internet vai facilitar uma maior demanda por responsabilidade e liberdades, colocando desafios ao governo que serão difíceis para o Partido Comunista ignorar"", acrescenta.
Nos últimos meses, Cuba passou por uma agitação social sem precedentes, impulsionada pela recente chegada da internet móvel, com manifestações de artistas, protestos de dissidentes e mobilizações de outros setores da sociedade civil, como os defensores dos animais.
As redes sociais também ecoam a reivindicação dos jovens por mais liberdade política e de expressão.
""O fato de Raúl Castro ceder a liderança do Partido Comunista em Cuba não é uma mudança real"", escreveu na terça-feira no Twitter o senador americano de origem cubana Marco Rubio. ""Mas uma mudança real já está acontecendo"", observou ele, referindo-se à atual agitação social.
Para o analista político Harold Cárdenas, ""existe um sentimento de grande cansaço na sociedade, cansaço que é uma mistura da política do governo Trump em relação a Cuba da mais alta expressão, com a falta de confiança nos projetos e nas promessas das lideranças cubanas"".
Isso é o que ""a oposição do país está tentando capitalizar"", disse Cárdenas.
As sanções de Donald Trump fizeram desaparecer em 2019 os navios de cruzeiro lotados de turistas americanos, e um ano depois o mesmo aconteceu com as agências da empresa Western Union, por meio da qual os cubanos recebiam remessas de familiares e amigos no exterior.
Os ilhéus também estão angustiados com a ascensão dos mercados que operam em dólares, moeda à qual a maioria deles não tem acesso.
Na presidência do país desde 2018, Díaz-Canel será o primeiro civil a comandar o partido, no qual desenvolveu toda a sua carreira.
Raúl ""deve ser o último (Castro) a ocupar esse cargo"", diz o professor Villanis Vargas, de 47 anos. ""Mas bem, há o revezamento, ele é capacitado e acredito que nosso país vai seguir em frente com isso"".
";['ultimas-noticias', 'afp']
Planalto prevê solução de impasse sobre Orçamento até segunda-feira;"Reunião com integrantes do governo realizada nesta quinta-feira (15/4) tenta buscar ""bom termo"" para questão que gerou crise com o Congresso";O Palácio do Planalto trabalha com a possibilidade de resolver até a próxima segunda-feira (16/4) o impasse que envolve a sanção ou veto do Orçamento de 2021, aprovado no fim de março pelo Congresso Nacional. A expectativa era de solucionar o embate ... [2909 chars];https://www.metropoles.com/colunas/janela-indiscreta/planalto-preve-solucao-de-impasse-sobre-orcamento-ate-segunda-feira;https://uploads.metropoles.com/wp-content/uploads/2020/10/02225840/Guedes-coletiva-economia-9.jpeg;2021-04-15T22:52:48Z;Metrópoles;NA;['colunas', 'janela-indiscreta']
