title;description;content;url;image;publishedAt;source;Texto
A 100 dias das Olimpíadas, saiba as 100 estrelas de Tóquio 2021;Esporte olímpico mundial vive entressafra de estrelas após aposentadorias de Bolt e Phelps;Faltando 100 dias para as Olimpíadas, o blog Brasil em Tóquio elaborou uma lista com as 100 maiores estrelas que estarão nos Jogos de Tóquio. A ideia aqui não é necessariamente colocá-los em ordem de importância, por isso os nomes estão separados por... [14495 chars];https://globoesporte.globo.com/olimpiadas/blogs/brasil-em-toquio/noticia/a-100-dias-das-olimpiadas-saiba-as-100-estrelas-de-toquio-2021.ghtml;https://s2.glbimg.com/RBRc0ZMZ9_rrwe7AZgOqO-Rd9xY=/1200x/smart/filters:cover():strip_icc()/s.glbimg.com/es/ge/f/original/2019/10/13/2019-10-13t134550z_628424896_rc17a3c3d930_rtrmadp_3_gymnastics-world.jpg;2021-04-14T23:01:22Z;globoesporte.com;" Por Guilherme Costa — São Paulo  
 Por Guilherme Costa — São Paulo  
  14/04/2021 20h01    Atualizado  14/04/2021    
 Faltando 100 dias para as Olimpíadas, o blog Brasil em Tóquio elaborou uma lista com as 100 maiores estrelas que estarão nos Jogos de Tóquio. A ideia aqui não é necessariamente colocá-los em ordem de importância, por isso os nomes estão separados por esporte. 
 Alguns nomes ainda não estão 100% confirmados, casos dos astros da NBA e dos principais jogadores de tênis e golfe, mas parti do princípio que todos estarão em Tóquio. Coloquei as estrelas das modalidades, que não são necessariamente os atletas com maior favoritismo ao ouro, e sim aqueles mais importantes para seu respectivo esporte. 
 Simone Biles final solo Mundial de Ginástica — Foto: Wolfgang Rattay/Reuters 
ATLETISMO
 Armand Duplantis (Suécia) - Com apenas 21 anos, é o recordista mundial do salto com vara e super-favorito ao título em Tóquio. 
 Beatrice Chepkoech (Quênia) - Recordista mundial, marca feita em 2018, e também campeã mundial dos 3000m com obstáculos. 
 Christian Taylor (EUA) - Tetracampeão mundial e bicampeão olímpico do salto triplo. 
 Eliud Kipchoge (Quênia) - Atual campeão olímpico da maratona, se tornou em 2019 o primeiro da história a correr (ainda que extra-oficialmente) a maratona em menos de duas horas. 
 Karsten Warholm (Noruega) - Bicampeão mundial dos 400m com barreiras, tem o segundo melhor tempo da história da prova. 
 Katarina Johnson-Thompson (Grã Bretanha) - Campeã mundial do heptatlo, é a atleta mais completa da modalidade. 
 Joshua Cheptegei (Uganda) - Durante a pandemia, bateu os recordes mundiais dos 5000m e 10000m rasos, e é favorito ao ouro nas duas provas. 
 Shelly Ann Fraser (Jamaica) - Dona de seis medalhas olímpicas e onze em Campeonatos Mundiais, nas provas dos 100m, 200m e revezamento 4x100m rasos. 
 Sifan Hassan (Holanda) - Campeã mundial dos 1500m e 10000m rasos e favorita ao ouro nas duas provas. 
 Yulimar Rojas (Venezuela) - Tetracampeã mundial do salto triplo e favorita ao ouro em Tóquio. 
BADMINTON
 Kento Mamota (Japão) - Atual bicampeão mundial e líder do ranking, é favorito ao ouro em Tóquio. 
 Carolina Marin (Espanha) - Campeã olímpica e tricampeã mundial, passou por lesões recentemente e, recuperada, é o maior nome da modalidade. 
BASQUETE
 Diana Taurasi (Estados Unidos) - Assim como Bird, é tetracampeã olímpica. 
 LeBron James (Estados Unidos) - Ainda não confirmou que irá para as Olimpíadas, mas é considerado o melhor jogador dessa geração e tenta o tri olímpico. 
 Stephen Curry (Estados Unidos) - Apesar das lesões recentes, é uma das estrelas da NBA e, se for para Tóquio, disputará sua primeira Olimpíada. 
 Sue Bird (Estados Unidos) - Tetracampeã olímpica e tetra mundial, pode se tornar a primeira pentacampeã da história dos esportes coletivos. 
BEISEBOL/SOFTBOL
 Kelsey Stewart (Estados Unidos) - Grande heroína do título da Copa do Mundo de softbol, conquistado sobre o Japão em uma final histórica. 
 Masahiro Tanaka (Japão) - Com a provável ausência dos jogadores da MLB(Liga americana), o japonês pode ser o grande nome do beisebol nas Olimpíadas. A modalidade é uma febre no Japão. 
BOXE
 Julio Cesar La Cruz (Cuba) - Campeão olímpico e tetracampeão mundial, o cubano ficou ""só"" com o bronze no Mundial de 2019, mas ainda é a maior estrela da modalidade. 
CANOAGEM
 Jessica Fox (Austrália) - Dona de duas medalhas olímpicas e dez títulos mundiais, é o grande nome da canoagem slalom atualmente. 
 Liam Heath (Grã Bretanha) - Bicampeão mundial e campeão olímpico do K1 200m, a prova mais rápida da canoagem mundial. 
 Lisa Carrington (Nova Zelândia) - Favorita absoluta ao ouro no K1 200m, na qual é bicampeã olímpica e hepta mundial. É muito forte também no K1 500m. 
 Sebastian Brendell (Alemanha) - Bicampeão olímpico do C1 1000m, campeão do C2 1000 e dono de 12 títulos mundiais, o alemão é o grande rival dos brasileiros na modalidade. 
CICLISMO
 Anna van der Breggen (Holanda) - dona de duas medalhas olímpicas no ciclismo estrada, e atual campeã mundial tanto na prova de resistência como no contra-relógio. 
 Hannah Roberts (Estados Unidos) - líder do ranking e campeã mundial da categoria que fará a estreia nas Olimpíadas, o ciclismo BMX freestyle. 
 Harrie Lavreysen (Holanda) - Seis vezes campeão mundial no ciclismo pista, é o grande nome das provas em velódromo. 
 Lee Wai Sze (Hong Kong) - campeã mundial das provas de keirin e velocidade no ciclismo pista, é a grande atração da modalidade atualmente. 
 Mariana Pajón (Colômbia) - atual bicampeã olímpica do ciclismo BMX, pode se tornar a primeira sul-americana a ser tri entre qualquer modalidade. 
 Nino Schurter (Suíça) - Heptacampeão mundial do mountain bike e dono de três medalhas olímpicas, é o grande nome da modalidade. 
ESCALADA
 Janja Garnbret (Eslovênia) - Com seis títulos mundiais no currículo e 26 títulos no Circuito Mundial, é o grande nome da modalidade, que faz sua estreia em Olimpíadas. 
ESGRIMA
 Inna Deriglazova (Rússia) - Atual campeã olímpica e dona de seis títulos mundiais, é a favorita na categoria florete e o grande nome na modalidade atualmente. 
 Olha Kharlan (Ucrânia) - Tem apenas 30 anos, conquistou sua primeira medalha olímpica no sabre quando tinha só 18, e é uma das maiores vencedoras da esgrima atual. 
FUTEBOL
 Megan Rapinoe (Estados Unidos) - Melhor jogadora do mundo, bicampeã da Copa do Mundo e ouro nas Olimpíadas de 2012. 
 Marta (Brasil) - Seis vezes a melhor jogadora do mundo, foi prata nas Olimpíadas de 2004 e 2008 e irá disputar sua quinta edição dos Jogos. 
 Neymar (Brasil) - Já deixou clara sua intenção de jogar as Olimpíadas, mas ainda depende de convocações e liberações. Poderá se tornar o primeiro brasileiro com três medalhas no futebol masculino. 
GINÁSTICA
 Dina Averina (Rússia) - Dona de 13 medalhas de ouro em Campeonatos Mundiais, é o grande nome da ginástica rítmica atualmente. 
 Dong Dong (China) - Maior nome da história do trampolim acrobático, tem três medalhas olímpicas e 12 títulos mundiais. 
 Max Whitlock (Grã Bretanha) - Atual campeão olímpico do solo e do cavalo com alças, tem oito medalhas em Campeonatos Mundiais. 
 Nina Derwael (Suíça) - É a principal adversária de Biles nas barras assimétricas, provas na qual é bicampeã mundial. 
 Nikita Nagornyy (Rússia) - Dono de três medalhas de ouro no último Campeonato Mundial, é o grande nome masculino da ginástica artística atualmente. 
 Simone Biles (Estados Unidos) - Dona de quatro medalhas de ouro olímpicas e 19 títulos mundiais, é, talvez, a grande estrela das Olimpíadas entre todas as modalidades. 
GOLFE
 Rory McIlroy (Irlanda) - Nascido na Irlanda do Norte, optou por defender a Irlanda nas Olimpíadas. Tem quatro títulos de Majors na carreira. 
 Ko Jin Young (Coreia do Sul) - Principal nome do golfe feminino atual, ganhou dois Majors na carreira e é a favorita ao ouro nas Olimpíadas 
HANDEBOL
 Mikkel Hansen (Dinamarca) - Campeão olímpico em 2016 e Mundial em 2019, já foi eleito três vezes o melhor jogador do mundo. 
 Stine Bredal (Noruega) - Uma das mais vitoriosas jogadoras deste século, foi eleita a melhor do mundo em 2019. 
HIPISMO
 Isabell Werth (Alemanha) - Com seis medalhas olímpicas e dez títulos mundiais, é o grande nome do hipismo adestramento atual. 
 Steve Guerdat (Suíça) - Campeão olímpico do hipismo saltos é o atual número 1 do mundo na modalidade. 
HÓQUEI NA GRAMA
 Arthur Van Doren (Bélgica) - Campeão da Copa do Mundo e um dos melhores jogadores da atualidade. 
 Eva de Goede (Holanda) - Melhor jogadora do mundo nas duas últimas temporadas, tem no currículo três medalhas olímpicas. 
JUDÔ
 Clarisse Agbegnenou (França) - Tetracampeã mundial e prata nas Olimpíadas do Rio, é o maior nome do judô feminino atualmente. 
 Majlinda Kelmendi (Kosovo) - Atual campeã olímpica, não conquistou grandes resultados nos últimos anos, mas é uma estrela da modalidade por ter levado um país tão pequeno ao topo do pódio. 
 Teddy Riner (França) - Dez vezes campeão mundial, bicampeão olímpica e com apenas uma derrota em torneios internacionais em dez anos. 
KARATÊ
 Rafael Aghayev (Azerbaijão) - Pentacampeão mundial, é a principal estrela da modalidade, e chega, aos 36 anos, com a chance de colocar a cereja no bolo de sua carreira. 
LEVANTAMENTO DE PESO
 Lidia Valentín (Espanha) - Dona de três medalhas olímpicas, não é exatamente favorita ao ouro, mas é uma estrela do levantamento de peso mundial. 
 Lasha Talakhadze (Geórgia) - Campeão olímpico e tetra mundial, levanta 30 quilos a mais do que qualquer adversário na categoria pesado. 
NADO ARTÍSTICO
 Svetlana Romashina (Rússia) - Dona de cinco medalhas de ouro em Olimpíadas e 21 títulos mundiais, jamais perdeu uma competição representando seu país. 
NATAÇÃO
 Adam Peaty (Grã Bretanha) - Atual campeão olímpico e tri mundial nos 100m peito. 
 Caeleb Dressel (Estados Unidos) - Dono de 13 títulos mundiais, é favorito a seis ouros nas Olimpíadas e pode sair da competição como o maior medalhista entre todas as modalidades. 
 Daiya Seto (Japão) - Campeão mundial dos 200m e 400m medley, é a estrela da natação japonesa. 
 Florian Wellbrock (Alemanha) - Atual campeão mundial dos 1500m e da maratona aquática (10km). 
 Katie Ledecky (Estados Unidos) - Cinco vezes medalhista de ouro na Rio 2016 e dona de 15 títulos mundiais, é a grande estrela das provas mais longas da natação. 
 Katinka Hosszú (Hungria) - Dona de cinco medalhas olímpicas e 15 em Campeonatos Mundiais, é uma das favoritas nas provas de medley. 
 Kristóf Milák (Hungria) - Quebrou recentemente o recorde mundial de Michael Phelps nos 200m borboleta, é super favorito ao ouro nessa prova. 
 Rikako Ikee (Japão) - Não é favorita ao pódio, mas sua história de superação após se curar da leucemia, ficar 400 dias sem nadar e conseguir a vaga, a coloca como um dos símbolos das Olimpíadas. 
 Simone Manuel (Estados Unidos) - Tem quatro medalhas olímpicas e 16 em Campeonatos Mundiais, é o maior nome das provas de velocidade da natação. 
PENTATLO MODERNO
 Laura Asadauskaitė (Lituânia) - Aos 37 anos, é uma das mais vitoriosas atletas da história da modalidade, inclusive foi campeã olímpica em 2012. 
POLO AQUÁTICO
 Ashleigh Johnson (Estados Unidos) - Melhor goleira do mundo, campeã olímpica e mundial pelos Estados Unidos. 
 Filip Filipović (Sérvia) - Eleito quatro vezes o melhor jogador do mundo, tem três medalhas olímpicas e 12 títulos da Liga Mundial. 
REMO
 Sanita Pušpure (Irlanda) - Bicampeã mundial da prova individual (skiff simples) e favorita ao título em Tóquio. 
 Valent Sinković (Croácia) - Ao lado do irmão Martin foi campeão olímpico em 2016, mudou de prova (Do skiff duplo para o dois sem) e segue como favorito para Tóquio. 
RUGBY
 Jerry Tuwai (Fiji) - Principal estrela da seleção de Fiji, atual campeã olímpica e uma das favoritas em Tóquio. 
 Sarah Hirini (Nova Zelândia) - Campeã da Copa do Mundo e vice das Olimpíadas, é considerada uma das melhores (se não a melhor) jogadora do mundo. 
SALTOS ORNAMENTAIS
 Shi Tingmao (China) - Campeã olímpica do trampolim individual e sincronizado, tem oito títulos mundiais. 
SKATE
 Nyjah Huston (Estados Unidos) - Tetracampeão mundial e nome a ser batido na categoria street do skate. 
 Pamela Rosa (Brasil) - Campeã mundial e líder do ranking da categoria street 
 Sky Brown (Grã Bretanha) - Vai chegar nas Olimpíadas com 13 anos recém completos, e pode ser a mais jovem atleta de toda competição. Foi bronze no Mundial de 2019. 
SURFE
 Gabriel Medina (Brasil) - Bicampeão mundial e uma das estrelas da modalidade, que fará sua estreia no programa olímpico. 
 Clarissa Moore (Estados Unidos)- Maior nome do surfe feminino atual, é favorita ao título. 
TAEKWONDO
 Jade Jones (taekwondo) - Bicampeã olímpica da cateoria até 57kg, é uma das favoritas para ser tri. 
 Lee Dae Hoon ( taekwondo)- Titular da seleção coreana há uma década, tem duas medalhas olímpicas e quatro em Campeonatos Mundiais. 
TÊNIS
 Naomi Osaka (Japão) - Uma das estrelas do esporte japonês, bicampeã do Australian Open e favorita ao pódio em Tóquio. 
 Novak Djokovic (Sérvia) - Tenista com mais semanas na liderança do ranking mundial na história, tem o bronze olímpico em 2008, mas jamais levou o ouro. 
 Rafael Nadal (Espanha) - Um dos maiores da história, foi ouro em Pequim 2008 no individual, ficou fora de Londres 2012, e na Rio 2016 foi quarto no individual e levou o título nas duplas. 
 Roger Federer (Suíça) - Perto dos 40 anos, já disse ter interesse em disputar as Olimpíadas e tentar o ouro individual que ainda não tem (conquistou duplas em 2008). 
 Serena Williams (tênis) - Uma das maiores da história, tem quatro medalhas de ouro olímpicas (três em duplas e uma no individual). 
TÊNIS DE MESA
 Ma Long (China) - Atual campeão olímpico e tri mundial, é um dos melhores jogadores da história da modalidade. 
TIRO COM ARCO
 Brady Elison (Estados Unidos) - Atual campeão mundial e dono de três medalhas olímpicas. É a estrela da modalidade. 
TIRO ESPORTIVO
 Anna Korakaki (Grécia) - Com duas medalhas olímpicas no currículo e atual campeã mundial, é um dos maiores nomes do tiro esportivo feminino atualmente. 
 Jin Jong Oh (Coreia do Sul)- Quatro vezes campeão olímpico nas provas de pistola, é um dos favoritos em Tóquio. 
TRIATLO
 Alistair Brownlee (Grã Bretanha) - Atual bicampeão olímpico, não está ainda nem classificado para as Olimpíadas, mas é possível que o Comitê britânico o convoque. Há tempos não conquista um título, mas é a estrela da modalidade. 
VELA
 Giles Scott (Grã Bretanha) - Atual campeão olímpico da classe Finn, não competiu muito neste ciclo, mas é uma das estrelas da modalidade. 
 Robert Scheidt (Brasil) - Não é exatamente favorito ao pódio, mas com cinco medalhas olímpicas é um dos maiores velejadores da história. 
VÔLEI DE PRAIA
 Alison (Vôlei de praia)- Campeão olímpico em 2016, campeão mundial em 2015 e um dos melhores bloqueadores de todos os tempos. 
 Walsh (Estados Unidos) - Dona de quatro medalhas olímpicas, vai para sua quinta Olimpíadas. Não é exatamente favorita ao pódio, mas é a grande estrela da modalidade. 
VÔLEI
 Earvin N´Gapeth (França) - Considerado por muitos o melhor jogador do mundo, mas foi eliminado com a sua seleção pelo Brasil na Rio 2016. 
 Paola Egonu (Itália) - Considerada a melhor jogadora do mundo, pode levar a Itália para uma medalha inédita. 
 Wilfredo León (Polônia) - Cubano naturalizado polonês, é um dos melhores jogadores do mundo, tanto nas competições de clubes como por seleções. Mas, historicamente, perde decisões para o Brasil. 
WRESTLING
 Geno Petriashvili (Geórgia) - Tricampeão mundial dos pesos pesados na luta estilo livre, além de ter sido prata na Rio 2016. 
 Mijaín López (Cuba) - Tricampeão olímpico e penta mundial, ainda não está oficialmente classificado para as Olimpíadas, mas dificilmente o Comitê cubano vai excluí-lo. Foi porta-bandeira do país quatro vezes na carreira. 
 Risako Kawai (Japão) - Campeã olímpica e tri mundial, é o grande nome do wrestling feminino, modalidade muito popular no Japão. 
 Guilherme Costa Brasil em Tóquio blog — Foto: Reprodução 
As últimas notícias do ge diretamente no seu e-mail
Obrigado!
 Você acaba de se inscrever na newsletter do ge. 
"
Cristo Redentor ganha iluminação especial para marcar os 100 dias para as Olimpíadas de Tóquio;Ação promovida pelo Comitê Olímpico do Brasil (COB) lembra o poder do esporte em inspirar a sociedade na luta contra a Covid-19. Foram doadas mil cestas básicas para a Arquidiocese do Rio;O Cristo Redentor está de braços abertos para abençoar o Brasil a 100 dias do início dos Jogos Olímpicos de Tóquio. Nesta quarta, o tradicional monumento carioca ganhou uma iluminação especial, alusiva à data emblemática. A ação foi promovida pelo Co... [2196 chars];https://globoesporte.globo.com/olimpiadas/noticia/cristo-redentor-ganha-iluminacao-especial-para-marcar-os-100-dias-para-as-olimpiadas-de-toquio.ghtml;https://s2.glbimg.com/joH8XY5IfVLAmv2nX2gSIagAbbA=/1200x/smart/filters:cover():strip_icc()/i.s3.glbimg.com/v1/AUTH_bc8228b6673f488aa253bbcb03c80ec5/internal_photos/bs/2021/A/v/cEM2HuR6a8f9B957e0vw/whatsapp-image-2021-04-14-at-18.54.50.jpeg;2021-04-14T21:56:38Z;globoesporte.com;" Por Redação do ge — Rio de Janeiro 
 Por Redação do ge — Rio de Janeiro 
  14/04/2021 18h56    Atualizado  14/04/2021    
 O Cristo Redentor está de braços abertos para abençoar o Brasil a 100 dias do início dos Jogos Olímpicos de Tóquio. Nesta quarta, o tradicional monumento carioca ganhou uma iluminação especial, alusiva à data emblemática. A ação foi promovida pelo Comitê Olímpico do Brasil (COB), e o intuito é mostrar como o esporte pode inspirar a sociedade na luta contra a Covid-19. 
 Além da iluminação no Cristo, a iniciativa do COB também contempla a doação, através do Programa Transforma, de mil cestas básicas para a Arquidiocese do Rio, a qual apoia 60 projetos sociais na cidade. 
 Cristo Redentor recebe iluminação alusiva às Olimpíadas de Tóquio 2020 — Foto: Reprodução/Canal Olímpico Brasileiro 
 - Não existe momento mais propício para relembrarmos a importância da saúde e de uma vida mais saudável através da prática esportiva. Não é um dia para celebrar, em respeito a todos os brasileiros que perderam suas vidas, mas é um dia para exercitarmos a solidariedade e a esperança de que dias melhores virão. Não tenho dúvidas de que os Jogos Olímpicos poderão ser um símbolo do início do recomeço - disse o presidente do COB, Paulo Wanderley. 
 A projeção da imagem no Cristo começou às 18h45 desta quarta, apresentando a marca do Comitê Olímpico do Brasil, uma representação do uniforme da delegação e as palavras ""disciplina"", ""respeito"", ""foco"", ""superação"", ""determinação"" e ""coragem"", sobre campos, piscinas, tatames e quadras. 
 Cristo Redentor com o uniforme do Time Brasil — Foto: Julio Cesar Guimarães/COB 
 A exibição se encerrou às 20h20, horário em que os Jogos Olímpicos de Tóquio estarão abertos daqui a exatos 100 dias. 
 - O Brasil e o mundo passam por um momento muito difícil e eu tenho a convicção que o esporte pode nos ajudar a sairmos dessa melhores do que entramos. Respeito, superação e determinação, algumas das palavras que projetamos hoje e que estão presentes no dia a dia dos atletas, devem ser valorizados nesse momento - afirmou Rogério Sampaio, diretor geral do COB e campeão olímpico de judô. 
 Disciplina foi um dos temas projetados no Cristo — Foto: Júlio César Guimarães/COB 
 O tema coragem também foi projetado no Cristo — Foto: Júlio César Guimarães/COB 
 Respeito foi outro valor a ser lembrado — Foto: Júlio César Guimarães/COB 
 Além da iluminação no Cristo, o COB promoveu outras atividades nesta quarta para celebrar os 100 dias para as Olimpíadas. Mais cedo, o Canal Olímpico transmitiu um programa especial direto do centro de treinamento do COB com as participações de Aline Silva (wrestling), Ana Marcela Cunha (maratonas aquáticas), Flávia Saraiva (ginástica artísticas), Mayra Aguiar (judô) e Silvana Lima (surfe). 
 Na atração, dirigentes falaram sobre o planejamento esportivo da entidade e detalhes sobre a logística e protocolos adotados pela Missão Brasileira. Num dos momentos do programa, a correspondente do Canal Olímpico no Japão, Anna Olívia Wermelinger, trouxe um panorama de como andam os preparativos para o mega evento. 
As últimas notícias do ge diretamente no seu e-mail
Obrigado!
 Você acaba de se inscrever na newsletter do ge. 
"
Mineiro 2021: Tombense goleia Boa Esporte e está no G-4;Time da Zona da Mata não toma conhecimento do adversário, mesmo jogando fora de casa;"Jogo adiado
Mineiro 2021: Tombense goleia Boa Esporte e está no G-4
Time da Zona da Mata não toma conhecimento do adversário, mesmo jogando fora de casa
O Tombense está no G-4 do Campeonato Mineiro, faltando duas rodadas para o final da primeira fase... [1068 chars]";https://www.otempo.com.br/superfc/campeonato-mineiro/mineiro-2021-tombense-goleia-boa-esporte-e-esta-no-g-4-1.2472405;https://www.otempo.com.br/image/contentid/policy:1.2472406:1618439305/boa-x-tom-05.jpg?f=3x2&w=620&$p$f$w=2d453f4;2021-04-14T19:30:28Z;O Tempo;"O Tombense está no G-4 do Campeonato Mineiro, faltando duas rodadas para o final da primeira fase. Jogando no Estádio Municipal de Varginha, o time de Tombos não tomou conhecimento do Boa Esporte e goleou os donos da casa por 4 a 1, com dois gols de Keké, novo artilheiro do Estadual, e dois de Daniel Amorim, com um de Jefferson. O resultado leva o Tombense para o quarto lugar da competição, com 16 pontos e deixa o Boa Esporte em situação dramática, com apenas cinco pontos, na vice-lanterna.
O Tombense está no G-4 do Campeonato Mineiro, faltando duas rodadas para o final da primeira fase. Jogando no Estádio Municipal de Varginha, o time de Tombos não tomou conhecimento do Boa Esporte e goleou os donos da casa por 4 a 1, com dois gols de Keké, novo artilheiro do Estadual, e dois de Daniel Amorim, com um de Jefferson. O resultado leva o Tombense para o quarto lugar da competição, com 16 pontos e deixa o Boa Esporte em situação dramática, com apenas cinco pontos, na vice-lanterna.
O  jogo começou equilibrado. A equipe da Zona da Mata abriu o placar com Daniel Amorim, aos 18 minutos, mas levou o empate com Jefferson, aos 39. Aos 46, no entando, Keké deixou o Tombense em vantagem novamente. No segundo tempo, a expulsão de Alex Alves, no primeiro minuto, facilitou a vida dos visitante, que fizeram mais dois gols, com Daniel Amorim e Keké, novamente, e chegaram à quarta vitória no Estadual. 
---
Em tempos de desinformação e pandemia, o jornal O TEMPO reforça o compromisso com o jornalismo mineiro, profissional e de qualidade. Nossa redação produz diariamente informação responsável e que você pode confiar. Continue nos apoiando. Assine O TEMPO.
Ainda não tem uma conta? Cadastre-se
"
