title;description;content;url;image;publishedAt;source;Texto;categoria
EUA estudam aplicação de terceira dose de vacinas contra a Covid-19;Estudos mostram que resposta imunológica das imunizações da Pfizer/BioNTech e Moderna permanece em seu ápice por pelo menos seis meses, e um reforço poderia ser necessário;WASHINGTON — O governo americano já estuda a aplicação de uma terceira dose da vacina contra a Covid-19, em meio a estudos sobre o tempo de proteção que as doses fornecem a que as recebe. Segundo David Kessler, chefe do comitê científico do grupo de ... [2709 chars];https://oglobo.globo.com/mundo/eua-estudam-aplicacao-de-terceira-dose-de-vacinas-contra-covid-19-24973407;https://ogimg.infoglobo.com.br/in/24973398-723-8d3/FT1086A/92481868_FILE-PHOTO-Signs-and-age-groups-are-shown-for-the-Pfizer-and-Moderna-vaccines-at-a-vaccinat.jpg;2021-04-16T00:02:00Z;O Globo;"WASHINGTON — O governo americano já estuda a aplicação de uma terceira dose da vacina contra a Covid-19, em meio a estudos sobre o tempo de proteção que as doses fornecem. Segundo David Kessler, chefe do comitê científico do grupo de trabalho da Casa Branca para a pandemia, reforços poderiam ser necessários entre nove e 12 meses depois do recebimento da segunda dose, hoje considerada a última do processo.
WASHINGTON — O governo americano já estuda a aplicação de uma terceira dose da vacina contra a Covid-19, em meio a estudos sobre o tempo de proteção que as doses fornecem. Segundo David Kessler, chefe do comitê científico do grupo de trabalho da Casa Branca para a pandemia, reforços poderiam ser necessários entre nove e 12 meses depois do recebimento da segunda dose, hoje considerada a última do processo.
— Neste momento, não sabemos tudo — reconheceu Kessler em audiência na Câmara dos Deputados. — Estamos estudando a duração da resposta dos anticorpos.
Foco nos jovens: Apesar do aumento dos casos, vacinação acelerada deve evitar mais mortes pela Covid-19 nos EUA
Essa posição veio depois da divulgação de dados das farmacêuticas Moderna e Pfizer/BioNTech, responsáveis pela maior parte das doses aplicadas nos EUA, sinalizando que a eficácia plena das duas vacinas permanece por até seis meses, o que sugere que uma ou mais doses de reforço seriam necessárias. A vacina da Pfizer/BioNTech tem 95% de eficácia contra a Covid-19, enquanto a da Moderna tem 94,1%, de acordo com estudos clínicos.
— Uma hipótese provável é que seja necessária uma terceira dose, entre seis e 12 meses, e, a partir daí, será necessário se vacinar todos os anos, mas tudo isso tem que ser confirmado — destacou o presidente da Pfizer, Albert Bourla, à CNBC.
Para especialistas, mesmo que dados posteriores mostrem uma proteção mais prolongada, as variantes do novo coronavírus precisam ser levadas em consideração, uma vez que demandam alterações nas vacinas e novas aplicações.
Sem novos imunizantes:EUA podem não precisar de doses da vacina da AstraZeneca, diz Fauci
Segundo o Centro de Controle de Doenças (CDC), 125,8 milhões de pessoas receberam ao menos uma dose das vacinas no país, sendo que 78,5 milhões receberam a segunda dose ou foram imunizadas com a vacina da Janssen, que requer apenas uma aplicação — na terça-feira, as autoridades sanitárias recomendaram a suspensão das aplicações desta vacina, diante de uma suspeita de ligação entre as doses e a formação de um tipo raro de coágulo.
Alta:Casos de coronavírus voltam a aumentar nos EUA por causa do fim de medidas restritivas e de nova variante
Na mesma sessão da Câmara, a diretora do CDC, Rochelle Walensky, afirmou que está monitorando casos de pessoas que foram completamente imunizadas contra a Covid-19, mas mesmo assim foram infectadas. Segundo ela, das 78 milhões de pessoas nessa situação, 5,8 mil se infectaram, sendo que 396 foram hospitalizadas e 74 morreram.
Para ela, isso ocorre porque a resposta imunológica de alguns dos imunizados não se deu de forma adequada, mas alertou para o impacto de variantes mais agressivas do vírus, que já circulam nos Estados Unidos.
O Globo, um jornal nacional: Fique por dentro da evolução do jornal mais lido do Brasil

Os comentários são de responsabilidade exclusiva de seus autores e não
representam a opinião deste site. Se achar algo que viole os termos de
uso, denuncie. Leia as perguntas mais frequentes para saber o que é
impróprio ou ilegal


© 1996 - 2021. Todos direitos reservados a Editora Globo S/A. Este material não pode ser publicado, transmitido por broadcast, reescrito ou redistribuído sem autorização.

";['mundo']
Vítimas da covid-19, casal de idosos morre com dois dias de diferença;Após mais de 50 anos de casamento, o casal que teve 11 filhos morreu com dois dias de diferença;"Foto: Reprodução
A pandemia do novo coronavírus tem feito cada vez mais vítimas em todo o mundo. Só no Espírito Santo, o vírus tirou a vida de 95 pessoas nas últimas 24 horas, elevando o número de óbitos para 8.507 capixabas.
Muito além de números, e... [3235 chars]";https://www.folhavitoria.com.br/geral/noticia/04/2021/vitimas-da-covid-19-casal-de-idosos-morre-com-dois-dias-de-diferenca;https://assets.folhavitoria.com.br/images/fe3a6460-9e3f-11eb-9ba9-57cb2ab02f7d--minified.png;2021-04-15T23:59:54Z;Jornal Folha Vitória;"A pandemia do novo coronavírus tem feito cada vez mais vítimas em todo o mundo. Só no Espírito Santo, o vírus tirou a vida de 95 pessoas nas últimas 24 horas, elevando o número de óbitos para 8.507 capixabas. 
A pandemia do novo coronavírus tem feito cada vez mais vítimas em todo o mundo. Só no Espírito Santo, o vírus tirou a vida de 95 pessoas nas últimas 24 horas, elevando o número de óbitos para 8.507 capixabas. 
Muito além de números, esses dados são histórias de pessoas queridas, como o caso da Celina e do João, que eram casados há mais de 50 anos mas morreram vítimas da covid-19 em um intervalo de dois dias entre cada um.
Uma dupla que além de cuidar, era referência para os filhos. Esta é a definição para a relação de Celina, de 77 anos, e João, 71, quando os filhos lembram dos pais que faleceram vítimas da covid-19.
""Tudo o que eu faço na minha vida hoje eu lembro dos meus pais. Não tem como te falar algo que eu não lembre deles, porque não tem"", disse a filha Paula Jane da Silva.
Quando vieram de Minas Gerais para o Espírito Santo, o casal decidiu morar em Pedro Canário, região norte do estado. Anos se passaram e os dois foram parar no município da Serra, onde tiveram cinco filhos, em Minas Gerais já tinham seis e totalizaram 11, mas um acabou morrendo.
Assim que souberam dos problemas de saúde dos pais, os filhos foram direto para Minas Gerais, mas em nenhum momento desconfiaram que poderia ser  covid-19.
""Meu pai foi picado por um escorpião na região onde eles moravam, que é interior, e ele foi para o hospital, chegando lá ele recebeu o antídoto do escorpião, teve alta, foi para casa e depois que chegou em casa a dor persistiu. O braço começou a ficar dormente e depois ele precisou voltar ao hospital. Quando passou uma semana ele começou com uma tosse seca. Não apresentava outro sintoma, só a tosse"", contou Jane.
Enquanto João sofria com a tosse, a esposa dele estava tranquila e não apresentava nenhum sintoma da doença. Como o casal morava em outro estado, o contato com os filhos era feito apenas por telefone e aplicativos de mensagens. 
Porém, tudo mudou quando os filhos receberam a ligação de uma tia pedindo para que fossem até Minas Gerais buscar o pai, pois ele não estava bem.
Chegando em Minas Gerais, a situação de João e Celina se agravou e eles foram em busca de ajuda médica. Ao se depararem com a situação e descobrirem que os pais precisariam ficar no hospital, os filhos entraram em desespero.
""A médica chegou para mim e falou que meu pai estava gravíssimo e com quase 100% dos dois lados do pulmão comprometido"", lembrou a filha do casal.
Com o passar dos dias, as notícias sobre o estado de saúde do casal não eram animadoras. Mas a situação ficou ainda pior quando a família recebeu a pior notícia. A mulher que era sinônimo de força e exemplo para os filhos não suportou a luta contra o vírus.
""O hospital entrou em contato com o meu irmão dizendo que infelizmente minha mãe tinha partido minutos depois de terminar uma sessão de hemodiálise"", contou.
Dois dias após o sepultamento de Celina, outra triste notícia: a morte do pai, João. Jane lembra que foi a primeira a saber.
""Nós enterramos minha mãe em uma quarta, passou a quinta-feira meu pai começou a apresentar febre. Eu fui ao Jayme ver o boletim do meu pai e quando cheguei lá infelizmente fui eu que recebi a notícia que ele tinha acabado de falecer"".
Uma das filhas do casal, Aparecida Ferreira, ressalta a importância que os pais tiveram para que ela fosse a pessoa que é hoje. ""Nossos pais foram referência para nós. Hoje tudo o que nós somos nós devemos a eles"", disse emocionada.
* Com informações do repórter Douglas Camargo, da TV Vitória/RecordTV
";['geral']
Dois agentes de batalhão em SP são afastados em meio à sindicância de fura fila na vacinação;Suspeitas são de que profissionais da segurança levaram parentes para receberem imunizante contra Covid-19, o que contraria 'determinações claramente emanadas pelo comando da Polícia Militar';RIO — Dois oficiais do 32º Batalhão de Polícia Militar do Interior (BPM/I) em Assis (SP) foram afastados em meio à sindicância aberta nesta semana, que apura se houve fraude na vacinação para profissionais das forças de segurança. As suspeitas levant... [2050 chars];https://oglobo.globo.com/brasil/dois-agentes-de-batalhao-em-sp-sao-afastados-em-meio-sindicancia-de-fura-fila-na-vacinacao-1-24973358;https://ogimg.infoglobo.com.br/in/24973363-0c0-efe/FT1086A/32BPM-Assis-SP.jpg;2021-04-15T23:37:00Z;O Globo;"RIO — Dois oficiais do 32º Batalhão de Polícia Militar do Interior (BPM/I) em Assis (SP) foram afastados em meio à sindicância aberta nesta semana, que apura se houve fraude na vacinação para profissionais das forças de segurança. As suspeitas levantadas até o momento sao de que parentes de alguns agentes foram até o batalhão receberem doses do imunizante contra Covid-19.
RIO — Dois oficiais do 32º Batalhão de Polícia Militar do Interior (BPM/I) em Assis (SP) foram afastados em meio à sindicância aberta nesta semana, que apura se houve fraude na vacinação para profissionais das forças de segurança. As suspeitas levantadas até o momento sao de que parentes de alguns agentes foram até o batalhão receberem doses do imunizante contra Covid-19.
Em nota divulgada nesta quinta-feira, dia 15, a Polícia Militar de São Paulo afirmou ter recbido ""com perplexidade"" a informação de que familiares de policiais teriam sido vacinados na chamada ""xepa"", quando são aproveitadas algumas doses restantes de três frascos já abertos ao final das atividades do dia.
""A operação de vacinação dos profissionais de segurança pública exigiu minucioso planejamento e primorosa execução para imunizar mais de 140 mil agentes em 83 postos de vacinação nos quartéis em 10 dias"", disse a corporação, lembrando que o suposto uso indevido ""contraria determinações claramente emanadas pelo comando da Polícia Militar"". ""A instituição não compactua com desvios de comportamento e o caso está sendo rigorosamente apurado"", acrescentou.
A PMSP ressaltou ter seguido ""as recomendações do PNI (Programa Nacional de Imunizações) e do PEI (Plano Estadual de Imunização) para vacinação contra a Covid-19, assim como os protocolos técnicos de ambas as instâncias"".
Seguindo pedido do Ministério Público de São Paulo, a prefeitura de Assis divulgou, na segunda-feira, dia 12, a lista dos profissionais de Segurança Pública vacinados contra Covid-19. Num comunicado, o governo municipal destacou não ter participado ""de nenhum critério ou avaliação de elegibilidade para a vacinação"" do grupo mencionado.
""Todo o direcionamento, local e horário, organização da fila, pré-cadastramento e registro no sistema VaciVida ficou de total responsabilidade da Policia Militar e da equipe da Penitenciária de Assis"", afirmou.
A prefeitura de Assis informou que foi de sua responsabilidade ""apenas realizar a aplicação do imunizante em parceria com a Grupo de Vigilância Epidemiológica do Estado (GVE 13 – Assis), pois a Policia Militar não tinha profissional qualificado para este fim"". 
""Já a Penitenciária de Assis, que dispõe de uma equipe de saúde, realizou a aplicação da vacina de seus servidores"", acrescentou.
O Globo, um jornal nacional: Fique por dentro da evolução do jornal mais lido do Brasil

Os comentários são de responsabilidade exclusiva de seus autores e não
representam a opinião deste site. Se achar algo que viole os termos de
uso, denuncie. Leia as perguntas mais frequentes para saber o que é
impróprio ou ilegal


© 1996 - 2021. Todos direitos reservados a Editora Globo S/A. Este material não pode ser publicado, transmitido por broadcast, reescrito ou redistribuído sem autorização.

";['brasil']
Kassio nega pedido de Kajuru para que STF mande Senado abrir processo de impeachment de Moraes;Solicitação do senador foi apresentada ao Supremo após a corte determinar instalação da CPI da Covid;"Brasília
O ministro Kassio Nunes Marques rejeitou a ação em que o senador Jorge Kajuru (Podemos-GO) pedia para o STF (Supremo Tribunal Federal) determinar à Mesa Diretora do Senado a abertura do processo de impeachment contra o ministro da corte Alex... [3114 chars]";https://www1.folha.uol.com.br/poder/2021/04/kassio-nega-pedido-de-kajuru-para-que-stf-mande-senado-abrir-processo-de-impeachment-de-moraes.shtml;https://f.i.uol.com.br/fotografia/2020/07/25/15957165635f1cb3d32eda2_1595716563_3x2_xl.jpg;2021-04-15T23:25:00Z;Folha de S.Paulo;"
      Acesse seus artigos salvos em 
Minha Folha,  sua área personalizada
    

      Acesse seus artigos salvos em 
Minha Folha,  sua área personalizada
    

Recurso exclusivo para assinantes

assine
ou
faça login

Assinantes podem liberar 5 acessos por dia para conteúdos da Folha
Assinantes podem liberar 5 acessos por dia para conteúdos da Folha
Assinantes podem liberar 5 acessos por dia para conteúdos da Folha
Gostaria de receber as principais notícias do Brasil e do mundo?
Recurso exclusivo para assinantes

assine
ou
faça login

Assinantes podem liberar 5 acessos por dia para conteúdos da Folha
Assinantes podem liberar 5 acessos por dia para conteúdos da Folha
Assinantes podem liberar 5 acessos por dia para conteúdos da Folha
O ministro Kassio Nunes Marques rejeitou a ação em que o senador Jorge Kajuru (Podemos-GO) pedia para o STF (Supremo Tribunal Federal) determinar à Mesa Diretora do Senado a abertura do processo de impeachment contra o ministro da corte Alexandre de Moraes.
Kassio afirmou que uma decisão a favor da solicitação do parlamentar representaria uma intromissão do Judiciário no Legislativo e violaria a jurisprudência do Supremo sobre o tema.
Kajuru protocolou o processo no STF após o ministro Luís Roberto Barroso mandar, a seu pedido, o Senado instalar a CPI da Covid. 





Poucos dias depois da decisão de Barroso, o senador divulgou o áudio de um telefonema com o presidente Jair Bolsonaro (sem partido) em que o chefe do Executivo criticou a ordem judicial pela criação da comissão parlamentar de inquérito e cobrou de Kajuru que também requeresse ao Supremo a abertura de impeachment de ministros da corte.
A militância bolsonarista incentivou o movimento para que o Senado vote a retirada de Moraes do Supremo.
O ministro é criticado por aliados do presidente pela condução dos inquéritos das fake news e dos atos antidemocráticos, que apuram movimentos próximos de Bolsonaro acusados de atacar as instituições e promover uma rede de notícias falsas.
Correligionários de Bolsonaro dizem ter reunido mais de 3 milhões de assinaturas pelo impeachment de Moraes depois que ele determinou a prisão em flagrante do deputado Daniel Silveira (PSL-RJ) por ter publicado um vídeo com ofensas a ministros do Supremo.
Na decisão em que negou mandar o presidente do Senado, Rodrigo Pacheco (DEM-MG), abrir o processo de impedimento do magistrado, Kassio afirmou que essa é uma decisão interna da Casa Legislativa.
“A jurisprudência da corte já acentuou, sob diferentes ângulos, a independência do Poder Legislativo para processar e julgar as autoridades sujeitas à jurisdição daquele Poder em crimes de responsabilidade”, disse.
""Ante o exposto, denego a ordem de mandado de segurança, por ser manifestamente improcedente a ação, além de contrária à jurisprudência consolidada do Tribunal"", concluiu.
Nesta quinta-feira (15), Kassio também rejeitou ação em que o ex-procurador-geral da República Cláudio Fonteles pedia a reversão da decisão da presidência do Senado de arquivar o pedido de impeachment do ministro Gilmar Mendes.
O magistrado adotou argumento semelhantes ao que usou na ação de Kajuru. ""Cabe ao Poder Legislativo, e apenas a ele, dirigir o processo de impeachment"", disse ao manter o arquivamento do impedimento de Gilmar.
Nesta quarta-feira, Kajuru anunciou que se filiou ao Podemos. O anúncio acontece após ter sido convidado a se retirar do Cidadania, em virtude do vazamento da gravação de conversa telefônica que manteve com o presidente Jair Bolsonaro.
Na gravação, Bolsonaro defende a ampliação da investigação da CPI da Covid para incluir governadores e prefeitos. O presidente também estimula o parlamentar a ingressar com pedido de impeachment de ministros do STF.
O senador declarou na sessão plenária desta quinta-feira (15) que as negociações com o Podemos iniciaram há um ano.
""A partir de hoje, ingresso no partido Podemos. E por quê? Porque, há um ano, um senador que classifico como reserva moral deste país, Alvaro Dias, vem conversando comigo, sabendo que eu sempre falava para ele: 'É meu sonho entrar no Podemos'"", disse o senador.





Recurso exclusivo para assinantes

assine
ou
faça login

Assinantes podem liberar 5 acessos por dia para conteúdos da Folha
Assinantes podem liberar 5 acessos por dia para conteúdos da Folha
Assinantes podem liberar 5 acessos por dia para conteúdos da Folha

      Você já conhece as vantagens de ser assinante da Folha?
      Além de ter acesso a reportagens e colunas, você conta com newsletters exclusivas (conheça aqui).
      Também pode baixar nosso aplicativo gratuito na Apple Store ou na Google Play para receber alertas das principais notícias do dia.
      A sua assinatura nos ajuda a fazer um jornalismo independente e de qualidade. Obrigado!
    

      Mais de 180 reportagens e análises publicadas a cada dia. Um time com mais de 120 colunistas. Um jornalismo profissional que fiscaliza o poder público, veicula notícias proveitosas e inspiradoras, faz contraponto à intolerância das redes sociais e traça uma linha clara entre verdade e mentira. Quanto custa ajudar a produzir esse conteúdo?
    

Os comentários não representam a opinião do jornal; a responsabilidade é do autor da mensagem.

As principais notícias da semana sobre o cenário jurídico e conteúdos exclusivos
Carregando...

            Por 8 votos a 3, corte decidiu anular as condenações e devolver os direitos políticos do ex-presidente
          

            Plano ainda está em discussão e depende da chancela do Ministério da Economia
          

            Remédios foram comprados por um grupo de empresas e doados ao governo federal
          


Copyright Folha de S.Paulo. Todos os direitos reservados. É proibida a reprodução do conteúdo desta página em qualquer meio de comunicação, eletrônico ou impresso, sem autorização escrita da Folhapress.

Cadastro realizado com sucesso!
Por favor, tente mais tarde!
";['poder']
Em luta contra a Covid-19, Portugal alivia lockdown com cautela;Por Catarina Demony e Sergio Goncalves LISBOA (Reuters) - A maior parte das regiões portuguesas irá entrar na terceira fase de atenuação das restrições de;"Por Catarina Demony e Sergio Goncalves
LISBOA (Reuters) – A maior parte das regiões portuguesas irá entrar na terceira fase de atenuação das restrições de lockdown impostas por conta da Covid-19 na semana que vem, mas regras mais rígidas continuarão ... [1433 chars]";https://www.mixvale.com.br/2021/04/15/em-luta-contra-a/;https://www.mixvale.com.br/wp-content/uploads/Reuters_Direct_Media/BrazilOnlineReportWorldNews/tagreuters.com2021binary_LYNXMPEH3E1LT-BASEIMAGE.jpg;2021-04-15T23:24:37Z;Portal Mix Vale;NA;['em-luta-contra-a']
Terceira dose da vacina pode ser necessária daqui um ano, aponta CEO da Pfizer;CEO da Pfizer alerta sobre a possibilidade de um reforço da vacina contra a COVID-19 para manter eficácia da fórmula. Nesses casos, a terceira dose do imunizante seria desenvolvida a partir das novas variantes do coronavírus, atualizando a proteção;No combate ao novo coronavírus (SARS-CoV-2), o CEO da farmacêutica norte-americana Pfizer, Albert Bourla, afirmou que as pessoas “provavelmente” precisarão de uma dose de reforço dos imunizantes contra a COVID-19, o que deve ocorrer em até 12 meses a... [2638 chars];https://canaltech.com.br/saude/terceira-dose-da-vacina-pode-ser-necessaria-daqui-um-ano-aponta-ceo-da-pfizer-182889/;https://ibcdn.canaltech.com.br/OU24RjachkD4fVrryJBhp7UZNQA=/1400x788/smart/i12018.jpeg;2021-04-15T23:20:00Z;Canaltech;"No combate ao novo coronavírus (SARS-CoV-2), o  CEO da farmacêutica norte-americana Pfizer, Albert Bourla, afirmou que as pessoas “provavelmente” precisarão de uma dose de reforço dos imunizantes contra a COVID-19, o que deve ocorrer em até 12 meses após a vacinação completa. Divulgada nesta quinta-feira (15), a declaração do responsável pela vacina Pfizer/BioNTech foi feita durante um programa da rede de televisão CNBC. 
No combate ao novo coronavírus (SARS-CoV-2), o  CEO da farmacêutica norte-americana Pfizer, Albert Bourla, afirmou que as pessoas “provavelmente” precisarão de uma dose de reforço dos imunizantes contra a COVID-19, o que deve ocorrer em até 12 meses após a vacinação completa. Divulgada nesta quinta-feira (15), a declaração do responsável pela vacina Pfizer/BioNTech foi feita durante um programa da rede de televisão CNBC. 
“Um cenário provável é que haja a necessidade de uma terceira dose, algo entre seis e 12 meses e, a partir daí, haverá uma vacinação anual, mas tudo isso precisa ser confirmado. E, novamente, as variantes terão um papel fundamental [no processo]”, explicou o CEO Bourla. Em outras palavras, as doses de reforço devem ser necessárias para combater as novas mutações do coronavírus, mantendo a alta eficácia das fórmulas. Atualmente, a taxa de eficácia do imunizante da Pfizer/BioNTech é estimada em 95% para casos sintomáticos.
No mês de fevereiro, o CEO da Johnson & Johnson, Alex Gorsky, também confirmou a possibilidade de uma vacinação anual contra a COVID-19, de forma semelhante ao que ocorre com a vacinação contra a gripe. Outra questão que ainda é investigada pelos cientistas e pode reforçar a necessidade de uma teceria dose é que não se sabe o tempo máximo de proteção da cada fórmula contra o agente infeccioso.
Ainda nesta quinta-feira, David Kessler, membro da agência norte-americana Food and Drug Administration (FDA) —  com função similar a da Agência Federal de Vigilância Sanitária (Anvisa), no Brasil —, também comentou que as pessoas deverão tomar uma dose de reforço das vacinas contra a COVID-19 para manter a proteção da fórmula contra as novas variantes.  
Na ocasião, Kessler explicou que as vacinas contra a COVID-19, atualmente autorizadas, são altamente protetoras e eficazes contra o coronavírus, mas as novas variantes podem “desafiar” esta eficácia. “Não sabemos tudo neste momento”, afirmou o membro da FDA. “Estamos estudando a durabilidade da resposta do anticorpo”, complementou.
No Brasil, o Instituto Butantan confirmou que existe, sim, a possibilidade de uma dose reforço da CoronaVac contra a COVID-19 na quarta-feira (15). No entanto, esta não seria considerada uma terceira dose, já que a composição do imunizante não deve ser a mesma, mas uma atualização feita a partir das novas variantes em circulação do coronavírus.
""O que o Butantan estuda é atualização da vacina, com a possibilidade de, no próximo ano, aplicar uma outra dose, em razão das novas cepas e da evolução da doença, como ocorre com a vacina da Influenza"", esclareceu, em comunicado.
Fonte: CNBC  
Gostou dessa matéria?
Inscreva seu email no Canaltech para receber atualizações diárias com as últimas notícias do mundo da tecnologia.
";['saude', 'terceira-dose-da-vacina-pode-ser-necessaria-daqui-um-ano-aponta-ceo-da-pfizer-182889']
