title;description;content;url;image;publishedAt;source;Texto
Grêmio e Palmeiras mostram Brasil atrasado no continente?;Colunistas do UOL Esporte analisam se Grêmio e Palmeiras mostram Brasil abaixo do desejado no continente.;"Classificação e Jogos Libertadores
Recopa Sul-Americana
A quarta-feira (14) foi de eliminações de times brasileiros em competições sul-americanas. Enquanto o Grêmio voltou a ser derrotado pelo Independiente del Valle-EQU e acabou caindo precocemente ... [4150 chars]";https://www.uol.com.br/esporte/futebol/ultimas-noticias/2021/04/15/colunistas-gremio-palmeiras.htm;https://conteudo.imguol.com.br/c/esporte/63/2021/04/14/jogadores-do-gremio-lamentam-durante-a-derrota-para-o-independiente-del-valle-pela-libertadores-1618450506882_v2_615x300.jpg;2021-04-15T19:18:00Z;UOL;"Texto em que o autor apresenta e defende suas ideias e opiniões, a partir da interpretação de fatos e dados.
Texto em que o autor apresenta e defende suas ideias e opiniões, a partir da interpretação de fatos e dados.
Do UOL, em Santos (SP)
15/04/2021 13h50Atualizada em 15/04/2021 16h18 
A quarta-feira (14) foi de eliminações de times brasileiros em competições sul-americanas. Enquanto o Grêmio voltou a ser derrotado pelo Independiente del Valle-EQU e acabou caindo precocemente da Copa Libertadores 2021, ainda na fase preliminar, o Palmeiras perdeu nos pênaltis do Defensa y Justicia-ARG e ficou sem o título da Recopa Sul-Americana.
A eliminação precoce do Grêmio na Libertadores, inclusive, resultou na saída do técnico Renato Portaluppi do comando do time. A troca de chefia foi ratificada pelo clube de Porto Alegre nesta quinta-feira (15). Com quatro anos de trabalho, essa era a gestão mais longeva entre as equipes de elite do futebol nacional.
Diante disso, é possível dizer que Grêmio e Palmeiras mostram Brasil abaixo do patamar desejado no continente? Fizemos essa pergunta aos colunistas do UOL Esporte. Veja as respostas:
 
Não vejo comparação possível. Grêmio está fora da Libertadores, Palmeiras é o atual campeão. Os times viveram temporadas completamente diferentes em 2020 e ainda é cedo nesta para avaliar o que podem de fato entregar dentro de campo. Enxergo uma tendência de queda no tricolor gaúcho, depois de anos vitoriosos, e de ascensão no alviverde paulistano, com mais tempo para Abel Ferreira treinar a equipe.ALICIA KLEIN
Querida Conmebol, está difícil manter a amizade
Grêmio em queda, insistência com Renato só se justifica pela idolatria. Palmeiras perdeu a Recopa por uma série de fatores, inclusive a péssima arbitragem e o fato de ter colocado o duelo com o Flamengo pela Supercopa como prioridade. O desgaste físico e emocional cobrou alto. Mas Libertadores é outra conversa por envolver outros times.ANDRÉ ROCHA
City passa barreira com Guardiola na Champions, mas dará o que o PSG gosta
Pois é. Bastou elogiar o nível do Palmeiras diante do Flamengo para que, em seguida, víssemos o que vimos. Faz tempo que o futebol brasileiro está na segunda divisão mundial. Periga cair para terceira enquanto seguir resultadista, defensivista, medíocre. Abel Ferreira não parece capaz de fazer omelete saboroso apesar de todos os ovos que tem. E o Grêmio já vem sendo vítima da arrogância do Renato Portaluppi faz tempo.JUCA KFOURI
Não. Brasil ganhou as duas últimas Libertadores e fez a final da mais recente. Clubes brasileiros não tiveram pré-temporada, nesse calendário indecente que CBF e federações criaram por causa da pandemia. E quando você vai desgastado e com preparação inadequada enfrentar dos times muito bons como Del Valle e Defensa é normal que tenha problemas.MARCEL RIZZO
Conmebol quer vacinar 4 mil pessoas até junho, mas não sabe como fazer isso
O resultado do Grêmio é normal. O Independiente dele Valle é um time em ascensão no continente, já ganhou uma Sul-americana e goleou o Flamengo. O Palmeiras jogou abaixo do que se pode esperar. As férias de Abel Ferreira podem ter atrapalhado.MENON
É tudo sazonal, como sempre no futebol. O Palmeiras tem grande potencial, elenco e patrocínio. Mas é bom o técnico português parar de brigar na beira do campo, pilhando desnecessariamente o time. Já o Grêmio vai continuar oscilando entre as notas 5,5 e 6,8.MILTON NEVES
O Palmeiras virou fogo de palha nas mãos do explosivo Abel!
Seria injusto julgar Palmeiras e Grêmio pelo que apresentaram no último jogo de cada um. Ainda mais com a maratona de jogos em meio à pandemia de covid-19. No caso do Palmeiras, não podemos esquecer da partida espetacular feita contra o Flamengo pela Supercopa do Brasil. Os dois times fizeram uma apresentação muito superior à média do continente. Já o Grêmio vem em queda de rendimento nos últimos meses. Ainda assim, joga dentro da média da elite sul-americana.PERRONE
CBF convoca clubes para reunião com relator do projeto de clube-empresa
Não acho que seja um sinal de decadência do futebol brasileiro no continente. Não custa lembrar que os dois últimos campeões da Libertadores são daqui e a última final foi 100% brazuca. O Grêmio já vem mal há algum tempo. Precisa de uma boa reformulação e talvez até da troca de treinador. Já o Palmeiras precisa, antes de mais nada, se aprimorar em cobranças de pênaltis. A instabilidade em início de temporada é normal. Continua forte em todas as competições que disputar.RENATO MAURÍCIO PRADO
Ó, Abel! Tens que treinar pênaltis, pá!
Sim, pelo elenco e investimento, esperava-se de Grêmio e Palmeiras um desempenho melhor nesses jogos contra Independiente del Valle-EQU e Defensa y Justicia-ARG, respectivamente. Mas nos últimos anos os brasileiros não vêm conseguindo fazer valer sua força diante de times teoricamente inferiores tecnicamente nas competições sul-americanas. Há ainda uma dificuldade enorme dos brasileiros, principalmente, nos mata-matas.RODOLFO RODRIGUES
Real Madrid e Manchester City são os favoritos na semifinal da Champions
Acho que não dá pra traçar exatamente um paralelo entre um e outro. O Grêmio vem em queda há duas temporadas. Não consegue jogar bem com regularidade e ontem poderia até ter vencido não fosse o número absurdo de gols perdidos no 1° tempo. O caso do Palmeiras é um pouco diferente. Busca um crescimento nos últimos meses e no meio desse processo ganhou a Libertadores. Tem oscilações como as de ontem, mas vejo numa evolução natural.RODRIGO COUTINHO
Guia da Libertadores - Tudo sobre o Grupo C
** Este texto não reflete, necessariamente, a opinião do UOL
Depois da eliminação precoce na Libertadores, o Grêmio já voltou aos treinos nesta quinta-feira pensando no jogo...
Após a classificação para a 3ª fase da Copa do Brasil na noite de quarta-feira, 14 de abril, o América-MG se...
Jogador com mais pontos na história da modalidade no mundo inteiro, Oscar Schmidt relembrou em suas redes sociais...
Fãs de Rainbow Six Siege que têm o sonho de seguir carreira na modalidade agora terão ainda mais chances de...
"
Única mulher a presidir federação de futebol recebeu entidade sob 'tiroteio';Michelle Ramalho comanda o esporte na Paraíba e mira futuro da modalidade feminina;"São Paulo
A advogada Michelle Ramalho, 43, construiu parte da carreira com recuperação de empresas falidas. Isso fez com que ele não ficasse chocada em 2018, quando entrou na sede da Federação Paraibana de Futebol (FPF).
Não havia computadores. Docum... [5664 chars]";https://www1.folha.uol.com.br/esporte/2021/04/unica-mulher-a-presidir-federacao-de-futebol-recebeu-entidade-sob-tiroteio.shtml;https://f.i.uol.com.br/fotografia/2021/04/14/161836957560765c2792c39_1618369575_3x2_md.jpg;2021-04-15T16:10:00Z;Folha de S.Paulo;"
      Acesse seus artigos salvos em 
Minha Folha,  sua área personalizada
    

      Acesse seus artigos salvos em 
Minha Folha,  sua área personalizada
    

Recurso exclusivo para assinantes

assine
ou
faça login

Assinantes podem liberar 5 acessos por dia para conteúdos da Folha
Assinantes podem liberar 5 acessos por dia para conteúdos da Folha
Assinantes podem liberar 5 acessos por dia para conteúdos da Folha
Gostaria de receber as principais notícias do Brasil e do mundo?
Recurso exclusivo para assinantes

assine
ou
faça login

Assinantes podem liberar 5 acessos por dia para conteúdos da Folha
Assinantes podem liberar 5 acessos por dia para conteúdos da Folha
Assinantes podem liberar 5 acessos por dia para conteúdos da Folha
A advogada Michelle Ramalho, 43, construiu parte da carreira com recuperação de empresas falidas. Isso fez com que ele não ficasse chocada em 2018, quando entrou na sede da Federação Paraibana de Futebol (FPF).
Não havia computadores. Documentos, fichas de atletas e de clubes eram datilografados em uma máquina de escrever. O arquivo era composto de caixas e mais caixas de papéis. Mesmo hoje, ainda é preciso revirá-las para achar um documento. ""Era um tiroteio no escuro"", compara.
Há pouco mais de dois anos, Ramalho assumiu a presidência da entidade. Tornou-se a única mulher a comandar uma federação estadual de futebol no país.
""Nunca joguei futebol nem fui muito envolvida com o esporte. Você não precisa jogar bola para fazer carreira de gestão, e as pessoas misturam muito isso. O futebol feminino tem superado um estigma e começa a crescer muito"", afirma ela.
Não que a dirigente jamais tivesse tido qualquer contato com clubes antes da federação. Foi advogada do Treze, um dos times mais tradicionais do estado. Também fez defesa da CBF em ações judiciais e integrou a 1ª comissão disciplinar do Superior Tribunal de Justiça Desportiva (STJD).
No momento de maior crise da história do futebol paraibano, alguns dirigentes procuraram uma pessoa de fora, que não tivesse sido cartola de nenhuma equipe. O nome de Michelle foi sugerido. ""Eu tive receio no início, porque o futebol na Paraíba estava muito desgastado. Eu tinha preocupação em como ficaria a minha imagem"", admite.
A ideia de entregar a FPF a alguém sem ligações anteriores com o mundo da bola aconteceu por causa da Operação Cartola. Investigação da Polícia Civil e do Ministério Público da Paraíba desbaratou esquema de manipulação de resultados no futebol do estado em 2018. O então mandatário da federação, Amadeu Rodrigues, acabou afastado.
Ramalho não foi a candidata de consenso. A eleição contra o advogado Eduardo Araújo terminou empatada em 25 votos para cada um. No segundo turno, ela venceu por 26 a 24. Mas jura até hoje não saber quem mudou o voto.
""Nem quero saber, mas já tiveram uns 10 [dirigentes] que vieram me dizer terem sido eles"", conta se divertindo a presidente. Ela ressalta que, se houvesse novo empate, ganharia de qualquer jeito por ser a mais velha.
Por causa das suspeitas contra a arbitragem local, Michelle fez o futebol da Paraíba usar apenas árbitros de outros estados por uma temporada, até que estivesse em funcionamento uma nova escola de arbitragem.
A presidente e seus aliados foram acusados de comprar votos, que seriam trocados por cargos na FPF e de ter sido beneficiada pelo inchaço do colégio eleitoral com clubes amadores que estavam inadimplentes e, na teoria, não poderiam votar.
""Eu nunca prometi emprego para ninguém. Sempre há quem confunda as coisas e ache que, porque votou em mim, vai receber algo em troca. Não existe isso de fazer essa troca. A ideia sempre foi profissionalizar a federação, não distribuir cargos"", afirma.
Ramalho confirma ter ajudado clubes a retornarem à entidade, mas apenas após ter sido eleita. Desde o início da pandemia, em março do ano passado, ela os desobrigou de pagar taxa de registro dos jogadores. Anistiou os valores dos alvarás dos times amadores, mas não dos profissionais. ""Se eu abro mão de tudo, a federação fechas as portas"", argumenta.
Os R$ 120 mil que a CBF deu a cada federação estadual no ano passado, para ajudar as entidades a continuarem abertas durante a pandemia, foram 100% entregues aos clubes e arbitragem. ""O dinheiro seria para pagar a folha de pagamento da FPF. Mas a gente estava em um cenário de terra arrasada e com quadro de funcionários bem enxuto. Melhor passar para os times mesmo.""
É uma decisão política, também. Michelle diz ser difícil cuidar do futebol, às vezes um sacrifício. Mas não pensa em sair, como é comum entre os outros mandatários de federação no país, e já se põe candidata à reeleição em 2022.
Ela não esconde ter recebido a ajuda da CBF na informatização da entidade e na implantação de um novo sistema de registro de atletas. A boa relação pode ser vista pela sua conta no Instagram.
Há fotos ao lado do mandatário da confederação, Rogério Caboclo, do presidente da Fifa, Gianni Infantino, e com a taça da Copa América de 2019. Ela ouviu questionamentos por outra imagem publicada, em que parece junto ao presidente da República, Jair Bolsonaro (sem partido).
""Algumas pessoas reclamaram. Mas a federação tem projetos, quer desenvolver o futebol do estado e tenho de ter uma boa relação com todos. Não posso me deixar levar por divergências"", diz.
Esse não é um assunto que lhe agrade abordar, assim como o da discriminação da mulher no futebol. Ramalho afirma nunca ter tido qualquer problema com isso, talvez por ter aparecido em um momento de emergência e não ser torcedora declarada de nenhum time do estado. Questionada, declara torcer para a seleção brasileira.





Sua atenção está voltada para o futuro do futebol feminino. A verba da federação, com os patrocínios, foi suficiente para realizar apenas dois campeonatos profissionais em 2020. A presidente avisou aos times da segunda divisão que não haveria torneio. Realizou apenas o Paraibano da elite dos homens e das mulheres.
A ideia de Michelle Ramalho é ser uma liderança do futebol feminino em nível nacional. Ela, que foi chefe de delegação da seleção no Mundial de 2019, na França, lista as jogadoras da equipe das quais é próxima, a começar por Marta.
""Eu quero fazer isso porque sou competente, não por ser mulher. É a mesma coisa de quando entro em campo antes de uma partida do campeonato e a torcida começa a gritar. Chamam de 'linda', alguns de 'gostosa'. Já me perguntaram se considero assédio e, para mim, não é. Eu me preocuparia se gritassem 'ladra' ou 'corrupta'. Isso ninguém grita. Então significa que estou indo bem.""
Recurso exclusivo para assinantes

assine
ou
faça login

Assinantes podem liberar 5 acessos por dia para conteúdos da Folha
Assinantes podem liberar 5 acessos por dia para conteúdos da Folha
Assinantes podem liberar 5 acessos por dia para conteúdos da Folha

      Você já conhece as vantagens de ser assinante da Folha?
      Além de ter acesso a reportagens e colunas, você conta com newsletters exclusivas (conheça aqui).
      Também pode baixar nosso aplicativo gratuito na Apple Store ou na Google Play para receber alertas das principais notícias do dia.
      A sua assinatura nos ajuda a fazer um jornalismo independente e de qualidade. Obrigado!
    

      Mais de 180 reportagens e análises publicadas a cada dia. Um time com mais de 120 colunistas. Um jornalismo profissional que fiscaliza o poder público, veicula notícias proveitosas e inspiradoras, faz contraponto à intolerância das redes sociais e traça uma linha clara entre verdade e mentira. Quanto custa ajudar a produzir esse conteúdo?
    

Os comentários não representam a opinião do jornal; a responsabilidade é do autor da mensagem.

Carregando...

            Por 8 votos a 3, corte decidiu anular as condenações e devolver os direitos políticos do ex-presidente
          

            Projeto da LDO de 2022 destrava despesas com investimentos caso haja atraso na aprovação das contas do ano
          

            Ex-funcionário de empresa de disparo em massa é o 3º a ser responsabilizado por ofensas de cunho sexual contra jornalista Patrícia Campos Mello
          


Copyright Folha de S.Paulo. Todos os direitos reservados. É proibida a reprodução do conteúdo desta página em qualquer meio de comunicação, eletrônico ou impresso, sem autorização escrita da Folhapress.

Cadastro realizado com sucesso!
Por favor, tente mais tarde!
"
