index;source;author;title;description;url;urlToImage;publishedAt;content;Texto
2;google-news-br;;Twitter coloca aviso de publicação enganosa em post de Eduardo Bolsonaro sobre 'lockdown';Mensagem do deputado, filho do presidente Jair Bolsonaro, não pode mais ser curtida ou respondida, mas ainda pode ser visualizada. Para Twitter, post contém 'informações enganosas e potencialmente prejudiciais relacionadas à Covid-19'.;https://g1.globo.com/bemestar/coronavirus/noticia/2021/04/12/twitter-coloca-aviso-de-publicacao-enganosa-em-post-de-eduardo-bolsonaro-sobre-lockdown.ghtml;https://s2.glbimg.com/1VsmAZR2p5p4YmdXZ7n7U_rEwYw=/1200x/smart/filters:cover():strip_icc()/i.s3.glbimg.com/v1/AUTH_59edd422c0c84a879bd37670ae4f538a/internal_photos/bs/2019/A/A/fYrLAPQwSmMdOI2LW7kg/000-1n34j9.jpg;2021-04-13T02:34:00+00:00;"O Twitter colocou um aviso de ""publicação de informações enganosas e potencialmente prejudiciais relacionadas à Covid-19"" em um post do deputado federal Eduardo Bolsonaro (PSL-SP). Na mensagem, o par… [+3273 chars]";" Por G1 
 Por G1 
  12/04/2021 23h34    Atualizado  13/04/2021    
 Deputado federal Eduardo Bolsonaro, ao discursar na inauguração do escritório da Apex em Jerusalém, em 2019 — Foto: Gil Cohen-Magen/AFP 
 O Twitter colocou um aviso de ""publicação de informações enganosas e potencialmente prejudiciais relacionadas à Covid-19"" em um post do deputado federal Eduardo Bolsonaro (PSL-SP). Na mensagem, o parlamentar, filho do presidente Jair Bolsonaro (sem partido), fala sobre ""lockdown"" e distanciamento social. 
 O texto, publicado na tarde desta segunda-feira (12), afirma que ""com as pessoas ficando em casa, a proliferação do coronavírus aumenta"". 
""Lockdown é o oposto de distanciamento social. No lockdown as pessoas são condenadas a ficarem confinadas em casa, aumentando a proliferação do vírus"", diz a mensagem.
Twitter vai desativar conta que desrespeitar 5 vezes as regras de desinformação sobre Covid-19O que acontece quando um post no Twitter é marcado como enganoso
 A rede social não apagou o texto, mas colocou um aviso de que a mensagem viola as regras de publicação de informações enganosas. 
 Segundo o Twitter, foi determinado que o conteúdo pode ser de interesse público e, por conta disso, manteve o texto acessível. Não aparecem mais curtidas, retuítes e não é mais possível responder à mensagem. 
 Publicação de Eduardo Bolsonaro recebeu aviso de 'publicação enganosa' no Twitter — Foto: Reprodução/Twitter 
Eduardo já culpou China por coronavírus
 Em março de 2020, Eduardo Bolsonaro publicou uma mensagem no Twitter, dizendo que a ""culpa"" pela crise do coronavírus é da China. A mensagem não foi apagada nem recebeu aviso pela rede social. 
 ""Quem assistiu Chernobyl vai entender o q ocorreu. Substitua a usina nuclear pelo coronavírus e a ditadura soviética pela chinesa. [...] +1 vez uma ditadura preferiu esconder algo grave a expor tendo desgaste, mas q salvaria inúmeras vidas. [...] A culpa é da China e liberdade seria a solução"", publicou Eduardo Bolsonaro. 
 O texto fez com que Rodrigo Maia (DEM-RJ), então presidente da Câmara, pedisse desculpas à China pela mensagem do deputado. O embaixador da China no Brasil, Yang Wanming, também repudiou a publicação do deputado e exigiu pedido de desculpas. 
Posts do presidente apagados em 2020
 Esta não foi a primeira vez que o Twitter agiu contra postagens dos Bolsonaro. Em março de 2020, tuítes do presidente foram apagados também por violação de regras relacionadas a conteúdos que envolviam a pandemia. 
 Na ocasião, foram tirados do ar posts que registravam um passeio de Bolsonaro em Brasília, que provocou aglomerações, e o posicionamento dele contra o isolamento social, defendido por autoridades de saúde do mundo inteiro. 
 Nas regras sobre remoção de conteúdo que envolva desinformação sobre a Covid-19, em texto de julho passado, a rede social apontou o que leva em conta ao considerar essa medida. Podem ser alvos posts que: 
reflitam não uma opinião, mas algo apontado como fato, e, entre os exemplos, o Twitter cita postagens que abordem supostas medidas preventivas contra a doença, tratamentos ou curas;tenham sido apontados como falsos ou enganosos por especialistas no assunto, como autoridades de saúde pública;possam causar danos se as pessoas acreditarem nessa informação, da forma como ela foi apresentada, podendo levar a uma maior exposição ao vírus ou afetar a capacidade do sistema de saúde de lidar com a pandemia, por exemplo.
 A plataforma afirma ainda que, em vez de remover um post, poderá colocar um advertência no tuíte, nos casos em que o risco de dano seja menos grave, mas, ainda assim, possam confundir as pessoas. E que isso reduz a visibilidade da postagem. 
O que aconteceu hoje, diretamente no seu e-mail
Obrigado!
 Você acaba de se inscrever na newsletter Resumo do dia. 
Veja também




"
3;google-news-br;André Siqueira;'Nunca mais falo com ele, a relação com Bolsonaro está rompida', diz Kajuru;Na esteira da decisão do ministro Luís Roberto Barroso, do Supremo Tribunal Federal (STF), que determinou que o presidente do Senado, Rodrigo Pacheco (DEM-MG), instalasse a Comissão Parlamentar de Inquérito (CPI) da Covid-19, para apurar supostas omissões do …;https://jovempan.com.br/noticias/politica/nunca-mais-falo-com-ele-a-relacao-com-bolsonaro-esta-rompida-diz-kajuru.html;https://jpimg.com.br/uploads/2021/03/kajuru.jpg;2021-04-13T00:05:12+00:00;Na esteira da decisão do ministro Luís Roberto Barroso, do Supremo Tribunal Federal (STF), que determinou que o presidente do Senado, Rodrigo Pacheco (DEM-MG), instalasse a Comissão Parlamentar de In… [+6452 chars];"Em entrevista à Jovem Pan, senador explicou por que fez ligação ao presidente da República, ressaltou que não se arrependeu do episódio e rebateu Flávio Bolsonaro: ‘Nunca fui denunciado por corrupção’
Em entrevista à Jovem Pan, senador explicou por que fez ligação ao presidente da República, ressaltou que não se arrependeu do episódio e rebateu Flávio Bolsonaro: ‘Nunca fui denunciado por corrupção’
Na esteira da decisão do ministro Luís Roberto Barroso, do Supremo Tribunal Federal (STF), que determinou que o presidente do Senado, Rodrigo Pacheco (DEM-MG), instalasse a Comissão Parlamentar de Inquérito (CPI) da Covid-19, para apurar supostas omissões do governo federal no combate à pandemia do novo coronavírus, o senador Jorge Kajuru (Cidadania-GO) divulgou uma conversa telefônica com o presidente Jair Bolsonaro sobre a ampliação do escopo da comissão, a fim de que a gestão de prefeitos e governadores também seja incluída no rol de investigados. O diálogo caiu como uma bomba em Brasília e gerou repercussão imediata de representantes dos três Poderes.
Na manhã desta segunda-feira, 12, Bolsonaro criticou a divulgação da conversa, que, segundo ele, só poderia ocorrer com autorização judicial. Como a Jovem Pan mostrou, o filho do presidente, senador Flávio Bolsonaro, decidiu representar contra Kajuru no Conselho de Ética, por quebra de decoro parlamentar. Em paralelo, o senador Eduardo Girão (Podemos-CE) anunciou que conseguiu as assinaturas necessárias para a criação de uma CPI para investigar Estados e municípios – Pacheco fará uma consulta à Secretaria-Geral da Mesa Diretora sobre a legalidade deste pedido, uma vez que o regimento interno do Senado prevê que não serão admitidas comissões parlamentares de inquérito sobre fatos inerentes a Estados. Em entrevista à Jovem Pan, Kajuru falou sobre a repercussão da conversa e disparou: “Nunca mais falo com ele [Jair Bolsonaro]. Está rompida a relação. A relação que era boa, cordial e respeitosa, acabou. Eu não guardo rancor. Não serei contra o governo dele, porque ser contra ele é ser contra o Brasil. Mas a relação está rompida”. O parlamentar também explica que ligou ao presidente para “defender a minha honra e a de meus colegas senadores, desrespeitados por ele [Bolsonaro] e chamados de canalhada”. Confira abaixo os principais trechos da entrevista:
Por que o senhor resolveu telefonar ao presidente? Para defender a minha honra e a honra dos meus colegas senadores, desrespeitados por ele, colocados na mesma vala, chamados de canalhada. Eu liguei para ele, pedi para que ele avisasse, em uma futura entrevista, que eu havia ligado. Liguei porque estava levando porrada de bolsonaristas, da turma dele, como se eu tivesse sido contra incluir governadores e prefeitos na CPI. Eu sempre defendi que a CPI deveria ser ampliada. Ela tinha que começar pelo governo federal, mas não podia ser só o governo federal. No final da conversa, ele me prometeu que daria uma entrevista dizendo que o Kajuru queria uma CPI completa e ampliada.
O senhor deixou claro que divulgaria a conversa? Sim. Às 12h40 do domingo avisei, 20 minutos antes de [a conversa] ir ao ar. Ele me disse que não tinha nada para esconder de ninguém. Ele ainda me deu os parabéns porque o avisei que Girão estava conseguido as assinaturas para o requerimento de inclusão de Estados e municípios, e também porque avisei que o senador Alessandro Vieira havia apresentado um termo de aditamento com pedido semelhante.
Mas hoje de manhã o presidente criticou o senhor… No momento claquete, com aquele pessoal que fala “mito”, que fala “eu te amo”, ele resolveu me culpar porque alguém chamou sua atenção. Se ele tivesse ficado puto comigo, poderia muito bem ter dado uma entrevista em algum momento do domingo, porque a imprensa está na porta do Palácio o dia todo. Ele poderia ter falado. Só falou às 10h de hoje porque alguém chamou sua atenção e disse “culpe o Kajuru”. Só que ele está esquecendo que o Kajuru é preparado, tem 40 anos de imprensa, de jornalista. Eu gravo tudo, ofereço à Justiça o que ela quiser e precisar.
Como o senhor avalia o pedido de CPI feito pelo senador Eduardo Girão? Incluir Estados e 5.570 municípios em uma CPI que também irá apurar as ações da União não torna a comissão contraproducente? Se fizermos as duas CPIs juntas, por 90 dias, você beneficia o governo, porque tira ele do foco. O prazo de 90 dias passa rapidamente. Elas têm que ser feitas ao mesmo tempo, mas de forma separada, com procedimentos separados.
O regimento interno do Senado deixa claro, no artigo 146, que não serão admitidas CPIs que tratem sobre assuntos inerentes a Estados, por exemplo. Insistir no pedido do senador Girão não é um contrassenso? Eu penso totalmente diferente. Ela pode, sim, ser feita. Mas, para ser apensada, colocar tudo junto, temos que aumentar para 180 dias o prazo, porque CPI não ocorre todo dia. O senador tem que viajar, ir para as suas bases, já pensam em 2022. Se a CPI pudesse ser feita de segunda a sexta, com a concordância dos 18 integrantes, tudo bem. Mas como isso é sonho, que sejam separadas. Se colocar tudo junto, você beneficia o governo federal, tira ele do foco principal. Ele é o primeiro plano. Os governadores e prefeitos têm que ser investigados, senão a CPI será revanchista.
Mas como conduzir uma CPI, que tem a pretensão de ouvir diversas especialistas, parlamentares, ministros de Estado, neste momento da pandemia? Um eventual convocado pode alegar questões sanitárias para evitar o deslocamento até Brasília… Façamos remotamente. Oitivas remotas. A análise de documento pode ser feita presencialmente. Documento não passa Covid-19 para ninguém, não é? A CPI pode ser realizada. Ela não foi instalada anteriormente por conta da decisão do presidente Rodrigo Pacheco, que agora obedeceu a lei.
O senhor foi atacado por apoiadores e criticado pelo próprio presidente. Se arrepende de ter feito a ligação? Jamais. Em nenhum momento me arrependo. Eu tenho 40 anos de profissão. Meus amigos me apoiam abertamente. Um homem pode ser qualificado pela escolha de amigos e inimigos. Os amigos estão do meu lado.
Mesmo afirmando que não se arrepende, o senhor pretende dar algum outro conselho ao presidente? Nunca mais falo com ele, está rompida a relação. A relação que era boa, cordial e respeitosa, acabou. Eu não guardo rancor. Não serei contra o governo dele, porque ser contra ele é ser contra o Brasil. Mas a relação está rompida.
O senador Flávio Bolsonaro apresentou uma representação contra o senhor no Conselho de Ética. O que pensa sobre isso? Eu morri de rir.  Quem tem que ir ao Conselho de ética é ele. Eu nunca fui denunciado por crime nenhum. Ele tem que ter coragem de aceitar ir ao Conselho de Ética para explicar a denúncia contra ele. Nunca fui denunciado por corrupção, fui processado por opiniões políticas, por dirigentes de futebol e por criticar pessoas da televisão. Contra a minha honra nunca tive nada. Eu o convidei para ir junto comigo ao Conselho. [Espero] Que ele tenha coragem de ir se explicar sobre o que é denunciado.
"
4;google-news-br;Danilo Vital;Rosa Weber suspende flexibilização de posse de armas feita por Bolsonaro;Os quatro decretos editados pelo presidente Jair Bolsonaro para flexibilizar as regras para aquisição de armas de fogo e munições no país que entraram em vigor nesta segunda-feira (12/4), ao inovarem na ordem jurídica, fragilizaram o programa normativo estabe…;https://www.conjur.com.br/2021-abr-12/rosa-suspende-flexibilizacao-posse-armas-feita-bolsonaro;https://s.conjur.com.br/img/b/ministra-rosa-weber-20202.jpeg;2021-04-12T23:54:00+00:00;Os quatro decretos editados pelo presidente Jair Bolsonaro para flexibilizar as regras para aquisição de armas de fogo e munições no país que entraram em vigor nesta segunda-feira (12/4), ao inovarem… [+4876 chars];NA
5;google-news-br;Daniel Gullino;Em conversa gravada, Bolsonaro disse que teria que 'sair na porrada' com Randolfe por conta de CPI;Kajuru afirmou que que não publicou originalmente trecho de diálogo para 'proteger' presidente;https://oglobo.globo.com/brasil/em-conversa-gravada-bolsonaro-disse-que-teria-que-sair-na-porrada-com-randolfe-por-conta-de-cpi-24966858;https://ogimg.infoglobo.com.br/in/24576441-b90-aca/FT1086A/46332271532_c6503c9528_o.jpg;2021-04-12T13:52:30+00:00;"BRASÍLIA O presidente Jair Bolsonaro afirmou, em conversa gravada com o senador Jorge Kajuru (Cidadania-GO), que teria que ""sair na porrada"" com o senador Randolfe Rodrigues (Rede-AP), autor do reque… [+6489 chars]";"BRASÍLIA — O presidente Jair Bolsonaro afirmou, em conversa gravada com o senador Jorge Kajuru (Cidadania-GO), que teria que ""sair na porrada"" com o senador Randolfe Rodrigues (Rede-AP), autor do requerimento de abertura da Comissão Parlamentar de Inquérito (CPI) destinada a apurar omissões do governo federal na pandemia de Covid-19.
BRASÍLIA — O presidente Jair Bolsonaro afirmou, em conversa gravada com o senador Jorge Kajuru (Cidadania-GO), que teria que ""sair na porrada"" com o senador Randolfe Rodrigues (Rede-AP), autor do requerimento de abertura da Comissão Parlamentar de Inquérito (CPI) destinada a apurar omissões do governo federal na pandemia de Covid-19.
A declaração ocorreu em conversa entre os dois no sábado. Kajuru já havia publicado no domingo a maior parte do diálogo, que trata da ampliação do escopo da CPI, mas divulgou o novo trecho nesta segunda-feira, em entrevista à Rádio Bandeirantes.
Bernardo Mello Franco: A obsessão de Bolsonaro com Randolfe Rodrigues
— Se você não participa (da CPI), daí a canalhada lá do Randolfe Rodrigues vai participar. E vai começar a encher o saco. Daí, vou ter que sair na porrada com um bosta desse — diz Bolsonaro, na gravação apresentada por Kajuru durante a entrevista.
Ao GLOBO, Kajuru disse que havia optado por não publicar esse trecho para proteger tanto Randolfe quanto Bolsonaro. Ele mudou de ideia, no entanto, após Bolsonaro defender a divulgação da íntegra:
— Eu resolvi tirá-la, não coloquei no ar, por dois motivos. Primeiro, não queria ver o meu colega, meu amigo, Randolfe Rodrigues, que é o criador da CPI, desrespeitado pelo presidente. Segundo, para o presidente seria ruim porque outros senadores evidentemente seriam solidários ao Randolfe.
Mais cedo, em conversa com apoiadores no Palácio da Alvorada, o presidente criticou Kajuru por ter gravado a conversa. Ele defendeu, contudo, a divulgação da íntegra.
— Não é vazar. É te gravar. Gravação só com autorização judicial. Gravar o presidente e divulgar...E outra, só para controle, falei mais coisa naquela conversa. Pode divulgar tudo, da minha parte. 
Apesar da reclamação de Bolsonaro, Kajuru afirmou que avisou ao presidente que iria divulgar a conversa entre os dois e que ele não se opôs, e disse que já havia feito isso antes.
— Eu coloquei no ar 13h. 12h40 eu liguei para dar duas notícias para ele. A primeira, que o senador Alessandro Vieira tinha feito um requerimento para a CPI investigar governadores e prefeitos, que era desejo dele. Falei para ele: ""daqui a pouco vou colocar nosso papo no ar"". Despedi dele, coloquei no ar. Já fiz várias vezes conversas por telefone com ele e coloquei no ar. Quando interessava para ele, ele não reclamava.
Sonar:Randolfe Rodrigues lista 14 pontos a serem apurados pela CPI da Pandemia: ‘do que Bolsonaro tem medo?’
O senador relatou que não avisou Bolsonaro que estava gravando a conversa no momento do diálogo, mas disse que o motivo é que naquele momento não sabia se iria publicar.
— Não (avisei). Porque eu não sabia se colocar no ar. Simplesmente gravei para ter. Eu gravo todo mundo que conversa comigo. É um direito meu.
Apesar de Bolsonaro afirmar que a gravação só poderia ter ocorrido com uma autorização judicial, a legislação não proíbe gravações telefônicas realizadas por uma das partes da conversa. A interceptação telefônica, quando a conversa é gravada por um terceiro não envolvido no diálogo, é que exige autorização judicial. 

Após a divulgação da fala, Randolfe afirmou, em sua conta no Twitter, que ""a violência costuma ser uma saída para os covardes que têm muito a esconder"".
Também nesta segunda, o senador Flávio Bolsonaro (Republicanos-RJ) entrou com representação no Conselho de Ética do Senado contra Kajuru.
O Globo, um jornal nacional: Fique por dentro da evolução do jornal mais lido do Brasil

Os comentários são de responsabilidade exclusiva de seus autores e não
representam a opinião deste site. Se achar algo que viole os termos de
uso, denuncie. Leia as perguntas mais frequentes para saber o que é
impróprio ou ilegal


© 1996 - 2021. Todos direitos reservados a Editora Globo S/A. Este material não pode ser publicado, transmitido por broadcast, reescrito ou redistribuído sem autorização.

"
