index;source;author;title;description;url;urlToImage;publishedAt;content;Texto
0;google-news-br;;Índia registra recorde de 200 mil novos casos de Covid e passa de 14 milhões de infectados;País de 1,3 bilhão de habitantes sofre uma grande 2ª onda de infecções. Capital Nova Délhi anunciou toque de recolher no fim de semana.;https://g1.globo.com/mundo/noticia/2021/04/15/india-registra-recorde-de-200-mil-novos-casos-de-covid-e-passa-de-14-milhoes-de-infectados.ghtml;https://s2.glbimg.com/tuoHV5_gt19EjSTf8dIM2z7hvN0=/1200x/smart/filters:cover():strip_icc()/i.s3.glbimg.com/v1/AUTH_59edd422c0c84a879bd37670ae4f538a/internal_photos/bs/2021/u/s/Xid2myRLuK07ST9cFJhg/ap21104315245917.jpg;2021-04-15T09:56:29+00:00;A Índia registrou um recorde de 200 mil novos casos de Covid-19 nas últimas 24 horas e passou de 14 milhões de infectados, apontam dados oficiais divulgados nesta quinta-feira (15). O país de 1,3 bil… [+3339 chars];" Por G1 
 Por G1 
  15/04/2021 06h56    Atualizado  15/04/2021    
 Índia bate novo recorde de casos diários da Covid-19, com mais de 200.700 mil registros em 24 horas 
 A Índia registrou um recorde de 200 mil novos casos de Covid-19 nas últimas 24 horas e passou de 14 milhões de infectados, apontam dados oficiais divulgados nesta quinta-feira (15). 
O país de 1,3 bilhão de habitantes sofre uma grande segunda onda de infecções e se tornou o segundo do mundo a confirmar mais de 200 mil casos em um único dia. A Índia vive período de festivais religiosos, com desrespeito às medidas para combater a pandemia mesmo com hospitais lotados.
 Corpo de homem que morreu de Covid-19 é colocado em ambulância em meio à pandemia do novo coronavírus em Nova Délhi, na Índia, nesta quinta-feira (15) — Foto: Danish Siddiqui/Reuters 
 O recorde absoluto de casos em 24 horas ainda é dos Estados Unidos, que teve mais de 300 mil registrados em 2 de janeiro. O recorde de infectados do Brasil é de 97,5 mil novos casos em 24 horas, que foram registrados em 25 de março. 
 O país registrou mais de 1,15 milhão de infectados nos últimos sete dias, passou o Brasil em casos confirmados na segunda-feira (12) e agora está atrás apenas dos EUA (31,4 milhões). 
 A Índia teve também 1.038 mortes em 24 horas, o maior patamar desde outubro, e é o quarto em número de vítimas do coronavírus (175 mil), atrás de EUA (564 mil), Brasil (361 mil) e México (210 mil). 
Medidas de restrição
 Em meio à escalada de casos, a capital Nova Délhi impôs um toque de recolher no fim de semana. Shopping, academias, restaurantes e alguns mercados fecharão e apenas serviços essenciais poderão funcionar. 
 Pessoas caminham em mercado lotado em meio à pandemia do novo coronavírus (Covid-19) nos bairros antigos de Delhi, na Índia, em 6 de abril de 2021 — Foto: Anushree Fadnavis/Reuters 
 Mumbai, capital financeira do país, já tem adotado diversas medidas de restrição. A cidade fica no maior estado do país, Maharashtra, que é o epicentro da segunda onda e iniciou um lockdown à meia-noite. 
No final de janeiro e começo de fevereiro, a Índia estava registrando menos de 10 mil infectados por dia. O governo indiano culpa o desrespeito ao distanciamento social e o não uso de máscaras como causas para o surto. Médicos e especialistas apontam também a complacência do governo e novas variantes do coronavírus pela escalada de casos.
 O governo do primeiro-ministro indiano, Narendra Modi, tem se recusado a adotar um lockdown nacional, depois que o primeiro, adotado no ano passado, teve um forte impacto econômico. 
 Apesar da situação, centenas de milhares de hindus têm se reunido para se banhar no Rio Ganges devido ao festival Kumbh Mela, que dura semanas, e celebrações religiosas têm contribuído para piorar a pandemia. 
 Naga Sadhus, ou homens sagrados hindus, mergulham no rio Ganges em 12 de abril durante festival religioso em Haridwar, na Índia, em meio à pandemia do novo coronavírus — Foto: Anushree Fadnavis/Reuters 
Hospitais lotados
 Hospitais em todo o país estão ficando lotados de pacientes. Há escassez de oxigênio, essencial para combater as dificuldades respiratórias causadas pela Covid-19, em lugares como Gujarat, o estado natal do primeiro-ministro indiano. 
""Se essas condições persistirem, o número de mortos aumentará"", escreveu o chefe de um corpo médico na cidade industrial de Ahmedabad em uma carta a Narendra Modi.
 O governo indiano disse que aumentou aumentou a produção de oxigênio hospitalar. ""Com o aumento da produção e os estoques excedentes disponíveis, a disponibilidade atual é suficiente"", disse o Ministério da Saúde em um comunicado. 
 ""A situação é horrível"", diz Avinash Gawande, funcionário de um hospital na cidade industrial de Nagpur enquanto tenta lidar com uma enxurrada de pacientes. ""Somos um hospital com 900 leitos, mas há cerca de 60 pacientes esperando e não temos espaço para eles"". 
 ""Este vírus é mais infeccioso e virulento"", afirma a médica Dhiren Gupta, do Hospital Sir Ganga Ram. ""Temos pacientes de 35 anos com pneumonia em tratamento intensivo, o que não acontecia no ano passado. A situação é caótica"". 
 Indianos vão às ruas durante as celebrações do Lathmar Holi na cidade de Barsana, no estado de Uttar Pradesh, durante a pandemia do novo coronavírus na Índia em 23 de março — Foto: Adnan Abidi/Reuters 
Vacinação contra Covid
 O recorde de casos ocorre em meio à aceleração da vacinação no país. A Índia é o maior produtor mundial de vacinas e iniciou em janeiro sua campanha de imunização, que demorou a engrenar. 
 Mas o país passou a restringir a exportação de vacinas contra a Covid-19 para aumentar a sua velocidade de vacinação, o que tem mostrado resultado. 
 A Índia é o terceiro país que mais aplicou doses até o momento (111 milhões), atrás apenas de EUA (192 milhões) e China (175 milhões), segundo o Our World in Data, projeto ligado à Universidade de Oxford. 
 A Índia é o segundo em vacinas aplicadas por dia (média de 3,44 milhões na última semana), atrás de China (4,24 milhões) e à frente dos EUA (3,38 milhões). Até fevereiro, a média diária era inferior a 500 mil por dia. 
 Mas há relatos de falta de doses em vários estados, incluindo Maharashtra, e centros de vacinação têm fechado mais cedo e recusam pessoas à medida que os imunizantes acabam. 
 E o país ainda tem uma vacinação proporcional à população ainda pequena (8,06 doses a cada 100 habitantes), número muito inferior ao dos EUA (57,49) e menor que o da média mundial (10,59) e até da China (12,20), país mais populoso do mundo. 
 Aviso sobre falta de vacinas contra a Covid-19 em centro de vacinação em Mumbai, na Índia, em 8 de abril — Foto: Francis Mascarenhas/Reuters 
VÍDEOS: as últimas notícias internacionais
O que aconteceu hoje, diretamente no seu e-mail
Obrigado!
 Você acaba de se inscrever na newsletter Resumo do dia. 
Veja também




"
1;google-news-br;Gazeta do Povo;Pesquisa: Lula venceria Bolsonaro no 2.º turno por 52% a 34%;A pesquisa PoderData divulgada nesta quarta-feira (14) mostra que Lula registrou 52% das intenções de voto no segundo turno, enquanto Bolsonaro teve 38%.;https://www.gazetadopovo.com.br/republica/breves/pesquisa-lula-venceria-bolsonaro-2022-segundo-turno/;https://media.gazetadopovo.com.br/2021/03/09092702/lula-660x372.jpg;2021-04-15T00:21:00+00:00;A pesquisa PoderData divulgada nesta quarta-feira (14) mostra que Lula registrou 52% das intenções de voto no segundo turno, enquanto Bolsonaro teve 38%.;"O ex-presidente Luiz Inácio Lula da Silva (PT) venceria com folga o presidente Jair Bolsonaro em possível segundo turno em 2022. É o que mostra a pesquisa PoderData, divulgada pelo Poder360 nesta quarta-feira (14). Lula registrou 52% das intenções de voto na simulação do segundo turno, enquanto Bolsonaro teve 38%. Na simulação de primeiro turno, o petista teria 34% e Bolsonaro, 31%
O ex-presidente Luiz Inácio Lula da Silva (PT) venceria com folga o presidente Jair Bolsonaro em possível segundo turno em 2022. É o que mostra a pesquisa PoderData, divulgada pelo Poder360 nesta quarta-feira (14). Lula registrou 52% das intenções de voto na simulação do segundo turno, enquanto Bolsonaro teve 38%. Na simulação de primeiro turno, o petista teria 34% e Bolsonaro, 31%
Na comparação com a última pesquisa, feita há duas semanas, o atual presidente apresenta uma piora nas intenções de voto. O levantamento anterior mostrava que Bolsonaro só perderia em um eventual segundo turno para Lula e Ciro Gomes (PDT). Na pesquisa de hoje, Bolsonaro não ganharia de ninguém com uma margem ampla.
Em confrontos diretos, o presidente perderia para Lula (52% x 34%) e para o apresentador Luciano Huck (48% x 35%). Além disso, foram registrados empates técnicos entre: Bolsonaro (38%) e João Doria (37%); Bolsonaro (38%) e Sergio Moro (37%) e Bolsonaro (38%) e Ciro Gomes (38%). A margem de erro da pesquisa é de 1,8 ponto percentual, para mais ou para menos.
A pesquisa foi realizada pelo PoderData, a divisão de estudos estatísticos do Poder360 em parceria com o Grupo Bandeirantes. Foram realizadas 3.500 entrevistas em 512 municípios, nas 27 unidades da Federação.
"
2;google-news-br;;"Brasil tem mais de 362 mil mortos por Covid; média móvel de óbitos fica acima de 3 mil pelo 5º dia";País contabilizou 13.677.564 casos e 362.180 óbitos por Covid-19 desde o início da pandemia, segundo balanço do consórcio de veículos de imprensa. Foram 3.462 mortes contabilizadas no último dia.;https://g1.globo.com/bemestar/coronavirus/noticia/2021/04/14/brasil-tem-mais-de-362-mil-mortos-por-covid-media-movel-de-obitos-fica-acima-de-3-mil-pelo-5o-dia.ghtml;https://s2.glbimg.com/trLYUofjTUCzsGLOMewg49Xlrpg=/1200x/smart/filters:cover():strip_icc()/s02.video.glbimg.com/x720/9437057.jpg;2021-04-14T23:00:23+00:00;O país registrou 3.462 mortes pela Covid-19 nas últimas 24 horas e totalizou nesta quarta-feira (14) 362.180 óbitos desde o início da pandemia. Com isso, a média móvel de mortes no Brasil nos últimos… [+4852 chars];" Por G1 
 Por G1 
  14/04/2021 20h00    Atualizado  14/04/2021    
 Brasil passa de 360 mil mortes por Covid 
 O país registrou 3.462 mortes pela Covid-19 nas últimas 24 horas e totalizou nesta quarta-feira (14) 362.180 óbitos desde o início da pandemia. Com isso, a média móvel de mortes no Brasil nos últimos 7 dias chegou a 3.012. É o quinto dia seguido em que a média móvel fica acima da marca de 3 mil. Em comparação à média de 14 dias atrás, a variação foi de -3%, indicando tendência de estabilidade nos óbitos decorrentes da doença. 
 Os números estão no novo levantamento do consórcio de veículos de imprensa sobre a situação da pandemia de coronavírus no Brasil, consolidados às 20h desta quarta. O balanço é feito a partir de dados das secretarias estaduais de Saúde. 
 Já são 84 dias seguidos no Brasil com a média móvel de mortes acima da marca de mil; o país completa agora 29 dias com essa média acima dos 2 mil mortos por dia; e já são 19 dias com a média acima da marca de 2,5 mil. A média está acima da marca de 3 mil há 5 dias, algo inédito. 
 Veja a sequência da última semana na média móvel: 
 Evolução da média móvel de óbitos no Brasil na última semana — Foto: Editoria de Arte/G1 
Quinta (8): 2.818Sexta (9): 2.938Sábado (10): 3.025Domingo (11): 3.109Segunda (12): 3.125 (recorde)Terça (13): 3.051Quarta (14): 3.012
 Em casos confirmados, desde o começo da pandemia 13.677.564 brasileiros já tiveram ou têm o novo coronavírus, com 75.998 desses confirmados no último dia. A média móvel nos últimos 7 dias foi de 68.648 novos diagnósticos por dia. Isso representa uma variação de -7% em relação aos casos registrados em duas semanas, o que indica tendência de estabilidade também nos diagnósticos. 
 Seis estados estão com alta nas mortes: AP, ES, MA, PI, PR, RJ. 
 O estado do Ceará não teve atualização nos dados desde a terça-feira. Segundo a Secretaria de Saúde do estado, o sistema que gerencia os dados do boletim estadual apresentou ""problemas críticos"" que impossibilitaram a divulgação. 
Mortes e casos de coronavírus no Brasil e nos estadosMortes e casos por cidadeVeja como está a vacinação no seu estado
 Brasil, 14 de abril
Total de mortes: 362.180Registro de mortes em 24 horas: 3.462Média de novas mortes nos últimos 7 dias: 3.012 por dia (variação em 14 dias: -3%)Total de casos confirmados: 13.677.564Registro de casos confirmados em 24 horas: 75.998Média de novos casos nos últimos 7 dias: 68.648 por dia (variação em 14 dias: -7%)
Estados
Subindo (6 estados): AP, ES, MA, PI, PR, RJEm estabilidade (14 estados): AC, AL, AM, BA, GO, MG, MS, MT, PA, PE, RR, SE, SP e TOEm queda (5 estados e o Distrito Federal): DF, PB, RN, RO, RS e SCNão atualizou (1 estado): CE
 Essa comparação leva em conta a média de mortes nos últimos 7 dias até a publicação deste balanço em relação à média registrada duas semanas atrás (entenda os critérios usados pelo G1 para analisar as tendências da pandemia). 
 Vale ressaltar que há estados em que o baixo número médio de óbitos pode levar a grandes variações percentuais. Os dados de médias móveis são, em geral, em números decimais e arredondados para facilitar a apresentação dos dados. 
Vacinação
 Balanço da vacinação contra Covid-19 deste quarta-feira (14) aponta que 24.956.272 pessoas já receberam a primeira dose de vacina contra a Covid-19, segundo dados divulgados até as 20h. O número representa 11,79% da população brasileira. 
 A segunda dose já foi aplicada em 8.121.842 pessoas (3,84% da população do país) em todos os estados e no Distrito Federal. 
 No total, 33.078.114 doses foram aplicadas em todo o país. 
Variação de mortes por estado
 Estados com mortes em alta — Foto: Editoria de Arte/G1 
 Estados com mortes em estabilidade — Foto: Editoria de Arte/G1 
 Estados com mortes em queda — Foto: Editoria de Arte/G1 
 Sul 
PR: +34%RS: -39%SC: -23%
 Sudeste 
ES: +17%MG: +8%RJ: +17%SP: -3%
 Centro-Oeste 
DF: -19%GO: -4%MS: +4%MT: -11%
 Norte 
AC: +8%AM: +3%AP: +43%PA: +14%RO: -23%RR: +12%TO: -12%
 Nordeste 
AL: +6%BA: -11%CE: o estado não divulgou novos dados até as 20h. Considerando os dados até 20h de terça (13), estava em -4% (tendência de estabilidade)MA: +19%PB: -31%PE: +13%PI: +21%RN: -18%SE: +15%
Brasil
Sul
Sudeste
Centro-Oeste
Norte
Nordeste
Consórcio de veículos de imprensa
 Os dados sobre casos e mortes de coronavírus no Brasil foram obtidos após uma parceria inédita entre G1, O Globo, Extra, O Estado de S.Paulo, Folha de S.Paulo e UOL, que passaram a trabalhar, desde o dia 8 de junho, de forma colaborativa para reunir as informações necessárias nos 26 estados e no Distrito Federal (saiba mais). 
Veja vídeos de novidades sobre vacinas contra a Covid-19:
O que aconteceu hoje, diretamente no seu e-mail
Obrigado!
 Você acaba de se inscrever na newsletter Resumo do dia. 
Veja também




"
3;google-news-br;Paolla Serra;Caso Henry: advogado decide deixar a defesa de Dr. Jairinho;Representante do vereador afirmou que objetivo é 'evitar conflito de interesse' depois que a mãe do menino decidiu trocar de escritório;https://oglobo.globo.com/rio/caso-henry-advogado-decide-deixar-defesa-de-dr-jairinho-24971306;https://ogimg.infoglobo.com.br/in/24971305-7e1-0dd/FT1086A/WhatsApp-Image-2021-04-14-at-18.25.40.jpeg.jpg;2021-04-14T21:30:03+00:00;RIO - O advogado André França Barreto, que representava Jairo Souza Santos Júnior, o Dr. Jairinho, no inquérito em que ele é investigado pela morte do enteado, Henry Borel Medeiros, de 4 anos, acabou… [+5383 chars];"RIO - O advogado André França Barreto, que representava Jairo Souza Santos Júnior, o Dr. Jairinho, no inquérito em que ele é investigado pela morte do enteado, Henry Borel Medeiros, de 4 anos, acabou de renunciar à defesa do vereador no caso. Em nota, ele alegou que a decisão tem o objetivo de ""evitar conflito de interesse"", já que ele tambem representava Monique Medeiros da Costa e Silva, namorada de Jairinho e mãe do menino, que decidiu contratar outro escritório.
RIO - O advogado André França Barreto, que representava Jairo Souza Santos Júnior, o Dr. Jairinho, no inquérito em que ele é investigado pela morte do enteado, Henry Borel Medeiros, de 4 anos, acabou de renunciar à defesa do vereador no caso. Em nota, ele alegou que a decisão tem o objetivo de ""evitar conflito de interesse"", já que ele tambem representava Monique Medeiros da Costa e Silva, namorada de Jairinho e mãe do menino, que decidiu contratar outro escritório.
Caso Henry:  Confira o que cada uma das 19 testemunhas contou em depoimento à polícia
No segundo depoimento que prestou na 16ª DP (Barra da Tijuca), responsável pelo caso, a babá Thayna de Oliveira afirmou ter sido pressionada pelo então defensor de Jairinho, que à época também defendia Monique, sobre o que diria no primeiro relato à polícia. Segundo a babá, em uma reunião no escritório de André, ele disse ser “católico como a declarante”, como consta no novo termo de declaração, e afirmou que ela, por acreditar em Deus, “tinha que falar para o mundo o quão pessoas boas eram Monique e Jairinho”. 
Na cadeia:  Diretor de presídio pede exoneração após denúncias de regalias a Jairinho e mãe de Henry
No encontro, que também teve a presença da empregada doméstica da família, Leila Rosângela de Souza, que foi ouvida pela segunda vez nesta quarta-feira, Thayna relatou ter sido orientada pelo advogado a dar uma entrevista a um canal de televisão. André enumerou todas as respostas que deveriam ser dadas, e afirmou que a babá teria de dizer as mesmas coisas ao ser ouvida na delegacia.
Nesta quarta-feira, os novos advogados de Monique estiveram na 16ª DP. Thiago Minagé, Hugo Novaes e Thaise Mattar tiveram acesso ao conteúdo da investigação. Na saída da unidade, Hugo Novaes, um dos defensores da professora, afirmou que solicitou à polícia que também marque um novo depoimento de Monique:
- A nossa estratégia é que ela diga a verdade. A prisão de Monique foi a melhor coisa que aconteceu, foi a libertação contra a opressão e o medo. E a Monique precisa ser ouvida, até agora ela não falou por ela - disse a advogada Thaise Mattar.
Dor revivida:  'Sofro ao ver como existem pessoas tão cruéis', diz mãe de Isabella Nardoni sobre morte do menino Henry
Veja, abaixo, a íntegra da nota enviada por André Barreto:
""Desde o momento da outorga de poderes a este escritório por Jairo Souza Santos Júnior (Dr. Jairinho) e Monique Medeiros da Costa e Silva, a todo o momento os constituintes afirmaram a sua inocência, motivo pelo qual inexistia impedimento para a defesa conjunta de ambos.
No entanto, no dia 12 de abril de 2021, a constituinte Monique nomeou um novo patrono.
Por tal razão, estes advogados, reafirmando a sua conduta ética, segundo a qual sempre pautaram a atuação, na forma do artigo 20 do Código de Ética da OAB, e após prévio entendimento com os dois, informam a renúncia ao mandato conferido pelos outorgantes, a fim de evitar eventuais conflitos de interesses.""
O Globo, um jornal nacional: Fique por dentro da evolução do jornal mais lido do Brasil

Os comentários são de responsabilidade exclusiva de seus autores e não
representam a opinião deste site. Se achar algo que viole os termos de
uso, denuncie. Leia as perguntas mais frequentes para saber o que é
impróprio ou ilegal


© 1996 - 2021. Todos direitos reservados a Editora Globo S/A. Este material não pode ser publicado, transmitido por broadcast, reescrito ou redistribuído sem autorização.

"
4;google-news-br;;Ex-senador diz que não tomou vacina clandestina mas admite que esposa pagou R$ 3,6 mil para se imunizar junto com irmãos dele;Na casa da cuidadora de idosos Cláudia Mônica Pinheiro Torres de Freitas, os investigadores encontraram ampolas de soro fisiológico e seringas, novas e usadas.;https://g1.globo.com/mg/minas-gerais/noticia/2021/04/14/em-depoimento-a-pf-ex-senador-diz-que-nao-tomou-vacina-clandestina-mas-pagou-r-36-mil-para-imunizar-mulher-e-irmaos.ghtml;https://s2.glbimg.com/3_bUO8MGEkcy1SCVoILo_zYJFVc=/1200x/smart/filters:cover():strip_icc()/s03.video.glbimg.com/x720/9436638.jpg;2021-04-14T20:55:41+00:00;Em depoimento à Polícia Federal na tarde desta quarta-feira (14), o ex-senador Clésio Andrade admitiu que a sua mulher pagou R$ 3,6 mil para que ela e os irmãos dele tomassem a vacina clandestina, of… [+3502 chars];" Por Thais Pimentel e Fernando Zuba, G1 Minas e TV Globo — Belo Horizonte 
 Por Thais Pimentel e Fernando Zuba, G1 Minas e TV Globo — Belo Horizonte 
  14/04/2021 17h55    Atualizado  14/04/2021    
 Ex-senador Clésio Andrade diz à PF que mulher dele recebeu dose de suposta vacina 
 Em depoimento à Polícia Federal na tarde desta quarta-feira (14), o ex-senador Clésio Andrade admitiu que a sua mulher pagou R$ 3,6 mil para que ela e os irmãos dele tomassem a vacina clandestina, oferecida pela falsa enfermeira Cláudia Mônica Pinheiro Torres de Freitas e promovida pelos irmãos Lessa, empresários do ramo de transportes de Minas Gerais. 
 (O G1 errou ao informar, na publicação desta reportagem, que a aplicação da vacina clandestina foi custeada pelo ex-senador. Na verdade, quem pagou pela imunização de cinco pessoas foi a mulher dele, Gisa Andrade. A informação foi corrigida às 20h desta quarta-feira, 14.) 
PF vai pedir exames laboratoriais para 57 pessoas que receberam suposta vacina de falsa enfermeiraDono de haras diz que comprou suposta vacina contra Covid-19 de falsa enfermeira acreditando que seria da PfizerMulher investigada por imunizar empresários em BH trabalhou como enfermeira em clínica de vacinação no Rio de Janeiro, diz PFEmpresários de BH admitem que compraram vacinas contra Covid; PF afirma que irmãos Lessa comandaram esquemaIrmãos do ex-senador Clésio Andrade teriam tomado vacina clandestina em Belo Horizonte, diz Polícia FederalMensagens de ex-senador aparecem em celular de empresário que organizou vacinação clandestina, diz PF
 Como já tinha adiantado ao G1, o ex-senador admitiu ter ido até a garagem da empresa de Robson e Rômulo Lessa, onde acontecia a imunização, mas negou ter participado. 
 Ex-senador Clésio Andrade prestou depoimento à Polícia Federal — Foto: Reprodução/GloboNews 
 Clésio foi ouvido por videoconferência, no inquérito que investiga a vacinação clandestina em Belo Horizonte. Outras quatro pessoas — dois irmãos, uma irmã e a enteada de Andrade — também são investigadas. 
 Os nomes delas estavam na lista encontrada no escritório de Rômulo Lessa, que admitiu ter organizado a vacinação clandestina na empresa de transportes. 
 Em nota divulgada nesta quarta-feira, Clésio disse que, ""durante conversa telefônica com um amigo, sobre temas do transporte, tomou conhecimento da disponibilidade de vacina da farmacêutica Pfizer, mas não se interessou"". 
 Ainda segundo ele, sua mulher, Gisa Andrade, quis se vacinar por ser portadora de doença crônica. ""Clésio Andrade esclareceu que sua mulher contatou seus irmãos e pagou R$ 3,6 mil para que pudessem receber o 'imunizante'"", disse a nota. 
 Segundo as investigações, a falsa enfermeira cobrava R$ 600 por dose. Clésio pagou para a mulher, a enteada, dois irmãos e uma irmã, o que totalizaria R$ 3 mil. O valor total desembolsado daria para pagar doses para seis pessoas. Segundo Clésio, cinco da família se imunizaram.  
 No dia 23 de março, data da vacinação na garagem da família Lessa, o ex-senador acompanhou Gisa até o local. 
""Ele disse que, novamente, recebeu oferta de tomar a injeção, mas recusou. Gisa recebeu a aplicação e logo em seguida eles entraram no carro e foram embora. Andrade esclareceu que não encontrou com seus irmãos e não sabe se eles tomaram a injeção"", disse a nota. 
 Ao ver a repercussão pela imprensa, Gisa Andrade teria pesquisado na internet o nome do homem para o qual foi feito o depósito e identificou a mãe dele, que se apresentou como enfermeira. Eram Cláudia Mônica e Igor Torres, também investigado. 
 ""Clésio Andrade disse ao delegado que repassou as informações sobre Igor e sua mãe aos irmãos Lessa para informá-los de que tinham sido vítimas de uma fraude e tranquilizá-los, pois não tinham cometido crime algum"", dia a nota. 
Falsa enfermeira
 A mulher suspeita de aplicar um suposto imunizante contra a Covid-19 em empresários da capital é a cuidadora de idosos Cláudia Mônica Pinheiro Torres de Freitas. Na semana passada, ela teve a prisão preventiva anulada pela Justiça Federal, mas a PF disse que a decisão não muda os rumos da investigação. Na casa da cuidadora de idosos, os investigadores encontraram ampolas de soro fisiológico e seringas, novas e usadas. 
 A principal hipótese da investigação é de que houve golpe: os empresários e políticos, na vacinação organizada na garagem da empresa de transportes, e também os moradores que receberam a falsa enfermeira em condomínios de luxo de BH, provavelmente tomaram doses de uma falsa vacina contra a Covid-19. 
Vídeos mais vistos do G1 MG:
O que aconteceu hoje, diretamente no seu e-mail
Obrigado!
 Você acaba de se inscrever na newsletter Resumo do dia. 
Veja também




"
