index;title;description;content;url;image;publishedAt;source;Texto
4;Maioria dos fabricantes brasileiros de cloroquina não recomenda o remédio para covid;Maioria dos fabricantes brasileiros de cloroquina não recomenda o remédio para covid;"Publicado originalmente no Repórter Brasil:
Por Diego Junqueira e Mariana Della Barba
Das seis farmacêuticas que fabricam cloroquina ou hidroxicloroquina no Brasil, quatro não recomendam o remédio para tratar a covid-19. Essa maioria foi formada após... [7313 chars]";https://www.diariodocentrodomundo.com.br/maioria-dos-fabricantes-brasileiros-de-cloroquina-nao-recomenda-o-remedio-para-covid/;https://www.diariodocentrodomundo.com.br/wp-content/uploads/2021/02/reuters-jair-bolsonaro-1500-24072020103912108.jpeg;2021-04-13T12:32:52Z;Diário do Centro do Mundo;"Publicado originalmente no Repórter Brasil:
Publicado originalmente no Repórter Brasil:
Por Diego Junqueira e Mariana Della Barba
Das seis farmacêuticas que fabricam cloroquina ou hidroxicloroquina no Brasil, quatro não recomendam o remédio para tratar a covid-19. Essa maioria foi formada após a Apsen, principal fabricante de hidroxicloroquina do país, se posicionar contra o uso pela primeira vez desde abril, quando a empresa divulgou estudos que supostamente indicavam a melhora de pacientes por causa da cloroquina.
A mudança de posicionamento da Apsen Farmacêutica aconteceu na quarta-feira (3), mais de quatro meses depois de a OMS rejeitar de forma conclusiva o medicamento para este fim e após a Repórter Brasil entrar em contato com a empresa para questionar sobre dois contratos de empréstimo assinados com o BNDES em 2020, que somam R$ 136 milhões. Deste total, R$ 20 milhões já foram desembolsados pelo banco, mas para investimento em inovação – o contrato não permite investir em medicamentos antigos, como a cloroquina, que a Apsen produz há 18 anos.
Outros três laboratórios – Farmanguinhos/Fiocruz, EMS e Sanofi-Medley – já haviam divulgado comunicados no qual recomendavam o fármaco apenas para doenças previstas em bula, ou seja, malária, lúpus e doenças reumáticas.
Já os dois laboratórios restantes na lista dos fabricantes do medicamento, Cristália e Laboratório do Exército, não se posicionam de forma clara contra o uso do remédio para a covid, mantendo aberta a possibilidade de que a cloroquina ou a hidroxicloroquina sejam usadas no tratamento dos infectados pelo novo coronavírus.
A fábrica militar alegou que, por ser apenas um “órgão executor”, não tem competência para opinar sobre a eficácia do medicamento que produz. Já o Cristália afirmou que a cloroquina é recomendada para malária e outras doenças, mas não descartou o uso para covid, dizendo que “qualquer recomendação fora das especificadas na bula deve ser feita sob responsabilidade do médico, como ocorre com qualquer medicamento”.
Além das farmacêuticas citadas, ainda há o caso da Eurofarma, que conseguiu o registro na Anvisa em agosto de 2020, mas afirma que não fabricou nem comercializou a cloroquina desde então.
Faturamento recorde
A Apsen é a maior beneficiada pela comercialização recorde do medicamento em 2020. Segundo o Sindusfarma, o faturamento das empresas com o remédio foi de R$ 91,6 milhões em 2020, ante R$ 55 milhões em 2019 (alta de 66%). O Conselho Federal de Farmácia vem alertando para vendas desenfreadas da medicação desde o início da pandemia.
As vendas do remédio ajudaram a Apsen a alcançar faturamento recorde em 2019: próximo de R$ 1 bilhão, 18% a mais em relação ao ano anterior.
Na fase inicial da pandemia, em março de 2020, a empresa divulgou mensagem em rede social dizendo que “apesar de promissores, não existem estudos conclusivos que comprovam o uso para o tratamento da covid-19”. Já em abril, a Apsen publicou uma nota em que apontava a medicação como possível “cura” para a doença. Naquele momento, ainda não existiam estudos científicos conclusivos que descartavam a droga para a covid-19.
A empresa voltou a se posicionar oficialmente sobre o tema na última quarta-feira, quando divulgou em seu site que, “com base nas evidências científicas atuais, a Apsen recomenda a utilização da hidroxicloroquina apenas nas indicações previstas em bula [ou seja, malária e doenças reumáticas]”.
A Fiocruz, que comanda o laboratório Farmanguinhos, emitiu os primeiros alertas contra o uso da medicação na pandemia em abril do ano passado, após um estudo do qual participava ser interrompido precocemente, depois de pacientes apresentarem maior risco de complicações cardíacas. A instituição fabrica cloroquina para o programa nacional de combate à malária. Porém, o Ministério da Saúde usou os estoques da Fiocruz para distribuir o remédio no SUS para o suposto tratamento precoce da covid-19.
A Sanofi-Medley afirmou à Repórter Brasil que não há uso aprovado de seu produto para tratamento da covid-19 em nenhum lugar do mundo, recomendando o medicamento somente para a indicação em bula.
Já a EMS disse, via assessoria de imprensa, que não recomenda o medicamento para o tratamento da covid-19. A empresa também recebeu empréstimos do BNDES em 2020, no total de R$ 23 milhões. Um dos contratos prevê a construção de uma fábrica de medicamentos oncológicos. O outro permite a aplicação de recursos em medicações antigas da empresa, já que se destina à “ampliação e reforma de unidade industrial, incluindo produção de medicamentos, linhas de embalagens e almoxarifado, no complexo industrial da EMS, em Hortolândia (SP)”. A empresa foi questionada se os recursos foram usados para ampliar a produção do remédio e respondeu que “nenhum pedido [de empréstimo] teve relação com a produção de sulfato de hidroxicloroquina” (veja o posicionamento completo das empresas).
Falta de evidência científica
As vendas de hidroxicloroquina bateram recorde em 2020 após se tornar o carro-chefe do governo brasileiro para enfrentar a covid-19. Só em farmácias foram comercializadas 2 milhões de unidades (com pico em dezembro) – alta de 113% no ano em comparação a 2019, segundo o Conselho Federal de Farmácia.
Além de distribuir cloroquina no SUS, o Ministério da Saúde incentivou a automedicação, por meio de um aplicativo e em campanha publicitária, e adotou um protocolo clínico, batizado de “tratamento precoce”, que recomenda a droga no estágio inicial da doença.
Em março de 2020, a OMS (Organização Mundial da Saúde) deu início ao Estudo Solidariedade, para avaliar a eficácia de alguns medicamentos contra a covid-19, incluindo a cloroquina e a hidroxicloroquina. O ensaio chegou a ser paralisado provisoriamente, em maio, por dúvidas com relação à segurança dos medicamentos, e, em 17 de junho, foi interrompido de forma definitiva, após ficar demonstrado que a droga não reduzia a mortalidade de pacientes com covid-19.
Em outubro, a OMS divulgou o resultado final da avaliação, realizada com mais de 11 mil pessoas em 30 países: tanto os compostos com cloroquina como o antiviral remdesivir apresentaram “pouco ou nenhum efeito” sobre a mortalidade por covid-19.
A Organização Mundial de Saúde continuou estudando o assunto para se certificar dos efeitos da cloroquina sobre a doença e, na semana passada, um painel de especialistas parece ter enterrado de vez a questão. Após revisar seis ensaios clínicos com 6.000 pessoas, os especialistas concluíram que a hidroxicloroquina não influencia as taxas de infecção e, provavelmente, aumenta o risco de efeitos adversos, como problemas cardíacos. “A hidroxicloroquina não é mais uma prioridade de pesquisa”, afirmou o painel.
Na avaliação de Nelson Mussolini, presidente-executivo do Sindusfarma (Sindicato da Indústria de Produtos Farmacêuticos no Estado de São Paulo), não se deve tomar medicamentos para o que não está registrado. “Nosso negócio é baseado em ciência”, diz. “O uso off-label (fora da bula) só se justifica quando existem novas indicações terapêuticas baseadas na prática médica e na ciência”, completa.
“A indústria farmacêutica investe bilhões de dólares para demonstrar a eficácia de seus produtos. Por isso, todos os medicamentos aprovados e registrados pela Anvisa para uso no país têm eficácia comprovada para as indicações terapêuticas de suas bulas, devendo ser consumidos de acordo com as prescrições e orientações de médicos, farmacêuticos e demais profissionais de saúde habilitados; o uso off-label só se se justifica quando existem novas indicações terapêuticas baseadas na prática médica e na ciência”.
O jornalismo do DCM precisa de você para continuar marcando ponto na vida nacional. 
Faça doação para o site. Sua colaboração é fundamental para seguirmos combatendo o bom combate com a independência que você conhece. 
A partir de R$ 10, você pode fazer a diferença. Muito Obrigado!







Conheça as regras do debate
"
5;Após manifestação, ônibus do Transcol começam a circular na Grande Vitória;Rodoviários reivindicam prioridade na fila de vacinação contra covid-19;"Foto: Arleson Schneider / TV Vitória
Após uma manhã de manifestação surpresa na Grande Vitória, os ônibus do sistema Transcol começaram a deixar as garagens por volta das 9 horas desta terça-feira (13). A operação ficou paralisada por cerca de duas s... [2843 chars]";https://www.folhavitoria.com.br/geral/noticia/04/2021/apos-manifestacao-onibus-do-transcol-comecam-a-circular-na-grande-vitoria;https://assets.folhavitoria.com.br/images/6c30f580-9c40-11eb-baa0-47a563518cee--minified.jpeg;2021-04-13T12:28:46Z;Jornal Folha Vitória;"Após uma manhã de manifestação surpresa na Grande Vitória, os ônibus do sistema Transcol começaram a deixar as garagens por volta das 9 horas desta terça-feira (13). A operação ficou paralisada por cerca de duas semanas e o retorno dos coletivos estava definido para esta madrugada.
Após uma manhã de manifestação surpresa na Grande Vitória, os ônibus do sistema Transcol começaram a deixar as garagens por volta das 9 horas desta terça-feira (13). A operação ficou paralisada por cerca de duas semanas e o retorno dos coletivos estava definido para esta madrugada.
O horário de liberação das garagens já era previsto pelos representantes do Sindirodoviários. De acordo com o diretor da categoria, Miguel Leite, um adesivo com o pedido pela vacina está sendo colocado nos veículos. ""Acabamos de liberar a circulação dos ônibus. Apenas uma empresa teve resistência para liberar, que foi a Praia Sol/Veredas. Estamos colocando o adesivo na frente de todos os carros, e a empresa não estava aceitando colocar. Mas depois eles aceitaram e a situação já está normalizada"", relatou.
Sobre a possibilidade de um novo protesto, Leite afirmou que é hora de aguardar um posicionamento do governo do Estado. ""Vamos esperar o governo dar o próximo passo para também darmos mais um. O governo está vacinando os policiais, por exemplo, mas e nós que estamos dentro dos terminais e ônibus lotados? Protocolamos um pedido em janeiro. No dia 6 de abril, fizemos mais um pedido, mas o governo não deu resposta. Sobre fazer um novo protesto, depende muito do que vai acontecer daqui pra frente. Vamos dando um passo de cada vez"", afirmou.
Segundo o presidente do sindicato, Valdeci Laurindo, a preocupação é com o crescente número de casos da doença em meio aos profissionais da categoria. ""Já perdemos mais de 30 rodoviários para a covid. Alguns ainda estão internados ou intubados. Os motoristas estão na linha de frente e todos estão assustados e com medo. Também somos essenciais e queremos nossa vacina"", disse.
O representante ainda disse que as secretarias de Mobilidade e de Saúde já foram notificados com a reivindicação. ""Sabemos que muitos voltariam a trabalhar hoje, mas precisamos tomar uma atitude"", afirmou.
A liberação ocorre nas garagens do Sistema Transcol e também no municipal de Vitória. Os ônibus que circulam em Vila Velha, da Sanremo, começaram a circular um pouco mais cedo, por volta das 8 horas.
A manifestação surpreendeu a população, inclusive os profissionais de Saúde, que dependem dos veículos para troca de turnos nos hospitais e postos de atendimento. Em vários pontos da Grande Vitória, muitas pessoas aguardam a chegada de veículos.
O secretário de Mobilidade e Infraestrutura, Fábio Damasceno, afirmou que a pasta também foi surpreendida pela manifestação. ""Existe uma reivindicação do pessoal que está na linha de frente do transporte público, mas fomos pegos de surpresa. Muitos profissionais dos hospitais, que precisam trocar de turno, estão sem transporte. É uma forma irresponsável de chamar a atenção para o assunto"", disse.
Procurada, a Secretaria de Estado da Saúde (Sesa) informou  que os grupos prioritários para vacinação Covid-19 são definidos pelo Ministério da Saúde, e o cronograma do Espírito Santo segue a indicação do Plano Nacional de Vacinação.
"
6;Com covid, Heitor Martinez passa 1ª noite sem suporte de oxigênio;De acordo com a irmã do artista, ele está evoluindo bem, ainda usa o aparelho de respiração, mas a dependência está diminuindo;"De acordo com a irmã do artista, ele está evoluindo bem, ainda usa o aparelho de respiração, mas a dependência está diminuindo edit
247 - Internado com covid-19 desde o dia 3 de abril, o ator Heitor Martinez, de 52 anos, apresentou melhora significat... [579 chars]";https://www.brasil247.com/midia/com-covid-heitor-martinez-passa-1-noite-sem-suporte-de-oxigenio;https://publisher-publish.s3.eu-central-1.amazonaws.com/pb-brasil247/swp/jtjeq9/media/20210408090448_10cc5d89c32f3ad1f1dffa27fb07d1d2a0996866deaca4534032291efec44aee.png;2021-04-13T12:27:35Z;Brasil 247;"De acordo com a irmã do artista, ele está evoluindo bem, ainda usa o aparelho de respiração, mas a dependência está diminuindo
edit
De acordo com a irmã do artista, ele está evoluindo bem, ainda usa o aparelho de respiração, mas a dependência está diminuindo
edit






247 - Internado com covid-19 desde o dia 3 de abril, o ator Heitor Martinez, de 52 anos, apresentou melhora significativa no seu quadro de saúde e, segundo sua irmã Paula Martinez, a equipe médica já começou o processo de retirada dos cateteres e do suporte de oxigênio para avaliar o desempenho pulmonar do artista. A informação é do portal R7.
""A equipe médica que está cuidando do Heitor já começou o processo de retirada dos acessos (cateteres). O Heitor continua apresentando melhora, tem feito fisioterapia, e ainda serão feitos mais alguns exames nos próximos dias para ver seu estado, mas tudo segue muito bem"", explicou ela ao R7.
  





247 - Internado com covid-19 desde o dia 3 de abril, o ator Heitor Martinez, de 52 anos, apresentou melhora significativa no seu quadro de saúde e, segundo sua irmã Paula Martinez, a equipe médica já começou o processo de retirada dos cateteres e do suporte de oxigênio para avaliar o desempenho pulmonar do artista. A informação é do portal R7.
""A equipe médica que está cuidando do Heitor já começou o processo de retirada dos acessos (cateteres). O Heitor continua apresentando melhora, tem feito fisioterapia, e ainda serão feitos mais alguns exames nos próximos dias para ver seu estado, mas tudo segue muito bem"", explicou ela ao R7.
 
O conhecimento liberta. Saiba mais. Siga-nos no Telegram.
A você que chegou até aqui, agradecemos muito por valorizar nosso conteúdo. Ao contrário da mídia corporativa, o Brasil 247 e a TV 247 se financiam por meio da sua própria comunidade de leitores e telespectadores. Você pode apoiar a TV 247 e o site Brasil 247 de diversas formas. Veja como em brasil247.com/apoio
Os comentários aqui postados expressam a opinião dos seus autores, responsáveis por seu teor, e não do 247
© 2021 Editora 247 - Todos os Direitos Reservados

"
7;Diante de disparada da Covid, Índia acelera aprovação de vacinas estrangeiras;A Índia acelerará a aprovação emergencial de vacinas contra Covid-19 que foram autorizadas por países ocidentais e o Japão, abrindo caminho para possíveis;"A Índia acelerará a aprovação emergencial de vacinas contra Covid-19 que foram autorizadas por países ocidentais e o Japão, abrindo caminho para possíveis importações de imunizantes da Pfizer, Johnson & Johnson e Moderna.
A medida, que dispensará a e... [1225 chars]";https://www.mixvale.com.br/2021/04/13/diante-de-disparada-da/;https://www.mixvale.com.br/wp-content/uploads/Reuters_Direct_Media/BrazilOnlineReportTopNews/tagreuters.com2021binary_LYNXMPEH3C0QP-BASEIMAGE.jpg;2021-04-13T12:26:30Z;Portal Mix Vale;NA
8;Projeto permite que indústria veterinária produza vacinas contra covid;A produção de vacinas contra a covid-19 poderá receber o apoio de estruturas industriais destinadas à fabricação de produtos de uso veterinário. É o que determina o Projeto de Lei (PL) 1.343/2021, de autoria do senador Wellington Fagundes (PL-MT), apre;A produção de vacinas contra a covid-19 poderá receber o apoio de estruturas industriais destinadas à fabricação de produtos de uso veterinário. É o que determina o Projeto de Lei (PL) 1.343/2021, de autoria do senador Wellington Fagundes (PL-MT), ap... [2255 chars];https://noticias.uol.com.br/saude/ultimas-noticias/redacao/2021/04/13/projeto-permite-que-industria-veterinaria-produza-vacinas-contra-covid-19.htm;https://conteudo.imguol.com.br/c/noticias/5e/2016/04/25/o-senador-wellington-fagundes-pr-mt-fala-durante-sessao-nao-deliberativa-no-plenario-do-senado-federal-1461634965425_615x300.jpg;2021-04-13T12:26:00Z;UOL;"Da Agência Senado
Da Agência Senado
13/04/2021 09h25Atualizada em 13/04/2021 09h26 
A produção de vacinas contra a covid-19 poderá receber o apoio de estruturas industriais destinadas à fabricação de produtos de uso veterinário. É o que determina o Projeto de Lei (PL) 1.343/2021, de autoria do senador Wellington Fagundes (PL-MT), apresentado ao Senado ontem.
O projeto autoriza, temporariamente, fábricas de produtos de uso veterinário a produzirem as vacinas, desde que cumpram todas as normas sanitárias e exigências de biossegurança próprias dos estabelecimentos destinados à produção de imunizantes humanos.
O senador defendeu a proposta em publicação em redes sociais. ""Estou convencido que a única alternativa para imunizar a população de nosso país é a produção de vacinas, com transferência tecnológica urgente"", disse.
Wellington Fagundes, o assunto tem sido discutido desde março pela Comissão Temporária da Covid-19, na qual atua como relator. Isso porque, segundo o Sindicato Nacional da Indústria de Produtos para Saúde Animal (Sindan), a indústria de saúde animal brasileira dispõe de três plantas de nível NB3+ de biossegurança, ou seja, têm capacidade já instalada para produzir vacinas.
Em sua justificativa, o senador afirma que o projeto tem objetivo de facilitar e estimular a utilização dessas plantas industriais, ""ampliando, assim, a oferta de doses de vacina e acelerando a imunização da população brasileira, para evitar mais mortes e permitir o retorno do país à normalidade, o mais rápido possível"".
O texto estabelece que todas as fases relacionadas à produção e ao armazenamento das vacinas deverão ocorrer em dependências fisicamente separadas das que, numa mesma estrutura industrial, sejam usadas para a fabricação de produtos de uso veterinário.
O controle será feito pela Agência Nacional de Vigilância Sanitária (Anvisa), nos termos da Lei nº 9.782, 1999.
Nesta segunda-feira, a Comissão Temporária da Covid-19 acatou a sugestão de Wellington Fagundes de visitar três fábricas de imunizantes veterinários com potencial e nível de biossegurança recomendável para a produção das vacinas.
A visita ainda sem data marcada, tem objetivo de conhecer instalações e identificar possíveis adaptações e investimentos para que os três parques fabris sejam aproveitados para a produção de vacinas.
Além dos membros da comissão, também serão convidados a compor a comitiva representantes do Ministério da Saúde, da Agência Nacional de Vigilância Sanitária (Anvisa), do Ministério da Agricultura, Pecuária e Abastecimento e do Instituto Butantan.
"
9;Covid-19: Atraso nas notificações pode prejudicar planejamento de distribuição de vacinas no estado do Rio;Das 4,4 milhões de doses de imunizantes, apenas 1,98 milhão foram informadas como aplicadas em moradores dos municípios fluminenses;RIO — Das 4,4 milhões de doses da vacina contra o coronavírus entregues aos municípios fluminenses, apenas 44,9% (ou 1,98 milhão) foram informadas como aplicadas, de acordo com o vacinômetro do Ministério da Saúde, em números consultados às 18h de se... [4967 chars];https://oglobo.globo.com/rio/covid-19-atraso-nas-notificacoes-pode-prejudicar-planejamento-de-distribuicao-de-vacinas-no-estado-do-rio-24968228;https://ogimg.infoglobo.com.br/in/24968230-e6d-2c3/FT1086A/vacina_Covid-19_estado-do-Rio.jpg;2021-04-13T12:18:00Z;O Globo;NA
