index;source;author;title;description;url;urlToImage;publishedAt;content;Texto
5;google-news-br;Redação;Calendário da primeira e segunda parcela do 13º salário do INSS;A liberação da antecipação do 13º salário aos aposentados e pensionistas do INSS deve ficar definitivamente para o mês de maio;https://www.jornalcontabil.com.br/calendario-da-primeira-e-segunda-parcela-do-13o-salario-do-inss/;https://www.jornalcontabil.com.br/wp-content/uploads/2020/06/quebra-galho-7-dicas-de-como-ganhar-dinheiro-trabalhando-no-fim-de-semana-quebra-galho-7-dicas-de-como-ganhar-dinheiro-trabalhando-no-fim-de-semana-1024x538-1.jpeg;2021-04-14T20:12:13+00:00;A liberação da antecipação do 13º salário aos aposentados e pensionistas do INSS deve ficar definitivamente para o mês de maio, o motivo para isso é referente ao impasse da aprovação do Orçamento de … [+2918 chars];"A liberação da antecipação do 13º salário aos aposentados e pensionistas do INSS deve ficar definitivamente para o mês de maio, o motivo para isso é referente ao impasse da aprovação do Orçamento de 2021, onde houve a retirada de 26,4 bilhões de despesas obrigatórias que iriam para o pagamento de aposentadorias, pensões, benefícios previdenciários e trabalhistas.
A liberação da antecipação do 13º salário aos aposentados e pensionistas do INSS deve ficar definitivamente para o mês de maio, o motivo para isso é referente ao impasse da aprovação do Orçamento de 2021, onde houve a retirada de 26,4 bilhões de despesas obrigatórias que iriam para o pagamento de aposentadorias, pensões, benefícios previdenciários e trabalhistas.
Além disso, o enceramento dos cálculos de gastos regulares da Previdência Social deste mês deve acontecer ainda essa semana, logo se a previdência fechar a folha de pagamentos de abril, não será possível viabilizar a antecipação este mês.
A liberação do 13º salário do INSS é uma alternativa considerada simples pelo governo, tendo em vista que trata-se apenas de uma antecipação de recursos, o que não geraria um custo para o governo, tendo em vista que o 13º salário do INSS já é um valor previsto no Orçamento.
A nova rodada de antecipação tem a estimativa de movimentar a economia em R$ 50 bilhões, valor esse que é superior a todo o programa do auxílio emergencial de 2021 que tem um teto máximo de R$ 44 bilhões.
Agora o Instituto Nacional do Seguro Social (INSS) vem se preparando para a liberação do 13º salário para os meses de maio e junho, sendo maio referente a primeira parcela e junho a segunda parcela.
Enquanto o Orçamento 2021 não for sancionado, a antecipação do 13° salário do INSS não poderá ser liberada, logo, a liberação da parcela natalina é empurrada para o mês de maio.
Caso o governo não crie um calendário especifico para o pagamento da parcela extra, o cronograma de pagamentos deve seguir o calendário habitual de pagamentos do INSS.
Vale lembrar que cada benefício pago pelo INSS é composto por uma numeração única e segue um padrão de 10 dígitos no seguinte formato: 111.111.119-1. O número a ser observado será o penúltimo, desconsiderando o dígito, nesse caso sendo o 9.
Também é necessário observar se o benefício é de um salário mínimo ou acima dele. Os que ganham até um salário mínimo recebem antes.
Confira o calendário de pagamentos tanto para o pagamento habitual da parcela como possível calendário da antecipação do 13º salário.
"
6;google-news-br;Luiza Calegari;Plenário do STF referenda liminar que obrigou Senado a abrir CPI da Covid-19;Por maioria, o Supremo Tribunal Federal referendou liminar do ministro Luís Roberto Barroso que obrigou o presidente do Senado a abrir uma Comissão Parlamentar de Inquérito (CPI) para investigar o governo federal pela condução do combate à epidemia de Covid-1…;https://www.conjur.com.br/2021-abr-14/supremo-referenda-liminar-obrigou-senado-abrir-cpi-covid;https://s.conjur.com.br/img/b/roberto-barroso9.jpeg;2021-04-14T18:29:00+00:00;Por maioria, o Supremo Tribunal Federal referendou liminar do ministro Luís Roberto Barroso que obrigou o presidente do Senado a abrir uma Comissão Parlamentar de Inquérito (CPI) para investigar o go… [+3522 chars];NA
7;google-news-br;Leandro Prazeres e Paula Ferreira;MPF move ação contra Pazuello e mais cinco por omissão em caos da saúde no Amazonas;Ação por improbidade é resultado de investigação que começou em janeiro após crise no Amazonas;https://oglobo.globo.com/brasil/mpf-move-acao-contra-pazuello-mais-cinco-por-omissao-em-caos-da-saude-no-amazonas-24970793;https://ogimg.infoglobo.com.br/in/24833259-037-927/FT1086A/pazuello.jpg;2021-04-14T17:17:06+00:00;BRASÍLIA O Ministério Público Federal (MPF) no Amazonas moveu uma ação por improbidade administrativa contra o ex-ministro da Saúde Eduardo Pazuello e mais cinco pessoas por omissão diante do recrude… [+7062 chars];"BRASÍLIA — O Ministério Público Federal (MPF) no Amazonas moveu uma ação por improbidade administrativa contra o ex-ministro da Saúde Eduardo Pazuello e mais cinco pessoas por omissão diante do recrudescimento da epidemia de Covid-19 no Amazonas entre dezembro de 2020 e janeiro de 2021. Segundo a ação, o Ministério da Saúde retardou suas ações e não supervisionou o fornecimento de oxigênio no estado antes do colapso que aconteceu no dia 14 de janeiro. O MPF cita ainda a campanha feita pelas autoridades do Ministério em defesa do ""tratamento precoce"", sem eficácia comprovada contra Covid-19.
BRASÍLIA — O Ministério Público Federal (MPF) no Amazonas moveu uma ação por improbidade administrativa contra o ex-ministro da Saúde Eduardo Pazuello e mais cinco pessoas por omissão diante do recrudescimento da epidemia de Covid-19 no Amazonas entre dezembro de 2020 e janeiro de 2021. Segundo a ação, o Ministério da Saúde retardou suas ações e não supervisionou o fornecimento de oxigênio no estado antes do colapso que aconteceu no dia 14 de janeiro. O MPF cita ainda a campanha feita pelas autoridades do Ministério em defesa do ""tratamento precoce"", sem eficácia comprovada contra Covid-19.
Saiba mais:  Relator no TCU quer investigar 'omissões' de Pazuello e diz que segunda onda de Covid-19 era anunciada
Além do ex-ministro, o MPF aciona a secretária de Gestão do Trabalho e da Educação da Saúde do Ministério da Saúde, Mayra Pinheiro; o secretário de Atenção Especializada à Saúde do Ministério da Saúde, Luiz Otávio Franco Duarte; o secretário de Ciência, Tecnologia, Inovação e Insumos Estratégicos em Saúde do Ministério da Saúde, Hélio Angotti Neto; o secretário de Saúde do Estado do Amazonas, Marcellus Campelo; e o Coordenador do Comitê de Crise, Francisco Filho.
O colapso no sistema de saúde do Amazonas aconteceu no dia 14 de janeiro deste ano. Naquele dia, houve o registro de falta de oxigênio hospitalar em diversas unidades de saúde.
Covid-19:  Maioria dos senadores que deverão integrar CPI da Pandemia quer início imediato dos trabalhos
Durante a investigação, o gerente da empresa fornecedora de oxigênio para o governo do Amazonas, Christiano Cruz, relatou que a White Martins só conseguiu se reunir com integrantes do Ministério da Saúde para relatar pessoalmente o grave problema na disponibilidade de oxigênio no Amazonas às vésperas do colapso.
Procuradores afirmam ainda que, mesmo sabendo da crise, tanto o MS quanto a secretaria de saúde do Amazonas só procuraram outras fornecedoras de oxigênio após o colapso.
Coronavírus nos pets:  Infecção de cães e gatos pelo coronavírus é mais frequente do que se imaginava, revela estudo brasileiro
Segundo a ação movida pelo MPF, Pazuello e seus secretários “tinham ciência do vertiginoso e descontrolado aumento de casos no Amazonas na segunda metade do mês de dezembro”. O MPF afirma ainda que essas autoridades tinham consciência, ainda em 2020, sobre a lotação dos leitos no estado.
""Apesar de ter notícia do aumento dos casos desde a semana do Natal – compreendida entre 20 e 26 de dezembro de 2020 – e de haver realizado  reunião com secretariado no dia 28 de dezembro, o ex-ministro Eduardo Pazuello determinou a ida de comitiva a Manaus apenas no dia 3 de janeiro de 2021, ou seja, quase uma semana após. Em tempo de pandemia, evidencia-se que o ministro não atuou com a celeridade necessária para debelar o novo pico pandêmico. Omitiu-se, portanto, na adoção de medidas com a presteza indispensável"", argumenta o MPF na ação.
Números da pandemia: Com 3.462 mortes nas últimas 24h, Brasil tem 5º dia de média móvel de óbitos por Covid-19 acima de três mil
De acordo com o órgão, o recrudescimento da pandemia no estado era amplamente divulgado na imprensa e era dever das autoridades monitorar e planejar o enfrentamento ao aumento de casos e mortes.  O MPF cita que a comitiva da pasta enviada ao estado tinha como objetivo ""avaliar a situação"" a partir de uma ""viagem de reconhecimento"", deixando para depois a adoção de medidas para mitigar a situação de colapso no estado.
""A espera por esse tempo não é compatível com o senso de urgência que, na maior pandemia do último século, deve orientar a atuação do Ministro da Saúde – o próprio documento do Ministério da Saúde, acima citado, demonstra que, em uma semana, o número de hospitalizações pode dobrar"", diz o MPF.
Imunização:  Pfizer antecipará entrega de 2 milhões de doses de vacina para o Brasil, diz ministro da Saúde
A argumentação do MPF é de que a secretaria estadual não tomou providências necessárias para dimensionar o crescimento da demanda de oxigênio a partir de 2020, mesmo sabendo que havia possibilidade de aumento do consumo e com crescimento exponencial da internações. Segundo a ação, o Ministério da Saúde tampouco cumpriu seu papel de determinar que o dimensionamento do consumo fosse feito.
""Todavia, o Ministro Eduardo Pazuello, o Secretário Hélio Angotti Neto, o Secretário Luiz Otávio Franco Duarte e a Secretária Mayra Pinheiro, mesmo após a ida de comitiva a Manaus em 3 de janeiro de 2021, omitiram-se em tomar as providências administrativas para verificar se havia o devido dimensionamento do consumo e da demanda futura de oxigênio medicinal no estado. Não tendo tomado essa providência básica, deixaram de promover a adequada orientação técnica dos servidores estaduais e não articularam com as empresas produtoras do insumo o fornecimento emergencial de maior volume"", diz o texto.
Kit intubação: Governo de SP diz que remédios para intubação podem acabar 'em poucos dias'
A equipe do ministro Eduardo Pazuello havia recebido um ofício da empresa no dia 8 de janeiro alertando sobre a insuficiência dos estoques de oxigênio, mas só se reuniu com a White Martins no dia 11. Três dias depois, a rede entrou em colapso, e pacientes passaram a morrer por falta de oxigênio.
Apesar dos alertas, em coletiva de imprensa em 18 de janeiro, o então ministro admitiu que foi informado pela White Martins sobre o problema, mas afirmou que a falta de oxigênio em Manaus foi uma ""surpresa"".
Leia também:  Pesquisadores defendem que Covid-19 seja classificada como febre viral trombótica
— No dia 8 de janeiro tivemos a compreensão a partir de uma carta de que poderia haver falta de O2 se não houvesse ações para mitigasse esse problema, mas aquela foi uma surpresa tanto para o governo do estado quanto para nós. até então o assunto oxigênio estava equilibrado pela própria empresa, mas a velocidade das internações foi muito grande — disse na ocasião.
Os procuradores também descobriram que, em meio ao colapso pela falta de oxigênio em Manaus, durante dois dias equipes do Ministério da Saúde fizeram um “tour” por 13 unidades básicas de saúde do município para falar sobre ""tratamento precoce"" contra a Covid-19 baseado em medicamentos sem comprovação científica no combate à doença como cloroquina e hidroxicloroquina.
Ao longo da ação, eles indicam que Pazuello permitiu ""campanha"" em favor do ""tratamento precoce"" e defendeu medidas sem eficácia comprovada. A acusação também é feita contra os secretários Mayra Pinheiro e Hélio Angotti Neto.
França: Premier francês fala do uso de cloroquina para Covid-19 no Brasil e arranca risadas de deputados; assista
""Como se vê, sem formação médica, o ex-Ministro, em pronunciamento amplamente divulgado, defendeu conduta médica reiteradamente questionada pela ciência como se fosse consensual, expôs visão confusa sobre a utilidade dos exames médicos, defendeu o uso de medicamentos com eficácia duvidosa independentemente dos exames e menosprezou os efeitos adversos possivelmente decorrentes dos remédios"", afirma o MPF.
Na ação, o MPF pede que Pazuello e os outros cinco réus sejam condenados eventuais ressarcimentos dos danos causados, perda de função pública, suspensão dos direitos políticos por até cinco anos e pagamento de multa.
O Globo, um jornal nacional: Fique por dentro da evolução do jornal mais lido do Brasil

Os comentários são de responsabilidade exclusiva de seus autores e não
representam a opinião deste site. Se achar algo que viole os termos de
uso, denuncie. Leia as perguntas mais frequentes para saber o que é
impróprio ou ilegal


© 1996 - 2021. Todos direitos reservados a Editora Globo S/A. Este material não pode ser publicado, transmitido por broadcast, reescrito ou redistribuído sem autorização.

"
