index;title;description;content;url;image;publishedAt;source;Texto
0;Imperial College: taxa de transmissão da Covid-19 no Brasil cai para 1,06, ainda considerada alta;"Cada 100 pessoas contaminadas transmitem a doença para outras 106; projeção é de aumento nas mortes nesta semana, segundo levantamento da universidade britânica";RIO — A taxa de transmissão (Rt) da Covid-19 no Brasil é de 1,06, de acordo com levantamento do Imperial College de Londres, divulgado nesta terça-feira. O índice representa uma queda em relação ao relatório divulgado na semana retrasada, quando o Rt... [2695 chars];https://oglobo.globo.com/sociedade/imperial-college-taxa-de-transmissao-da-covid-19-no-brasil-cai-para-106-ainda-considerada-alta-24957418;https://ogimg.infoglobo.com.br/in/24968378-d4a-115/FT1086A/bh.jpg;2021-04-13T13:02:00Z;O Globo;"RIO — A taxa de transmissão (Rt) da Covid-19 no Brasil é de 1,06, de acordo com levantamento do Imperial College de Londres, divulgado nesta terça-feira. O índice representa uma queda em relação ao relatório divulgado na semana retrasada, quando o Rt estava em 1,12, mas ainda é considerado alto. Na semana passada, o levantamento não foi divulgado.
RIO — A taxa de transmissão (Rt) da Covid-19 no Brasil é de 1,06, de acordo com levantamento do Imperial College de Londres, divulgado nesta terça-feira. O índice representa uma queda em relação ao relatório divulgado na semana retrasada, quando o Rt estava em 1,12, mas ainda é considerado alto. Na semana passada, o levantamento não foi divulgado.
A taxa de contágio acima de 1 indica que a doença avança sem controle no Brasil. Essa é uma das principais referências para acompanhar a evolução epidêmica do Sars-CoV-2 no país. Quando fica abaixo de 1, o índice indica tendência de desaceleração. O Rt atual significa que cada 100 pessoas contaminadas transmitem a doença para outras 106.
Brasil:  Levantamento alerta para escassez de oxigênio em 1.105 cidades
A universidade britânica também projeta que o Brasil deve registrar 23.100 mortes pela Covid-19 nesta semana, um aumento em relação à anterior, quando foram previstas 18.800 mortes pela doença. No pior quadro estimado, as perdas para o coronavírus podem chegar a 24.600.
Dentro da margem de erro calculada pelo Imperial College, o Rt brasileiro pode variar de 1 até 1,16.
Especialistas costumam ponderar que é preciso acompanhar a taxa de transmissão por um período prolongado de tempo para avaliar cenários, levando em conta o atraso nas notificações e o período de incubação do coronavírus, que chega a 14 dias. No Brasil, o Rt se mantém acima de 1 desde dezembro.
Por ser uma média nacional, o índice não significa que a doença está avançando ou retrocedendo da mesma forma em todas as cidades e estados do país.
Leia mais:  Rendesivir, único remédio aprovado para tratar Covid no Brasil, ainda não foi adotado no país
Estatísticas nacionais mostram altos números de casos e óbitos pela Covid-19 no país. Na segunda-feira, segundo o consórcio de veículos de imprensa, o Brasil registrou um novo recorde de média móvel de mortes por Covid-19: 3.124 óbitos. É o terceiro dia consecutivo que o índice está acima de 3 mil. O número é 15% maior que o notificado duas semanas atrás. O país contabilizou 1.726 mortes em 24h, elevando para 355.019 o total de vidas perdidas para o novo coronavírus. 
Desde 20h de domingo, 38.597 novos casos foram notificados pelas secretarias de saúde, totalizando 13.521.140 infectados pelo Sars-CoV-2. A média móvel foi de 71.136 diagnósticos positivos, 6% menor do que o cálculo de 14 dias atrás.
As maiores taxas de transmissão da Covid-19 da semana foram registradas no Irã (Rt 1,49), na Índia (Rt 1,47) e nos vizinhos Uruguai (Rt 1,42) e Argentina (Rt 1,37).
Já os menores índices foram identificados na Suécia (Rt 0,38), na Espanha (Rt 0,61), na Suíça (Rt 0,65) e na Dinamarca (Rt 0,75).
Estudo brasileiro:  Covid pode causar sérias lesões nos olhos
De acordo com o levantamento do Imperial College, o mundo registrou, até a segunda-feira, dia 29 de março, mais de 135 milhões de casos de Covid-19, e mais de 2,9 milhões de óbitos.
O Globo, um jornal nacional: Fique por dentro da evolução do jornal mais lido do Brasil

Os comentários são de responsabilidade exclusiva de seus autores e não
representam a opinião deste site. Se achar algo que viole os termos de
uso, denuncie. Leia as perguntas mais frequentes para saber o que é
impróprio ou ilegal


© 1996 - 2021. Todos direitos reservados a Editora Globo S/A. Este material não pode ser publicado, transmitido por broadcast, reescrito ou redistribuído sem autorização.

"
1;Live Coronavírus: químico Adriano Andricopulo fala sobre remédios para o tratamento da covid;"Pesquisador da USP é especialista em planejamento de fármacos e vai tirar dúvidas sobre medicamentos usados por pacientes infectados pelo coronavírus; transmissão ao vivo ocorrerá nesta terça, às 14h";SÃO PAULO - O Estadão entrevista ao vivo nesta terça-feira, 13, Adriano Andricopulo, químico medicinal e pesquisador do Instituto de Física da USP (câmpus São Carlos). A live será realizada a partir das 14 horas, com transmissão em quatro redes socia... [622 chars];https://saude.estadao.com.br/noticias/geral,live-coronavirus-quimico-adriano-andricopulo-fala-sobre-remedios-para-o-tratamento-da-covid,70003679311;https://img.estadao.com.br/resources/jpg/6/6/1598062981466.jpg;2021-04-13T13:00:49Z;Economia & Negócios Estadão;" 13 de abril de 2021 | 10h00 
 13 de abril de 2021 | 10h00 
 
SÃO PAULO - O Estadão entrevista ao vivo nesta terça-feira, 13, Adriano Andricopulo, químico medicinal e pesquisador do Instituto de Física da USP (câmpus São Carlos). A live será realizada a partir das 14 horas, com transmissão em quatro redes sociais do grupo: Facebook, Twitter, YouTube e LinkedIn. 
Com recorde na média móvel, Brasil registra 1.738 mortes por covid-19 nas últimas 24h

Andricopulo é especialista em planejamento de fármacos e medicamentos para combater a covid-19. A entrevista pretende tratar dos remédios que funcionam e não funcionam contra o coronavírus, explicar quais medicamentos estão em teste e quais são as expectativas de uso para os pacientes. 
Com duração de cerca de 30 minutos, a entrevista será conduzida por Mariana Hallal, repórter do Estadão. Depois, o vídeo também estará disponível para acesso nas redes sociais. O público poderá sugerir perguntas para o entrevistado por meio das seções de comentários nas plataformas. 
 
Encontrou algum erro? Entre em contato
Os comentários são exclusivos para assinantes do Estadão.
Institucional
Atendimento
Conexão Estadão
Hoje
Copyright © 1995 - 2021 Grupo Estado
O Estadão deixou de dar suporte ao Internet Explorer 9 ou anterior. Clique aqui e saiba mais.
"
2;Auxílio emergencial deve ir além de julho e estado de calamidade poderia voltar, dizem analistas;Recrudescimento da pandemia de Covid-19, demanda por novas medidas de enfrentamento à crise e falta de espaço orçamentário pressionam governo;"(Isac Nóbrega/PR)
SÃO PAULO – Diante do recrudescimento da pandemia do novo coronavírus no Brasil e das pressões por novas medidas de resposta à crise sanitária, o auxílio emergencial pode ir além dos quatro meses previstos pelo governo federal para ... [5615 chars]";https://www.infomoney.com.br/politica/auxilio-emergencial-deve-ir-alem-de-julho-e-estado-de-calamidade-poderia-voltar-dizem-analistas/;https://www.infomoney.com.br/wp-content/uploads/2020/09/2019_Visita_ao_Ministerio_da_Economia.jpg?fit=1536%2C1024&quality=70&strip=all;2021-04-13T12:56:35Z;InfoMoney;"

Entrar

Entrar

Entrar
Trabalhe no mercado financeiro
Imposto de Renda
Super Lives
Gestão Exponencial
Recrudescimento da pandemia de Covid-19, demanda por novas medidas de enfrentamento à crise e falta de espaço orçamentário pressionam governo
SÃO PAULO – Diante do recrudescimento da pandemia do novo coronavírus no Brasil e das pressões por novas medidas de resposta à crise sanitária, o auxílio emergencial pode ir além dos quatro meses previstos pelo governo federal para a nova fase em curso. Esta é a avaliação da maioria dos analistas políticos consultados na 25ª edição do Barômetro do Poder.
O levantamento, realizado entre os dias 6 e 8 de abril, mostra que a maioria dos especialistas consultados veem razoáveis chances de um novo estado de calamidade pública ser decretado para pôr em prática as iniciativas, em meio à indisponibilidade de recursos para os programas e no contexto de impasse envolvendo o Orçamento Geral da União de 2021.
Entre os analistas políticos ouvidos, 77% reputam chances elevadas de o auxílio emergencial sofrer uma nova prorrogação. Apenas 15% avaliam como baixa a probabilidade de o benefício ir além de julho.
Caso isso ocorra, a média das projeções apontam para pagamentos até dezembro deste ano. As estimativas, neste caso, variam de setembro de 2021 a dezembro de 2022. Clique aqui para acessar a íntegra do levantamento.

Esta edição do Barômetro do Poder contou com 13 participantes, sendo 9 casas de análise de risco político – BMJ Consultores Associados, Control Risks, Dharma Political Risk & Strategy, Empower Consultoria, MCM Consultores, Medley Global Advisors, Patri Políticas Públicas, Prospectiva Consultoria e Tendências Consultoria Integrada – e 4 analistas independentes – Antonio Lavareda (Ipespe), Carlos Melo (Insper), Claudio Couto (EAESP/FGV) e Thomas Traumann.
Conforme acordado previamente com os participantes, os resultados do levantamento são divulgados apenas de forma agregada, sendo preservado o anonimato das respostas e comentários.
O auxílio emergencial foi instituído em abril do ano passado, como o intuito de atender desempregados, trabalhadores informais e beneficiários de outros programas sociais durante a pandemia de Covid-19. O programa começou com parcelas de R$ 600 mensais (R$ 1.200 para as mães chefes de família).
Inicialmente projetado para durar três meses, a medida foi estendida para o total de cinco parcelas e, em setembro de 2020, sofreu nova prorrogação, com a redução das parcelas para R$ 300 mensais (R$ 600 para as mães chefes de família). Ao todo, mais de 60 milhões de brasileiros foram beneficiados e o impacto fiscal foi de pouco menos de R$ 300 bilhões.
A nova rodada do benefício consiste no pagamento de quatro parcelas, a partir de abril, com valores de R$ 150, R$ 250 ou R$ 375, dependendo da família. Ao todo, serão beneficiadas 45,6 milhões de pessoas. O impacto fiscal da iniciativa é estimado em R$ 43 bilhões, incluindo todos os custos operacionais.
Os recursos, previstos na Proposta de Emenda à Constituição (PEC) Emergencial, não estão sujeitos ao teto de gastos – regra constitucional que impede que as despesas do governo em um ano cresçam acima da inflação de 12 meses, medida pelo Índice de Preços ao Consumidor Amplo (IPCA), acumulada até junho do ano anterior.
O Barômetro do Poder também mostrou que 46% dos entrevistados veem alta probabilidade de o governo editar um novo decreto de estado de calamidade, em meio ao recrudescimento da pandemia e às pressões por novas medidas. O mecanismo poderia suspender limitações impostas pelo teto de gastos e pela meta de resultado primário de despesas para o enfrentamento à crise sanitária.
Em uma escala de 1 (muito baixa) a 5 (muito alta), a média atribuída para o uso do mesmo instrumento aplicado no ano passado ficou em 3,46. Apenas 8% dos analistas consultados veem baixa probabilidade de isso ocorrer.

Em meio ao impasse orçamentário e a necessidade de novos programas para enfrentar a nova onda da Covid-19 no país, o governo federal estuda enviar ao Congresso Nacional uma Proposta de Emenda à Constituição (PEC) abarcando uma série de gastos extraordinários, como o Benefício Emergencial, o Pronampe e despesas discricionárias na área da Saúde.
A ideia, ventilada pelo próprio Ministério da Economia, abriria espaço mais espaço no Orçamento de 2021 e evitaria a necessidade de cortes mais duros em emendas parlamentares – principal ponto de disputa da peça que aguarda apreciação do presidente Jair Bolsonaro (sem partido).
A discussão seria liberar cerca de R$ 35 bilhões de gastos fora do teto, sendo R$ 18 bilhões para obras, segundo reportagem do jornal O Estado de S.Paulo. Do restante, R$ 10 bilhões iriam para o programa que permite redução de jornada e salário ou suspensão de contrato de trabalhadores e R$ 7 bilhões para o programa de crédito para micro e pequenas empresas e uma autorização para gastos na área de saúde, relacionadas ao combate à pandemia, inclusive aquisição de vacinas, insumos e despesas relacionadas a campanhas de imunização.
Por se tratar de PEC, a proposta poderia sofrer modificações e ser ampliada pelo Congresso Nacional, e não seria submetida a controle posterior por parte do Poder Executivo, uma vez que vai à promulgação no próprio Legislativo logo após a aprovação.
O movimento já tem críticos nos bastidores, que o qualificaram como ação “fura teto” do chefe da equipe econômica, já que, ao incluir novas despesas fora da regra, esvazia o alcance da principal âncora fiscal do país.
Além disso, a tramitação longa deste tipo de proposição pode impor dificuldades adicionais, tendo em vista a urgência para a resolução do imbróglio orçamentário.
O Barômetro do Poder também mostra que 85% dos analistas políticos consultados veem elevada probabilidade de o teto de gastos ser descumprido ou flexibilizado ainda durante o governo Bolsonaro. Apenas 8% avaliam ser baixas as chances de isso acontecer. Em uma escala de 1 (muito baixa) a 5 (muito alta), a probabilidade média atribuída para fragilização da regra fiscal é elevada: 4,31.

© 2000-2021 InfoMoney. Todos os direitos reservados.
O InfoMoney preza a qualidade da informação e atesta a apuração de todo o conteúdo produzido por sua equipe, ressaltando, no entanto, que não faz qualquer tipo de recomendação de investimento, não se responsabilizando por perdas, danos (diretos, indiretos e incidentais), custos e lucros cessantes.
IMPORTANTE: O portal www.infomoney.com.br (o ""Portal"") é de propriedade da Infostocks Informações e Sistemas Ltda. (CNPJ/MF nº 03.082.929/0001-03) (""Infostocks""), sociedade controlada, indiretamente, pela XP Controle Participações S/A (CNPJ/MF nº 09.163.677/0001-15), sociedade holding que controla as empresas do XP Inc. O XP Inc tem em sua composição empresas que exercem atividades de: corretoras de valoresmobiliários, banco, seguradora, corretora de seguros, análise de investimentos de valores mobiliários, gestoras de recursos de terceiros. Apesar de as Sociedades XP estarem sob controle comum, os executivos responsáveis pela Infostocks são totalmente independentes e as notícias, matérias e opiniões veiculadas no Portal não são, sob qualquer aspecto, direcionadas e/ou influenciadas por relatórios de análise produzidos por áreas técnicas das empresas do XP Inc, nem por decisões comerciais e de negócio de tais sociedades, sendo produzidos de acordo com o juízo de valor e as convicções próprias da equipe interna da Infostocks.
                
                
"
3;Senadores maranhenses divergem sobre ampliar CPI da Covid-19 a estados e municípios;Representantes da bancada maranhense tem visões diferentes sobre a CPI para investigar ações e omissões do governo federal no enfrentamento da pandemia;O senador Roberto Rocha (PSDB-MA) apresentou nesta segunda-feira (12) requerimento no Congresso solicitando a constituição de uma Comissão Parlamentar Mista de Inquérito (CPMI) para apurar suposta malversação de recursos enviados pelo governo federal... [3317 chars];https://oimparcial.com.br/politica/2021/04/senadores-maranhenses-divergem-sobre-ampliar-cpi-da-covid-19-a-estados-e-municipios/;https://oimparcial.com.br/app/uploads/2021/03/COVID-19.jpg;2021-04-13T12:39:00Z;O Imparcial;"CORONAVÍRUS
CORONAVÍRUS
No Maranhão
 Foto: Reprodução
O senador Roberto Rocha (PSDB-MA) apresentou nesta segunda-feira (12) requerimento no Congresso solicitando a constituição de uma Comissão Parlamentar Mista de Inquérito (CPMI) para apurar suposta malversação de recursos enviados pelo governo federal aos Estados, Distrito Federal e municípios para o combate à pandemia da Covid-19.
Até o final da tarde já haviam sido registradas mais de 34 assinaturas, número suficiente para protocolar uma CPI abrangendo União, estados e municípios.
A leitura no Plenário do Senado do requerimento de criação da CPI da Covid-19 está prevista para esta terça-feira (13). O documento pede a criação de uma comissão parlamentar de inquérito para investigar ações e omissões do governo federal no enfrentamento da pandemia e no colapso da saúde no estado do Amazonas no começo do ano.
“Apresentei requerimento para a criação da Comissão Mista Parlamentar de Inquérito (CPMI) para apurar eventual malversação do emprego de recursos financeiros da União transferidos para os Estados, o Distrito Federal e os municípios, destinados ao enfrentamento da pandemia no país”, publicou Robeto Rocha em suas redes sociais.
O pedido de CPMI de Roberto Rocha foi feito justamente após o presidente Jair Bolsonaro (sem partido) ter uma conversa gravada e tornada pública na qual pressiona o senador Jorge Kajuru (Cidadania-DF) a incluir, mesmo sem ter poderes para tal, governadores e prefeitos no rol dos investigados pela CPI que o ministro do Supremo Tribunal Federal, Luis Roberto Barroso, mandou instalar para apurar omissões do governo no combate a pandemia.
Além de Roberto Rocha, outros senadores da federação estão propondo para que as investigações alcancem também os governos estaduais, distrital e municipais, o que pode ocorrer com a ampliação das investigações ou até com a criação de outra comissão.
Por meio de uma rede social, o governador do Maranhão, Flávio Dino (PCdoB), condenou a conversa mantida entre o presidente Jair Bolsonaro e o senador Jorge Kajuru sobre a Comissão Parlamentar de Inquérito (CPI) da Covid-19, que seria instalada com o objetivo investigar a atuação do governo do presidente Jair Bolsonaro diante da pandemia que já deixou mais de 340 mil mortes.
No diálogo, Bolsonaro pressiona pela mudança do objeto da CPI e pelo impeachment de ministros do Supremo Tribunal Federal (STF). 
“Mais uma vergonha. Presidente da República tramando perseguição contra ministro do Supremo. É o sujeito mais despreparado que já ocupou a presidência na história do Brasil”, escreveu o governador em seu perfil no Twitter.
Questionada sobre a criação ou ampliação da CPI da Covid-19 para apurar suposta malversação de recursos enviados pelo governo federal aos estados, distrito federal e municípios, a senadora Eliziane Gama (Cidadania-MA), ressaltou que se faz necessário manter o foco na CPI já requerida e não de uma que ainda vai ser criada.
“O Senado precisa manter o foco na CPI já requerida, a ser instalada pelo presidente Pacheco. O foco do Senado Federal é investigação federal, é isso que diz a Constituição. Caso surjam denúncias que comprometam estados e municípios serão investigadas também. Precisamos de fatos determinados. Acredito que essa é uma compreensão que não é apenas minha, mas de vários outros senadores. Dessa forma, o entendimento de consulta que o presidente Senado está fazendo deverá resultar em uma resposta dessa natureza”, avaliou Eliziane Gama (Cidadania-MA).
 A equipe de O Imparcial tentou falar com o senador Weverton Rocha (PDT-MA), mas até o fechamento desta edição não obteve retorno.
Conteúdo exclusivo. Direto na sua caixa de entrada.
Não perca a oportunidade de garantir a sua vaga de emprego
Ainda existem diversas curiosidades que cercam os filmes, que é desconhecida pelo público, sobre criação, desenvolvimento e sobre coisas que poucas pessoas perceberam ao assistir.
"
