index;title;description;content;url;image;publishedAt;source;Texto
0;Incertezas assombrarão todos os cem dias até a Olimpíada de Tóquio;Realização dos Jogos na pandemia faz com quem ninguém saiba ao certo o que encontrará no Japão;"São Paulo
Há mais de um ano, quando a pandemia de Covid-19 virou ameaça à realização dos Jogos Olímpicos de Tóquio em sua programação original, o evento passou a ser indissociável da palavra “incerteza”.
É assim até hoje, a cem dias da remarcada data... [4840 chars]";https://www1.folha.uol.com.br/esporte/2021/04/incertezas-assombrarao-todos-os-cem-dias-ate-a-olimpiada-de-toquio.shtml;https://f.i.uol.com.br/fotografia/2021/04/13/16183385346075e2e6151f9_1618338534_3x2_xl.jpg;2021-04-14T02:15:00Z;Folha de S.Paulo;"
      Acesse seus artigos salvos em 
Minha Folha,  sua área personalizada
    

      Acesse seus artigos salvos em 
Minha Folha,  sua área personalizada
    

Recurso exclusivo para assinantes

assine
ou
faça login

Assinantes podem liberar 5 acessos por dia para conteúdos da Folha
Assinantes podem liberar 5 acessos por dia para conteúdos da Folha
Assinantes podem liberar 5 acessos por dia para conteúdos da Folha
Gostaria de receber as principais notícias do Brasil e do mundo?

        Contextualiza um acontecimento e aprofunda a compreensão de seus diversos ângulos
      
Recurso exclusivo para assinantes

assine
ou
faça login

Assinantes podem liberar 5 acessos por dia para conteúdos da Folha
Assinantes podem liberar 5 acessos por dia para conteúdos da Folha
Assinantes podem liberar 5 acessos por dia para conteúdos da Folha
Há mais de um ano, quando a pandemia de Covid-19 virou ameaça à realização dos Jogos Olímpicos de Tóquio em sua programação original, o evento passou a ser indissociável da palavra “incerteza”.
É assim até hoje, a cem dias da remarcada data para sua cerimônia de abertura. E assim será até que a chama olímpica entre no Estádio Nacional da capital japonesa, em 23 de julho, para inaugurar os Jogos da 32ª Olimpíada.
Mas isso realmente acontecerá? É o que o mundo do esporte se pergunta durante todo esse tempo. Ainda que o COI (Comitê Olímpico Internacional) e o comitê organizador banquem que sim, muitos só acreditarão quando de fato se concretizar.





A desconfiança não é sem motivo. Nem a Olimpíada reconhecidamente mais bem-planejada de todos os tempos pôde prever a devastação causada pelo coronavírus.
Apesar de grandes competições esportivas terem sido realizadas desde o segundo semestre de 2020 —com maior ou menor sucesso no controle do vírus—, nenhuma pode ser comparada a uma edição dos Jogos em grandeza e complexidade.
Serão cerca de 11 mil atletas (sem contar a Paraolimpíada) de aproximadamente 200 países, além de treinadores, demais membros das delegações, jornalistas, viajando por um mundo em que a tendência é o fechamento de fronteiras, não a livre circulação.
Torcedores e voluntários que vivem fora do Japão já foram barrados, e a presença de público nas arenas permanece como dúvida.





O país de 126 milhões de habitantes registrou 508 mil casos de Covid e 9.393 mortes em decorrência da doença até esta terça-feira (13).
Anteriormente, havia a expectativa de que, em determinado momento deste ano, a batida de um martelo cravasse definitivamente a realização do megaevento, eliminando as dúvidas e permitindo que todos se planejassem para os Jogos em seu novo cenário, qualquer que fosse.
Isso não aconteceu, nem deve acontecer. O discurso do COI e do comitê organizador sustenta que a realização da Olimpíada está garantida desde a sua remarcação e que a discussão sempre foi sobre como fazê-la, não se seria feita.
O início do revezamento da tocha pelas 47 províncias japonesas, em 25 de março, foi o maior “agora vai” até o momento, mas, logo na sequência, o adiamento de competições-teste e o cancelamento da passagem da chama pelas ruas de Osaka —teve que circular por um parque fechado, justo na marca dos cem dias— soou como deboche: “vai mesmo?”.
Milhares de atletas pelo mundo querem se apresentar no principal palco do esporte, ainda que isso signifique riscos à saúde e que, para muitos, o rotineiro ato de treinar tenha se transformado em suplício desde o início de 2020.
Mas o desejo dos protagonistas do espetáculo não é o fator preponderante. O clamor real vem dos bilhões de dólares relacionados aos direitos de TV, principal fonte de receita do COI, e dos patrocinadores.
No Japão, onde pesquisas apontam que cerca de 70% da população rejeita a realização dos Jogos em 2021, houve divergências na decisão de levá-los adiante, com declarações contraditórias entre membros do governo.
Prevaleceu, porém, a decisão de manter o contrato com o comitê internacional e garantir sua fatia do bolo, após gastos de cerca de US$ 15,4 bilhões na organização —US$ 2,8 bilhões são extras, em decorrência do adiamento.
Se foi o melhor caminho, não será possível responder antes do fim da Paraolimpíada, em 5 de setembro.





Até lá, não haverá dias sem que as tais incertezas assombrem os Jogos em todos os seus níveis. Apesar de os primeiros guias de regras sanitárias para os participantes terem sido lançados em fevereiro, por enquanto o exercício de imaginar como será o dia a dia no Japão durante o evento é missão quase impossível entre atletas, técnicos, dirigentes e jornalistas. Cada um trabalha com as informações que possui e segue em frente, tateando no escuro.
Alguns assuntos mencionados pelas autoridades olímpicas nas últimos meses carecem de informações concretas. Por exemplo, a intenção de receber vacinas da China, anunciada pelo COI em março com o objetivo de proteger atletas e sobre a qual pouco se soube desde então.
As informações oficiais indicam que não será obrigatório estar vacinado para competir, devido ao ritmo discrepante da imunização entre os países. O próprio Japão só aplicou doses em profissionais de saúde até o momento.





Há ainda infindáveis questões na esfera esportiva a serem respondidas: como um teste positivo de coronavírus impactará os esportes coletivos ou membros de uma delegação que treinaram com a pessoa infectada? As grandes estrelas olímpicas receberão o mesmo tratamento disciplinar em caso de descumprimento de protocolos? Países mais afetados pela Covid-19, como o Brasil, sofrerão restrições mais duras na chegada ao Japão?
Muitas outras dúvidas povoam a cabeça dos milhares de envolvidos nos Jogos. Mas elas não serão eliminadas tão cedo. Pelo contrário, dominarão o noticiário olímpico até o evento e ao longo dele, tanto quanto as medalhas e as grandes histórias de costume.
Recurso exclusivo para assinantes

assine
ou
faça login

Assinantes podem liberar 5 acessos por dia para conteúdos da Folha
Assinantes podem liberar 5 acessos por dia para conteúdos da Folha
Assinantes podem liberar 5 acessos por dia para conteúdos da Folha

      Você já conhece as vantagens de ser assinante da Folha?
      Além de ter acesso a reportagens e colunas, você conta com newsletters exclusivas (conheça aqui).
      Também pode baixar nosso aplicativo gratuito na Apple Store ou na Google Play para receber alertas das principais notícias do dia.
      A sua assinatura nos ajuda a fazer um jornalismo independente e de qualidade. Obrigado!
    

      Mais de 180 reportagens e análises publicadas a cada dia. Um time com mais de 120 colunistas. Um jornalismo profissional que fiscaliza o poder público, veicula notícias proveitosas e inspiradoras, faz contraponto à intolerância das redes sociais e traça uma linha clara entre verdade e mentira. Quanto custa ajudar a produzir esse conteúdo?
    

Os comentários não representam a opinião do jornal; a responsabilidade é do autor da mensagem.

Carregando...

            Queda foi de 98% para 85% nas últimas duas semanas, e instituições já retomam as cirurgias eletivas
          

            Magistrado do DF diz que Judiciário não pode obrigar Executivo a adotar via específica contra a pandemia
          

            Benefícios, no entanto, são maiores que riscos e agência regulatória recomenda o uso; comitê de vacinação orienta que seja ofertada outra vacina para menores de 30 anos
          


Copyright Folha de S.Paulo. Todos os direitos reservados. É proibida a reprodução do conteúdo desta página em qualquer meio de comunicação, eletrônico ou impresso, sem autorização escrita da Folhapress.

Cadastro realizado com sucesso!
Por favor, tente mais tarde!
"
1;Rio tinha muitos problemas a cem dias da Olimpíada, mas não uma pandemia;Cinco anos depois, Tóquio chega à mesma marca tentando garantir os Jogos;"São Paulo
A cem dias do início dos Jogos Olímpicos, as obras de algumas das principais instalações ainda não estão prontas. O país vive um dos seus piores ciclos de recessão e grave crise política, com a presidente em meio a um processo de impeachmen... [5016 chars]";https://www1.folha.uol.com.br/esporte/2021/04/rio-tinha-muitos-problemas-a-cem-dias-da-olimpiada-mas-nao-uma-pandemia.shtml;https://f.i.uol.com.br/fotografia/2021/04/13/16183252176075aee1b81d9_1618325217_3x2_rt.jpg;2021-04-13T15:00:00Z;Folha de S.Paulo;"
      Acesse seus artigos salvos em 
Minha Folha,  sua área personalizada
    

      Acesse seus artigos salvos em 
Minha Folha,  sua área personalizada
    

Recurso exclusivo para assinantes

assine
ou
faça login

Assinantes podem liberar 5 acessos por dia para conteúdos da Folha
Assinantes podem liberar 5 acessos por dia para conteúdos da Folha
Assinantes podem liberar 5 acessos por dia para conteúdos da Folha
Gostaria de receber as principais notícias do Brasil e do mundo?
Recurso exclusivo para assinantes

assine
ou
faça login

Assinantes podem liberar 5 acessos por dia para conteúdos da Folha
Assinantes podem liberar 5 acessos por dia para conteúdos da Folha
Assinantes podem liberar 5 acessos por dia para conteúdos da Folha
A cem dias do início dos Jogos Olímpicos, as obras de algumas das principais instalações ainda não estão prontas. O país vive um dos seus piores ciclos de recessão e grave crise política, com a presidente em meio a um processo de impeachment. Para piorar, uma epidemia é a justificativa de alguns atletas para desistir do maior evento esportivo do planeta.
Em abril de 2016, esse era o cenário do Brasil e do Rio de Janeiro, às vésperas de receber a Olimpíada.
A situação do Japão e de sua capital é bem diferente no mesmo marco da contagem regressiva para os Jogos de Tóquio-2020, mas o cenário tornou-se mais incerto do que há cinco anos por conta de um problema que os japoneses não puderam prever nos preparativos: a pandemia de Covid-19.





Com quase tudo pronto antes de o coronavírus se espalhar pelo mundo, os japoneses estavam orgulhosos do ritmo de construção das oito arenas, dez locais temporários de competição e reformas nas 25 instalações já existentes.
O presidente do COI (Comitê Olímpico Internacional), Thomas Bach, definiu a cidade japonesa como sede mais bem preparada de todos os tempos.
Esse nível de organização será ainda mais fundamental na tentativa de garantir a realização da Olimpíada após seu adiamento em um ano, em meio à crise sanitária mundial e às medidas restritivas necessárias para conter a proliferação do vírus.
A última nova obra entregue, do Centro Aquático, foi concluída em março de 2020, alguns dias antes de o COI (Comitê Olímpico Internacional) anunciar o adiamento do evento.





A cem dias dos Jogos do Rio, a organização corria para concluir a Arena Carioca 2, que ficaria pronta em maio, e o Velódromo. Este último foi entregue a quase um mês da cerimônia de abertura, realizada no dia 5 de agosto.
A cidade sofria com quedas no fornecimento de energia elétrica e as novas arenas já eram alvos de críticas por confederações de outros países após participarem de eventos-teste.
""Estão deixando a desejar em detalhes muito importantes em cada arena"", disse, na ocasião, Francesco Ricci Bitti, presidente da Associação Internacional das Federações Olímpicas (ASOIF, na sigla em inglês) durante entrevista coletiva na Suíça.
Um dos principais legados da Olimpíada na capital fluminense, a construção da linha 4 do metrô também havia se tornado uma dor de cabeça enquanto o Tribunal de Justiça do Rio de Janeiro determinava, no dia 25 de abril, o bloqueio de R$ 661 milhões das contas do estado para pagar aposentados e pensionistas.
Uma semana antes, a Câmara do Deputados aprovara a abertura do processo de impeachment da presidente Dilma Rousseff (PT).
Ainda em abril, outra avalanche para a imagem do Brasil foi o desabamento de trecho suspenso sobre o mar da ciclovia Tim Maia, na avenida Niemeyer, que deixou dois mortos. Com custo de R$ 44,7 milhões, a obra havia sido inaugurada em janeiro.





Em fevereiro, a Organização Mundial de Saúde (OMS) declarou estado de emergência de saúde internacional diante da zika e complicações relacionadas ao vírus. Transmitido pelo mosquito Aedes aegypti, a doença pode causar microcefalia em bebês de mães infectadas durante a gravidez, além de outros problemas neurológicos em crianças e adultos.
Epicentro da epidemia, o Brasil contabilizou, entre 2015 e 2016, 12,7 mil notificações de casos de crianças cujo desenvolvimento pode ter sido afetado pelo vírus, de acordo com o Ministério da Saúde.
O epidemiologista Eduardo Massad calculou a chance de se pegar zika durante a Olimpíada: 3 casos para cada 100 mil habitantes. O COI recomendou às delegações que viajariam para o Brasil o uso de repelente e camisas e calças compridas.
Claramente nada que possa ser comparado ao impacto da pandemia de Covid-19 no Brasil, com 13,5 milhões de casos até esta segunda-feira (12), e no mundo, com 137 milhões.
“O Aedes não está em todos os países. A chance de um arbovírus [vírus transmitido por um artrópode] causar uma pandemia é quase zero”, afirmou Helder Nakaya, professor da Faculdade de Ciências Farmacêuticas da USP, em março do ano passado, quando o coronavírus ainda virava uma ameaça olímpica.
Até agora, a Coreia do Norte já comunicou que não irá aos Jogos de Tóquio. Oficialmente, por causa da pandemia de Covid-19, mas devido ao contexto político a ação tem sido entendida como um boicote.
No Rio, alguns atletas desistiram do evento alegando preocupação com o vírus da zika. Entre eles, os principais golfistas e alguns tenistas de destaque, como a romena Simona Halep, o canadense Milos Raonic e o tcheco Tomas Berdych, além da melhor dupla da história, os irmãos americanos Bob e Mike Bryan.
Carlos Arthur Nuzman, então presidente do comitê organizador, disse que os golfistas desistiram de vir porque não há premiação em dinheiro no torneio olímpico. A modalidade estava fora do calendário desde os Jogos de 1904, em Saint Louis (EUA).
Num passado recente no qual pouco se falava de negacionismo no Brasil, o velocista jamaicano Usain Bolt, questionado se viria para o Brasil apesar da zika, disse: “Sou rápido. Eles [mosquitos] não conseguem me pegar”.
Apesar da instabilidade e de todas as preocupações, a Olimpíada do Rio entregou um evento sem grandes percalços do ponto de vista da organização. Tóquio, bem preparada e com um inimigo invisível, espera dizer o mesmo nos próximos meses.
Recurso exclusivo para assinantes

assine
ou
faça login

Assinantes podem liberar 5 acessos por dia para conteúdos da Folha
Assinantes podem liberar 5 acessos por dia para conteúdos da Folha
Assinantes podem liberar 5 acessos por dia para conteúdos da Folha

      Você já conhece as vantagens de ser assinante da Folha?
      Além de ter acesso a reportagens e colunas, você conta com newsletters exclusivas (conheça aqui).
      Também pode baixar nosso aplicativo gratuito na Apple Store ou na Google Play para receber alertas das principais notícias do dia.
      A sua assinatura nos ajuda a fazer um jornalismo independente e de qualidade. Obrigado!
    

      Mais de 180 reportagens e análises publicadas a cada dia. Um time com mais de 120 colunistas. Um jornalismo profissional que fiscaliza o poder público, veicula notícias proveitosas e inspiradoras, faz contraponto à intolerância das redes sociais e traça uma linha clara entre verdade e mentira. Quanto custa ajudar a produzir esse conteúdo?
    

Os comentários não representam a opinião do jornal; a responsabilidade é do autor da mensagem.

Carregando...

            Queda foi de 98% para 85% nas últimas duas semanas, e instituições já retomam as cirurgias eletivas
          

            Magistrado do DF diz que Judiciário não pode obrigar Executivo a adotar via específica contra a pandemia
          

            Benefícios, no entanto, são maiores que riscos e agência regulatória recomenda o uso; comitê de vacinação orienta que seja ofertada outra vacina para menores de 30 anos
          


Copyright Folha de S.Paulo. Todos os direitos reservados. É proibida a reprodução do conteúdo desta página em qualquer meio de comunicação, eletrônico ou impresso, sem autorização escrita da Folhapress.

Cadastro realizado com sucesso!
Por favor, tente mais tarde!
"
2;Tóquio-2020: Por Covid, Brasil cogita não ir à Cerimônia de Abertura da Olimpíada;Na avaliação do COB, a festa no Estádio Nacional do Japão pode ser um risco para a saúde dos atletas que, uma vez positivados, perdem o evento;Mesmo a apenas 100 dias para a Olimpíada de Tóquio, marca que será comemorada nesta quarta-feira, há ainda muitas dúvidas de como a competição será realizada em plena pandemia do novo coronavírus. Desde como serão finalizados os classificatórios até ... [3017 chars];https://oglobo.globo.com/esportes/toquio-2020-por-covid-brasil-cogita-nao-ir-cerimonia-de-abertura-da-olimpiada-24968273;https://ogimg.infoglobo.com.br/in/24968265-37e-a09/FT1086A/60331987_ESP-05-08-2016Rio-2016Festa-de-abertura-das-Olimpiadas-2016-no-Maracana.-Foto-Pedro.jpg;2021-04-13T12:13:00Z;O Globo;"Mesmo a apenas 100 dias para a Olimpíada de Tóquio, marca que será comemorada nesta quarta-feira, há ainda muitas dúvidas de como a competição será realizada em plena pandemia do novo coronavírus. Desde como serão finalizados os classificatórios até como serão os procedimentos com atletas positivados para a Covid-19 em plena competição. A Cerimônia de Abertura está marcada para o dia 23 de julho e há resistência por parte de várias delegações de comparecerem à festa no Estádio Nacional do Japão. O Brasil cogita não levar seus atletas ao evento de inauguração.
Mesmo a apenas 100 dias para a Olimpíada de Tóquio, marca que será comemorada nesta quarta-feira, há ainda muitas dúvidas de como a competição será realizada em plena pandemia do novo coronavírus. Desde como serão finalizados os classificatórios até como serão os procedimentos com atletas positivados para a Covid-19 em plena competição. A Cerimônia de Abertura está marcada para o dia 23 de julho e há resistência por parte de várias delegações de comparecerem à festa no Estádio Nacional do Japão. O Brasil cogita não levar seus atletas ao evento de inauguração.
— Nós ainda estamos recebendo informações do Comitê Olímpico Internacional e do Comitê Organizador dos Jogos sobre o desfile no cenário atual. Faltam informações que permitam uma avaliação das condições de segurança para os atletas, mas é fato que nós não vamos expor os atletas e oficiais a uma situação que possamos identificar como sendo de risco — declarou Jorge Bichara, diretor de Esportes do COB.
Drible: Confederações perdem repasses federais por causa de reeleições infinitas
Embora o COI tenha dito repetidas vezes que a vacinação contra a Covid-19 não será obrigatória para os atletas, afirmou que ofertaria imunizantes doados pela China para vacinação até junho. Uma vez positivados, os atletas deverão cumprir dez dias de quarentena (o evento dura apenas duas semanas) em um hotel com cerca de 300 quartos, que deverá ser reservado para esta finalidade.
Segundo a entidade, essa iniciativa ""é mais um marco na garantia da segurança dos Jogos Olímpicos e Paralímpicos. São a nossa demonstração de solidariedade para com o povo japonês, pelo qual temos muito respeito e por quem temos grande consideração""
Eles já estão vacinados: Atletas brasileiros começam a ser vacinados no exterior; veja o que contam
Depois de protestos e matérias jornalísticas veiculadas no Japão sobre o que consideram ""prioridade na vacinação de atletas"", Nobuhiko Okabe, consultor de saúde do comitê organizador, disse que as vacinas devem estar disponíveis para os atletas que as desejarem.
Pare ele, as escolhas de atletas individuais de recusar a vacina por motivos de saúde ou religiosos ""devem ser respeitadas"".
A insatisfação ocorre porque o processo de vacinação para a população local está lento e atletas do Japão seriam tratados como “prioridade”.
— Acho que a recomendação deve ser a imunização, principalmente para os atletas — disse Okabe à Reuters, que já ocupou cargos de liderança na Organização Mundial da Saúde e hoje aconselha o governo local em relação à Covid-19.
Tamayo Marukawa, a ministra do Japão para os Jogos Olímpicos e Paralímpicos, negou que os atletas japoneses receberão algum tipo de prioridade. 
Jogos de Tóquio:boicote da Coreia do Norte é ruim para as negociações de paz
O COB anunciar que diminuirá sua delegação que vai ao Jogos. Três programas foram cancelados (Embaixadores e Vivência Olímpica, para ex-atletas e jovens atletas, e Família Olímpica, dos presidentes das confederações).
Com isso, o contingente de enviados ao Japão deve diminuir em 100 pessoas.
O COB também anunciou a diminuição da presença de diretores da entidade.
'Estou moída': Dores no joelho cobram o preço e Thaisa dá adeus à seleção brasileira de vôlei
A decisão comunicada aos presidentes de confederações, em reuniçao online, foi aceita com tranquilidade.
Um dos mais antigos e influentes dirigentes do esporte olímpico brasileiro, João Tomasini, da canoagem, morreu vítima do coronavírus.
Eleições no Hipismo: Justiça determina que voto da federação do Rio seja considerado válido
O Time Brasil, formado pelos atletas, comissões técnicas e médicas, terá entre cartolas somente o presidente Paulo Wanderley, o CEO Rogério Sampaio, e o  vice-presidente Marco La Porta como chefe de missão.
O Globo, um jornal nacional: Fique por dentro da evolução do jornal mais lido do Brasil

Os comentários são de responsabilidade exclusiva de seus autores e não
representam a opinião deste site. Se achar algo que viole os termos de
uso, denuncie. Leia as perguntas mais frequentes para saber o que é
impróprio ou ilegal


© 1996 - 2021. Todos direitos reservados a Editora Globo S/A. Este material não pode ser publicado, transmitido por broadcast, reescrito ou redistribuído sem autorização.

"
